[I 2024-12-15 12:33:26,859] A new study created in memory with name: no-name-639be7e5-65e0-4ddf-80a9-011069437c84
[I 2024-12-15 12:33:26,968] Trial 0 finished with value: 0.43778110944527737 and parameters: {'boosting_type': 'gbdt', 'num_leaves': 34, 'learning_rate': 0.3621455053476378, 'n_estimators': 142, 'max_depth': 1, 'subsample': 0.8874781925871538, 'colsample_bytree': 0.9707469520047491, 'reg_alpha': 0.8732420652718763, 'reg_lambda': 0.9142132749759853}. Best is trial 0 with value: 0.43778110944527737.
[I 2024-12-15 12:33:27,830] Trial 1 finished with value: 0.3853073463268366 and parameters: {'boosting_type': 'gbdt', 'num_leaves': 213, 'learning_rate': 0.31701754407112326, 'n_estimators': 945, 'max_depth': 6, 'subsample': 0.5244019191049367, 'colsample_bytree': 0.8960540746882808, 'reg_alpha': 0.9965946217770814, 'reg_lambda': 0.3892613737976163}. Best is trial 1 with value: 0.3853073463268366.
[I 2024-12-15 12:33:29,364] Trial 2 finished with value: 0.4197901049475262 and parameters: {'boosting_type': 'goss', 'num_leaves': 65, 'learning_rate': 0.23580072062139906, 'n_estimators': 505, 'max_depth': 8, 'subsample': 0.5251880803961961, 'colsample_bytree': 0.6434133977816338, 'reg_alpha': 0.7818238983597737, 'reg_lambda': 0.9283636434832948}. Best is trial 1 with value: 0.3853073463268366.
[I 2024-12-15 12:33:32,110] Trial 3 finished with value: 0.4362818590704648 and parameters: {'boosting_type': 'goss', 'num_leaves': 118, 'learning_rate': 0.21498775931284625, 'n_estimators': 756, 'max_depth': 10, 'subsample': 0.5392019851258321, 'colsample_bytree': 0.9860766744511785, 'reg_alpha': 0.2684132931834814, 'reg_lambda': 0.13131735904100816}. Best is trial 1 with value: 0.3853073463268366.
[I 2024-12-15 12:33:32,334] Trial 4 finished with value: 0.39730134932533734 and parameters: {'boosting_type': 'gbdt', 'num_leaves': 232, 'learning_rate': 0.27910326835983573, 'n_estimators': 230, 'max_depth': 2, 'subsample': 0.8837174879553107, 'colsample_bytree': 0.6326730019542848, 'reg_alpha': 0.7581669697023716, 'reg_lambda': 0.6008942964092806}. Best is trial 1 with value: 0.3853073463268366.
[I 2024-12-15 12:33:33,471] Trial 5 finished with value: 0.3928035982008995 and parameters: {'boosting_type': 'gbdt', 'num_leaves': 180, 'learning_rate': 0.18948652120291617, 'n_estimators': 605, 'max_depth': 6, 'subsample': 0.9816270289021873, 'colsample_bytree': 0.7046624786332917, 'reg_alpha': 0.6194909198198042, 'reg_lambda': 0.5292331118743054}. Best is trial 1 with value: 0.3853073463268366.
[I 2024-12-15 12:33:34,601] Trial 6 finished with value: 0.41079460269865065 and parameters: {'boosting_type': 'goss', 'num_leaves': 46, 'learning_rate': 0.03804312164083856, 'n_estimators': 896, 'max_depth': 3, 'subsample': 0.8156872698575024, 'colsample_bytree': 0.7771135610689572, 'reg_alpha': 0.48084235259883856, 'reg_lambda': 0.10847937856505385}. Best is trial 1 with value: 0.3853073463268366.
[I 2024-12-15 12:33:38,866] Trial 7 finished with value: 0.3868065967016492 and parameters: {'boosting_type': 'dart', 'num_leaves': 16, 'learning_rate': 0.3835306414739897, 'n_estimators': 878, 'max_depth': 3, 'subsample': 0.6634300367398158, 'colsample_bytree': 0.9245111731318475, 'reg_alpha': 0.9102266869740793, 'reg_lambda': 0.5824766394960916}. Best is trial 1 with value: 0.3853073463268366.
[I 2024-12-15 12:33:41,987] Trial 8 finished with value: 0.3853073463268366 and parameters: {'boosting_type': 'dart', 'num_leaves': 43, 'learning_rate': 0.35464743410163363, 'n_estimators': 706, 'max_depth': 3, 'subsample': 0.9280616873769715, 'colsample_bytree': 0.9898944204670884, 'reg_alpha': 0.4761642126377429, 'reg_lambda': 0.48056302263581185}. Best is trial 1 with value: 0.3853073463268366.
[I 2024-12-15 12:33:42,659] Trial 9 finished with value: 0.3793103448275862 and parameters: {'boosting_type': 'gbdt', 'num_leaves': 20, 'learning_rate': 0.3793347829653519, 'n_estimators': 635, 'max_depth': 3, 'subsample': 0.5834121961684628, 'colsample_bytree': 0.6176514685556515, 'reg_alpha': 0.8522537961297414, 'reg_lambda': 0.2357310761725998}. Best is trial 9 with value: 0.3793103448275862.
[I 2024-12-15 12:33:43,889] Trial 10 finished with value: 0.40179910044977507 and parameters: {'boosting_type': 'gbdt', 'num_leaves': 108, 'learning_rate': 0.4887410966847011, 'n_estimators': 407, 'max_depth': -1, 'subsample': 0.6759394749591583, 'colsample_bytree': 0.5137206494684522, 'reg_alpha': 0.08012153646638565, 'reg_lambda': 0.2685024546055227}. Best is trial 9 with value: 0.3793103448275862.
[I 2024-12-15 12:33:44,710] Trial 11 finished with value: 0.39730134932533734 and parameters: {'boosting_type': 'gbdt', 'num_leaves': 239, 'learning_rate': 0.4832927914710592, 'n_estimators': 997, 'max_depth': 6, 'subsample': 0.6166568265330102, 'colsample_bytree': 0.825218172491012, 'reg_alpha': 0.9601868972617036, 'reg_lambda': 0.33683978563806594}. Best is trial 9 with value: 0.3793103448275862.
[I 2024-12-15 12:33:45,323] Trial 12 finished with value: 0.3868065967016492 and parameters: {'boosting_type': 'gbdt', 'num_leaves': 160, 'learning_rate': 0.309505645311073, 'n_estimators': 436, 'max_depth': 5, 'subsample': 0.5042191781929835, 'colsample_bytree': 0.877513961109591, 'reg_alpha': 0.9984473820428338, 'reg_lambda': 0.33525651573369886}. Best is trial 9 with value: 0.3793103448275862.
[I 2024-12-15 12:33:46,997] Trial 13 finished with value: 0.38980509745127434 and parameters: {'boosting_type': 'gbdt', 'num_leaves': 190, 'learning_rate': 0.11768091982100887, 'n_estimators': 710, 'max_depth': 7, 'subsample': 0.6184103079863803, 'colsample_bytree': 0.523442443393402, 'reg_alpha': 0.6796800127297646, 'reg_lambda': 0.7593733395895627}. Best is trial 9 with value: 0.3793103448275862.
[I 2024-12-15 12:33:47,526] Trial 14 finished with value: 0.39730134932533734 and parameters: {'boosting_type': 'gbdt', 'num_leaves': 87, 'learning_rate': 0.4194526398737932, 'n_estimators': 294, 'max_depth': 9, 'subsample': 0.7434644330164355, 'colsample_bytree': 0.609471851062617, 'reg_alpha': 0.7968987148700332, 'reg_lambda': 0.04338844636190614}. Best is trial 9 with value: 0.3793103448275862.
[I 2024-12-15 12:33:47,682] Trial 15 finished with value: 0.3928035982008995 and parameters: {'boosting_type': 'dart', 'num_leaves': 151, 'learning_rate': 0.43776770676257215, 'n_estimators': 39, 'max_depth': 5, 'subsample': 0.5786884849557646, 'colsample_bytree': 0.7289456440957008, 'reg_alpha': 0.5740443696995341, 'reg_lambda': 0.2333742641633596}. Best is trial 9 with value: 0.3793103448275862.
[I 2024-12-15 12:33:48,793] Trial 16 finished with value: 0.4002998500749625 and parameters: {'boosting_type': 'gbdt', 'num_leaves': 216, 'learning_rate': 0.312436770859229, 'n_estimators': 600, 'max_depth': 0, 'subsample': 0.7334865802325878, 'colsample_bytree': 0.8841360211874604, 'reg_alpha': 0.3280128546877789, 'reg_lambda': 0.4276500866466899}. Best is trial 9 with value: 0.3793103448275862.
[I 2024-12-15 12:33:50,017] Trial 17 finished with value: 0.3778110944527736 and parameters: {'boosting_type': 'gbdt', 'num_leaves': 206, 'learning_rate': 0.15978143792918034, 'n_estimators': 989, 'max_depth': 4, 'subsample': 0.5778381612302699, 'colsample_bytree': 0.7982446829683254, 'reg_alpha': 0.8596614020923696, 'reg_lambda': 0.1978831985606485}. Best is trial 17 with value: 0.3778110944527736.
[I 2024-12-15 12:33:53,156] Trial 18 finished with value: 0.38980509745127434 and parameters: {'boosting_type': 'dart', 'num_leaves': 5, 'learning_rate': 0.14701780098311187, 'n_estimators': 788, 'max_depth': 4, 'subsample': 0.6959302111187927, 'colsample_bytree': 0.7793170025794062, 'reg_alpha': 0.7183007093922242, 'reg_lambda': 0.20169477990296045}. Best is trial 17 with value: 0.3778110944527736.
[I 2024-12-15 12:33:53,739] Trial 19 finished with value: 0.40929535232383807 and parameters: {'boosting_type': 'goss', 'num_leaves': 89, 'learning_rate': 0.148149410225413, 'n_estimators': 610, 'max_depth': 2, 'subsample': 0.6002649419886754, 'colsample_bytree': 0.5727086160415711, 'reg_alpha': 0.8543257579836164, 'reg_lambda': 0.034294977253789605}. Best is trial 17 with value: 0.3778110944527736.
[I 2024-12-15 12:33:54,304] Trial 20 finished with value: 0.4422788605697151 and parameters: {'boosting_type': 'gbdt', 'num_leaves': 256, 'learning_rate': 0.041816072442648844, 'n_estimators': 833, 'max_depth': 1, 'subsample': 0.8011569503784642, 'colsample_bytree': 0.6845045122451561, 'reg_alpha': 0.38604533963990817, 'reg_lambda': 0.20589577788044874}. Best is trial 17 with value: 0.3778110944527736.
[I 2024-12-15 12:33:55,230] Trial 21 finished with value: 0.3718140929535232 and parameters: {'boosting_type': 'gbdt', 'num_leaves': 206, 'learning_rate': 0.28999594172639215, 'n_estimators': 993, 'max_depth': 4, 'subsample': 0.5630979856660805, 'colsample_bytree': 0.8351166528124307, 'reg_alpha': 0.9888987306172682, 'reg_lambda': 0.37492356108277847}. Best is trial 21 with value: 0.3718140929535232.
[I 2024-12-15 12:33:56,192] Trial 22 finished with value: 0.3853073463268366 and parameters: {'boosting_type': 'gbdt', 'num_leaves': 185, 'learning_rate': 0.26684362401770423, 'n_estimators': 991, 'max_depth': 4, 'subsample': 0.5742807175170695, 'colsample_bytree': 0.8253938011265306, 'reg_alpha': 0.8711391654531949, 'reg_lambda': 0.3118929220282257}. Best is trial 21 with value: 0.3718140929535232.
[I 2024-12-15 12:33:57,895] Trial 23 finished with value: 0.38980509745127434 and parameters: {'boosting_type': 'gbdt', 'num_leaves': 145, 'learning_rate': 0.10396027282918294, 'n_estimators': 896, 'max_depth': 4, 'subsample': 0.6430659754819712, 'colsample_bytree': 0.822829122198018, 'reg_alpha': 0.6285334688656932, 'reg_lambda': 0.12619581182529882}. Best is trial 21 with value: 0.3718140929535232.
[I 2024-12-15 12:33:58,716] Trial 24 finished with value: 0.3853073463268366 and parameters: {'boosting_type': 'gbdt', 'num_leaves': 205, 'learning_rate': 0.1907209691999902, 'n_estimators': 813, 'max_depth': 2, 'subsample': 0.5622764364456574, 'colsample_bytree': 0.7674973040225596, 'reg_alpha': 0.9037915487508776, 'reg_lambda': 0.6946193510766756}. Best is trial 21 with value: 0.3718140929535232.
[I 2024-12-15 12:33:59,440] Trial 25 finished with value: 0.39580209895052476 and parameters: {'boosting_type': 'gbdt', 'num_leaves': 165, 'learning_rate': 0.41416179266114217, 'n_estimators': 664, 'max_depth': 5, 'subsample': 0.7129871538880921, 'colsample_bytree': 0.6719467793181214, 'reg_alpha': 0.8078510117209492, 'reg_lambda': 0.4312096120798675}. Best is trial 21 with value: 0.3718140929535232.
[I 2024-12-15 12:34:00,120] Trial 26 finished with value: 0.40179910044977507 and parameters: {'boosting_type': 'gbdt', 'num_leaves': 132, 'learning_rate': 0.07991799734389604, 'n_estimators': 488, 'max_depth': 3, 'subsample': 0.6370647402987474, 'colsample_bytree': 0.7414003040643583, 'reg_alpha': 0.029324561939958693, 'reg_lambda': 0.19092496804787137}. Best is trial 21 with value: 0.3718140929535232.
[I 2024-12-15 12:34:00,754] Trial 27 finished with value: 0.40929535232383807 and parameters: {'boosting_type': 'gbdt', 'num_leaves': 238, 'learning_rate': 0.2452283155174787, 'n_estimators': 925, 'max_depth': 1, 'subsample': 0.7791563786553419, 'colsample_bytree': 0.8401392811251726, 'reg_alpha': 0.9343114830328924, 'reg_lambda': 0.28534358935710286}. Best is trial 21 with value: 0.3718140929535232.
[I 2024-12-15 12:34:02,211] Trial 28 finished with value: 0.4302848575712144 and parameters: {'boosting_type': 'goss', 'num_leaves': 201, 'learning_rate': 0.291796925112144, 'n_estimators': 825, 'max_depth': 4, 'subsample': 0.5563405678678968, 'colsample_bytree': 0.5787312895669463, 'reg_alpha': 0.7107117416779414, 'reg_lambda': 0.3747490242586441}. Best is trial 21 with value: 0.3718140929535232.
[I 2024-12-15 12:34:05,220] Trial 29 finished with value: 0.3868065967016492 and parameters: {'boosting_type': 'dart', 'num_leaves': 172, 'learning_rate': 0.34214301635978533, 'n_estimators': 361, 'max_depth': 7, 'subsample': 0.6009978263939595, 'colsample_bytree': 0.9558488850879764, 'reg_alpha': 0.8246681281591673, 'reg_lambda': 0.09757004487540136}. Best is trial 21 with value: 0.3718140929535232.
[I 2024-12-15 12:34:06,277] Trial 30 finished with value: 0.4152923538230885 and parameters: {'boosting_type': 'gbdt', 'num_leaves': 70, 'learning_rate': 0.3668382590009049, 'n_estimators': 200, 'max_depth': 0, 'subsample': 0.5070487189375806, 'colsample_bytree': 0.7949462268961991, 'reg_alpha': 0.2000478602595146, 'reg_lambda': 0.8245722816560713}. Best is trial 21 with value: 0.3718140929535232.
[I 2024-12-15 12:34:07,183] Trial 31 finished with value: 0.3793103448275862 and parameters: {'boosting_type': 'gbdt', 'num_leaves': 202, 'learning_rate': 0.3129455520156815, 'n_estimators': 975, 'max_depth': 6, 'subsample': 0.5314229927213062, 'colsample_bytree': 0.8849539584422641, 'reg_alpha': 0.9947515396898046, 'reg_lambda': 0.36035134490191173}. Best is trial 21 with value: 0.3718140929535232.
[I 2024-12-15 12:34:08,054] Trial 32 finished with value: 0.3793103448275862 and parameters: {'boosting_type': 'gbdt', 'num_leaves': 196, 'learning_rate': 0.328775013501063, 'n_estimators': 967, 'max_depth': 5, 'subsample': 0.5486014321317514, 'colsample_bytree': 0.8603985870947924, 'reg_alpha': 0.9976538326792725, 'reg_lambda': 0.4717326767093838}. Best is trial 21 with value: 0.3718140929535232.
[I 2024-12-15 12:34:08,879] Trial 33 finished with value: 0.40479760119940034 and parameters: {'boosting_type': 'gbdt', 'num_leaves': 219, 'learning_rate': 0.38824804063807833, 'n_estimators': 875, 'max_depth': 7, 'subsample': 0.579537622079458, 'colsample_bytree': 0.9355825436086251, 'reg_alpha': 0.9290705270670183, 'reg_lambda': 0.40278140858127665}. Best is trial 21 with value: 0.3718140929535232.
[I 2024-12-15 12:34:09,981] Trial 34 finished with value: 0.3868065967016492 and parameters: {'boosting_type': 'gbdt', 'num_leaves': 224, 'learning_rate': 0.21738448268411859, 'n_estimators': 931, 'max_depth': 6, 'subsample': 0.5316323793847992, 'colsample_bytree': 0.9213260622467363, 'reg_alpha': 0.8586921281682668, 'reg_lambda': 0.2616200070014595}. Best is trial 21 with value: 0.3718140929535232.
[I 2024-12-15 12:34:11,072] Trial 35 finished with value: 0.39580209895052476 and parameters: {'boosting_type': 'gbdt', 'num_leaves': 252, 'learning_rate': 0.2587938950917324, 'n_estimators': 999, 'max_depth': 8, 'subsample': 0.5266174499572489, 'colsample_bytree': 0.799841282054264, 'reg_alpha': 0.7636797121338943, 'reg_lambda': 0.15857748780934572}. Best is trial 21 with value: 0.3718140929535232.
[I 2024-12-15 12:34:12,489] Trial 36 finished with value: 0.4497751124437781 and parameters: {'boosting_type': 'goss', 'num_leaves': 117, 'learning_rate': 0.2967091659749853, 'n_estimators': 545, 'max_depth': 6, 'subsample': 0.6467704275306004, 'colsample_bytree': 0.8636762572908148, 'reg_alpha': 0.9511868018588904, 'reg_lambda': 0.986530231371115}. Best is trial 21 with value: 0.3718140929535232.
[I 2024-12-15 12:34:13,279] Trial 37 finished with value: 0.38980509745127434 and parameters: {'boosting_type': 'gbdt', 'num_leaves': 178, 'learning_rate': 0.1984432969803805, 'n_estimators': 753, 'max_depth': 2, 'subsample': 0.5963105825861907, 'colsample_bytree': 0.9041448674881891, 'reg_alpha': 0.8866049367669228, 'reg_lambda': 0.576016365442174}. Best is trial 21 with value: 0.3718140929535232.
[I 2024-12-15 12:34:14,267] Trial 38 finished with value: 0.38230884557721134 and parameters: {'boosting_type': 'gbdt', 'num_leaves': 210, 'learning_rate': 0.2353613403782628, 'n_estimators': 934, 'max_depth': 3, 'subsample': 0.5026889999185618, 'colsample_bytree': 0.7154432078743835, 'reg_alpha': 0.9593852845371765, 'reg_lambda': 0.3707458791094532}. Best is trial 21 with value: 0.3718140929535232.
[I 2024-12-15 12:34:15,689] Trial 39 finished with value: 0.3943028485757122 and parameters: {'boosting_type': 'gbdt', 'num_leaves': 138, 'learning_rate': 0.16522012330625171, 'n_estimators': 877, 'max_depth': 4, 'subsample': 0.8729663438132399, 'colsample_bytree': 0.7567014576274563, 'reg_alpha': 0.5604271988217299, 'reg_lambda': 0.5011962462764886}. Best is trial 21 with value: 0.3718140929535232.
[I 2024-12-15 12:34:17,808] Trial 40 finished with value: 0.4227886056971514 and parameters: {'boosting_type': 'goss', 'num_leaves': 33, 'learning_rate': 0.37954093800761235, 'n_estimators': 749, 'max_depth': 10, 'subsample': 0.5464916564311562, 'colsample_bytree': 0.8528742581159603, 'reg_alpha': 0.7554991036765479, 'reg_lambda': 0.06510925578325938}. Best is trial 21 with value: 0.3718140929535232.
[I 2024-12-15 12:34:18,680] Trial 41 finished with value: 0.3928035982008995 and parameters: {'boosting_type': 'gbdt', 'num_leaves': 195, 'learning_rate': 0.3338313329028615, 'n_estimators': 961, 'max_depth': 5, 'subsample': 0.5482882387848076, 'colsample_bytree': 0.7995090039431467, 'reg_alpha': 0.9856268309650461, 'reg_lambda': 0.4634188755461978}. Best is trial 21 with value: 0.3718140929535232.
[I 2024-12-15 12:34:19,562] Trial 42 finished with value: 0.38080959520239877 and parameters: {'boosting_type': 'gbdt', 'num_leaves': 230, 'learning_rate': 0.32965409125604106, 'n_estimators': 945, 'max_depth': 5, 'subsample': 0.531298601538508, 'colsample_bytree': 0.9006381992748851, 'reg_alpha': 0.9907440108115045, 'reg_lambda': 0.33984794543235075}. Best is trial 21 with value: 0.3718140929535232.
[I 2024-12-15 12:34:20,482] Trial 43 finished with value: 0.3793103448275862 and parameters: {'boosting_type': 'gbdt', 'num_leaves': 200, 'learning_rate': 0.28079387028936575, 'n_estimators': 851, 'max_depth': 3, 'subsample': 0.6207886455791574, 'colsample_bytree': 0.8579786056597253, 'reg_alpha': 0.9101077920977354, 'reg_lambda': 0.6488365547043843}. Best is trial 21 with value: 0.3718140929535232.
[I 2024-12-15 12:34:21,354] Trial 44 finished with value: 0.4062968515742129 and parameters: {'boosting_type': 'gbdt', 'num_leaves': 166, 'learning_rate': 0.4548468310440783, 'n_estimators': 965, 'max_depth': 6, 'subsample': 0.6729121328897458, 'colsample_bytree': 0.9537661852856323, 'reg_alpha': 0.8439077441782077, 'reg_lambda': 0.5290727930362705}. Best is trial 21 with value: 0.3718140929535232.
[I 2024-12-15 12:34:22,248] Trial 45 finished with value: 0.4002998500749625 and parameters: {'boosting_type': 'gbdt', 'num_leaves': 180, 'learning_rate': 0.3653790356302853, 'n_estimators': 909, 'max_depth': 8, 'subsample': 0.587256077027736, 'colsample_bytree': 0.8329278647748087, 'reg_alpha': 0.9072969636604546, 'reg_lambda': 0.25279465867268214}. Best is trial 21 with value: 0.3718140929535232.
[I 2024-12-15 12:34:30,358] Trial 46 finished with value: 0.3793103448275862 and parameters: {'boosting_type': 'dart', 'num_leaves': 247, 'learning_rate': 0.39298371263410653, 'n_estimators': 999, 'max_depth': 5, 'subsample': 0.5624470076728841, 'colsample_bytree': 0.8763340586666035, 'reg_alpha': 0.9905131605073827, 'reg_lambda': 0.31259765848879095}. Best is trial 21 with value: 0.3718140929535232.
[I 2024-12-15 12:34:31,162] Trial 47 finished with value: 0.38080959520239877 and parameters: {'boosting_type': 'gbdt', 'num_leaves': 155, 'learning_rate': 0.3156225888995394, 'n_estimators': 687, 'max_depth': 4, 'subsample': 0.5181467196743842, 'colsample_bytree': 0.6358449987604732, 'reg_alpha': 0.8149289335391999, 'reg_lambda': 0.4530322989839769}. Best is trial 21 with value: 0.3718140929535232.
[I 2024-12-15 12:34:31,966] Trial 48 finished with value: 0.40179910044977507 and parameters: {'boosting_type': 'gbdt', 'num_leaves': 192, 'learning_rate': 0.34906904102314956, 'n_estimators': 798, 'max_depth': 7, 'subsample': 0.6159121612350195, 'colsample_bytree': 0.8074839521149616, 'reg_alpha': 0.953815253058952, 'reg_lambda': 0.17182117004725705}. Best is trial 21 with value: 0.3718140929535232.
[I 2024-12-15 12:34:32,855] Trial 49 finished with value: 0.3868065967016492 and parameters: {'boosting_type': 'gbdt', 'num_leaves': 210, 'learning_rate': 0.2719247317842413, 'n_estimators': 859, 'max_depth': 2, 'subsample': 0.5523655627241921, 'colsample_bytree': 0.9113079613422878, 'reg_alpha': 0.8777329125507778, 'reg_lambda': 0.005749154320984773}. Best is trial 21 with value: 0.3718140929535232.
[I 2024-12-15 12:34:37,493] Trial 50 finished with value: 0.38830584707646176 and parameters: {'boosting_type': 'dart', 'num_leaves': 98, 'learning_rate': 0.22278791816504379, 'n_estimators': 959, 'max_depth': 3, 'subsample': 0.6557697700868966, 'colsample_bytree': 0.536533599777764, 'reg_alpha': 0.655870615236177, 'reg_lambda': 0.5517240414306325}. Best is trial 21 with value: 0.3718140929535232.
[I 2024-12-15 12:34:38,390] Trial 51 finished with value: 0.38830584707646176 and parameters: {'boosting_type': 'gbdt', 'num_leaves': 226, 'learning_rate': 0.28858664607574397, 'n_estimators': 844, 'max_depth': 3, 'subsample': 0.6229523134852651, 'colsample_bytree': 0.8562816575751859, 'reg_alpha': 0.9228683131559012, 'reg_lambda': 0.6384571741159257}. Best is trial 21 with value: 0.3718140929535232.
[I 2024-12-15 12:34:39,282] Trial 52 finished with value: 0.3778110944527736 and parameters: {'boosting_type': 'gbdt', 'num_leaves': 199, 'learning_rate': 0.3082396147421996, 'n_estimators': 904, 'max_depth': 4, 'subsample': 0.573877376751585, 'colsample_bytree': 0.8797089447568648, 'reg_alpha': 0.9044023478571324, 'reg_lambda': 0.6716161035951145}. Best is trial 21 with value: 0.3718140929535232.
[I 2024-12-15 12:34:40,136] Trial 53 finished with value: 0.3868065967016492 and parameters: {'boosting_type': 'gbdt', 'num_leaves': 60, 'learning_rate': 0.31156338226457725, 'n_estimators': 900, 'max_depth': 5, 'subsample': 0.572760328551039, 'colsample_bytree': 0.8812250050344198, 'reg_alpha': 0.9968416666660254, 'reg_lambda': 0.8698464702720471}. Best is trial 21 with value: 0.3718140929535232.
