[I 2024-12-15 12:34:40,986] Trial 54 finished with value: 0.38980509745127434 and parameters: {'boosting_type': 'gbdt', 'num_leaves': 186, 'learning_rate': 0.40959309280202294, 'n_estimators': 957, 'max_depth': 4, 'subsample': 0.5972676317925715, 'colsample_bytree': 0.779627210131325, 'reg_alpha': 0.7821038260635842, 'reg_lambda': 0.49748476760500815}. Best is trial 21 with value: 0.3718140929535232.
[I 2024-12-15 12:34:42,248] Trial 55 finished with value: 0.40179910044977507 and parameters: {'boosting_type': 'gbdt', 'num_leaves': 237, 'learning_rate': 0.25055464620874957, 'n_estimators': 784, 'max_depth': 4, 'subsample': 0.691368816482895, 'colsample_bytree': 0.8885758732047373, 'reg_alpha': 0.42183114477322436, 'reg_lambda': 0.7325906283007956}. Best is trial 21 with value: 0.3718140929535232.
[I 2024-12-15 12:34:44,717] Trial 56 finished with value: 0.43928035982008995 and parameters: {'boosting_type': 'goss', 'num_leaves': 216, 'learning_rate': 0.33047552037553196, 'n_estimators': 1000, 'max_depth': 6, 'subsample': 0.527512254237743, 'colsample_bytree': 0.8183255247085497, 'reg_alpha': 0.7303539556671422, 'reg_lambda': 0.4083523549710323}. Best is trial 21 with value: 0.3718140929535232.
[I 2024-12-15 12:34:45,669] Trial 57 finished with value: 0.3928035982008995 and parameters: {'boosting_type': 'gbdt', 'num_leaves': 23, 'learning_rate': 0.29707376028514826, 'n_estimators': 911, 'max_depth': 5, 'subsample': 0.5409351808875834, 'colsample_bytree': 0.975646360642374, 'reg_alpha': 0.8331202877748706, 'reg_lambda': 0.22385180512880848}. Best is trial 21 with value: 0.3718140929535232.
[I 2024-12-15 12:34:46,460] Trial 58 finished with value: 0.39730134932533734 and parameters: {'boosting_type': 'gbdt', 'num_leaves': 204, 'learning_rate': 0.4391962715771762, 'n_estimators': 883, 'max_depth': 4, 'subsample': 0.8407416527424945, 'colsample_bytree': 0.8374042575175069, 'reg_alpha': 0.8795565141338666, 'reg_lambda': 0.2951016972135899}. Best is trial 21 with value: 0.3718140929535232.
[I 2024-12-15 12:34:47,189] Trial 59 finished with value: 0.3928035982008995 and parameters: {'boosting_type': 'gbdt', 'num_leaves': 176, 'learning_rate': 0.3217653157744577, 'n_estimators': 631, 'max_depth': 6, 'subsample': 0.9681246628659738, 'colsample_bytree': 0.6581344542545777, 'reg_alpha': 0.954574062828812, 'reg_lambda': 0.15251164353711122}. Best is trial 21 with value: 0.3718140929535232.
[I 2024-12-15 12:34:48,626] Trial 60 finished with value: 0.38380809595202403 and parameters: {'boosting_type': 'dart', 'num_leaves': 243, 'learning_rate': 0.3739805365511546, 'n_estimators': 521, 'max_depth': 2, 'subsample': 0.5687983960269289, 'colsample_bytree': 0.9378854774005985, 'reg_alpha': 0.20660666428566454, 'reg_lambda': 0.3557704526289265}. Best is trial 21 with value: 0.3718140929535232.
[I 2024-12-15 12:34:49,532] Trial 61 finished with value: 0.38080959520239877 and parameters: {'boosting_type': 'gbdt', 'num_leaves': 195, 'learning_rate': 0.2820188593778923, 'n_estimators': 842, 'max_depth': 3, 'subsample': 0.6274658203247274, 'colsample_bytree': 0.8683766410307177, 'reg_alpha': 0.9036492253812014, 'reg_lambda': 0.6372421055279452}. Best is trial 21 with value: 0.3718140929535232.
[I 2024-12-15 12:34:50,299] Trial 62 finished with value: 0.38080959520239877 and parameters: {'boosting_type': 'gbdt', 'num_leaves': 205, 'learning_rate': 0.35229414145362326, 'n_estimators': 725, 'max_depth': 3, 'subsample': 0.6085703902403253, 'colsample_bytree': 0.8478372189286799, 'reg_alpha': 0.9259185670941615, 'reg_lambda': 0.6258404456323681}. Best is trial 21 with value: 0.3718140929535232.
[I 2024-12-15 12:34:51,229] Trial 63 finished with value: 0.38980509745127434 and parameters: {'boosting_type': 'gbdt', 'num_leaves': 198, 'learning_rate': 0.2777546680036503, 'n_estimators': 971, 'max_depth': 3, 'subsample': 0.5818356848134728, 'colsample_bytree': 0.6085595636025312, 'reg_alpha': 0.9667184212756486, 'reg_lambda': 0.6746821289338761}. Best is trial 21 with value: 0.3718140929535232.
[I 2024-12-15 12:34:52,195] Trial 64 finished with value: 0.3703148425787106 and parameters: {'boosting_type': 'gbdt', 'num_leaves': 188, 'learning_rate': 0.2624557281038274, 'n_estimators': 932, 'max_depth': 4, 'subsample': 0.5170915367741554, 'colsample_bytree': 0.8955716557829018, 'reg_alpha': 0.8546135234000511, 'reg_lambda': 0.7293410585636038}. Best is trial 64 with value: 0.3703148425787106.
[I 2024-12-15 12:34:53,426] Trial 65 finished with value: 0.38230884557721134 and parameters: {'boosting_type': 'gbdt', 'num_leaves': 217, 'learning_rate': 0.17110560866433927, 'n_estimators': 926, 'max_depth': 5, 'subsample': 0.5147097455714879, 'colsample_bytree': 0.8937592780493924, 'reg_alpha': 0.8485040286076844, 'reg_lambda': 0.8046942484017856}. Best is trial 64 with value: 0.3703148425787106.
[I 2024-12-15 12:34:53,605] Trial 66 finished with value: 0.39730134932533734 and parameters: {'boosting_type': 'gbdt', 'num_leaves': 167, 'learning_rate': 0.23659444688697695, 'n_estimators': 66, 'max_depth': 4, 'subsample': 0.5019995916713611, 'colsample_bytree': 0.9220198241434184, 'reg_alpha': 0.6868366249355194, 'reg_lambda': 0.744339454059599}. Best is trial 64 with value: 0.3703148425787106.
[I 2024-12-15 12:34:54,269] Trial 67 finished with value: 0.3928035982008995 and parameters: {'boosting_type': 'gbdt', 'num_leaves': 184, 'learning_rate': 0.06141485393729523, 'n_estimators': 320, 'max_depth': 4, 'subsample': 0.5610245175324899, 'colsample_bytree': 0.736746360668156, 'reg_alpha': 0.791824301127414, 'reg_lambda': 0.43226638245523}. Best is trial 64 with value: 0.3703148425787106.
[I 2024-12-15 12:34:55,468] Trial 68 finished with value: 0.41679160419790107 and parameters: {'boosting_type': 'goss', 'num_leaves': 189, 'learning_rate': 0.30921466392147, 'n_estimators': 450, 'max_depth': 6, 'subsample': 0.5361318453152397, 'colsample_bytree': 0.8146105970332865, 'reg_alpha': 0.9394658950788766, 'reg_lambda': 0.2352983580720075}. Best is trial 64 with value: 0.3703148425787106.
[I 2024-12-15 12:34:58,088] Trial 69 finished with value: 0.3868065967016492 and parameters: {'boosting_type': 'gbdt', 'num_leaves': 225, 'learning_rate': 0.010032354904409096, 'n_estimators': 978, 'max_depth': 5, 'subsample': 0.5886661546224758, 'colsample_bytree': 0.7713867527072014, 'reg_alpha': 0.874944948668311, 'reg_lambda': 0.6995466843603115}. Best is trial 64 with value: 0.3703148425787106.
[I 2024-12-15 12:34:59,159] Trial 70 finished with value: 0.38980509745127434 and parameters: {'boosting_type': 'gbdt', 'num_leaves': 153, 'learning_rate': 0.2638148898712483, 'n_estimators': 943, 'max_depth': 7, 'subsample': 0.5167299914853467, 'colsample_bytree': 0.6966752289604643, 'reg_alpha': 0.7457759030870815, 'reg_lambda': 0.5950129047024367}. Best is trial 64 with value: 0.3703148425787106.
[I 2024-12-15 12:35:00,089] Trial 71 finished with value: 0.3853073463268366 and parameters: {'boosting_type': 'gbdt', 'num_leaves': 211, 'learning_rate': 0.3043237182297442, 'n_estimators': 927, 'max_depth': 3, 'subsample': 0.551406103953701, 'colsample_bytree': 0.8659901313970356, 'reg_alpha': 0.9002024294038229, 'reg_lambda': 0.8289129975297648}. Best is trial 64 with value: 0.3703148425787106.
[I 2024-12-15 12:35:00,694] Trial 72 finished with value: 0.4152923538230885 and parameters: {'boosting_type': 'gbdt', 'num_leaves': 2, 'learning_rate': 0.20592194196158464, 'n_estimators': 873, 'max_depth': 2, 'subsample': 0.5711392376830482, 'colsample_bytree': 0.8488190164398215, 'reg_alpha': 0.9725891120611809, 'reg_lambda': 0.39659009786633975}. Best is trial 64 with value: 0.3703148425787106.
[I 2024-12-15 12:35:01,539] Trial 73 finished with value: 0.38080959520239877 and parameters: {'boosting_type': 'gbdt', 'num_leaves': 200, 'learning_rate': 0.33746134051600435, 'n_estimators': 822, 'max_depth': 4, 'subsample': 0.6081393682552441, 'colsample_bytree': 0.9123343194390725, 'reg_alpha': 0.9253408582561176, 'reg_lambda': 0.780661225216728}. Best is trial 64 with value: 0.3703148425787106.
[I 2024-12-15 12:35:02,540] Trial 74 finished with value: 0.37481259370314846 and parameters: {'boosting_type': 'gbdt', 'num_leaves': 220, 'learning_rate': 0.25831970675259874, 'n_estimators': 895, 'max_depth': 5, 'subsample': 0.6347533727266287, 'colsample_bytree': 0.7836214866598279, 'reg_alpha': 0.855698413523749, 'reg_lambda': 0.6609612386635787}. Best is trial 64 with value: 0.3703148425787106.
[I 2024-12-15 12:35:03,600] Trial 75 finished with value: 0.38230884557721134 and parameters: {'boosting_type': 'gbdt', 'num_leaves': 234, 'learning_rate': 0.2356803595629155, 'n_estimators': 904, 'max_depth': 5, 'subsample': 0.7671941587396867, 'colsample_bytree': 0.7880631059822332, 'reg_alpha': 0.8118052935456254, 'reg_lambda': 0.7092458538013305}. Best is trial 64 with value: 0.3703148425787106.
[I 2024-12-15 12:35:04,608] Trial 76 finished with value: 0.3793103448275862 and parameters: {'boosting_type': 'gbdt', 'num_leaves': 218, 'learning_rate': 0.2546943839253277, 'n_estimators': 976, 'max_depth': 6, 'subsample': 0.5408153245769158, 'colsample_bytree': 0.7534955084612209, 'reg_alpha': 0.864836336596428, 'reg_lambda': 0.5265258866808893}. Best is trial 64 with value: 0.3703148425787106.
[I 2024-12-15 12:35:05,268] Trial 77 finished with value: 0.38230884557721134 and parameters: {'boosting_type': 'gbdt', 'num_leaves': 121, 'learning_rate': 0.35979033057854504, 'n_estimators': 557, 'max_depth': 5, 'subsample': 0.6350185729950396, 'colsample_bytree': 0.8285540702615121, 'reg_alpha': 0.9993442583181212, 'reg_lambda': 0.6723451157812347}. Best is trial 64 with value: 0.3703148425787106.
[I 2024-12-15 12:35:10,031] Trial 78 finished with value: 0.38980509745127434 and parameters: {'boosting_type': 'dart', 'num_leaves': 171, 'learning_rate': 0.3231889179215358, 'n_estimators': 768, 'max_depth': 4, 'subsample': 0.5861309696496474, 'colsample_bytree': 0.9381617373545068, 'reg_alpha': 0.8421541066973215, 'reg_lambda': 0.3290663069489301}. Best is trial 64 with value: 0.3703148425787106.
[I 2024-12-15 12:35:11,696] Trial 79 finished with value: 0.3853073463268366 and parameters: {'boosting_type': 'gbdt', 'num_leaves': 208, 'learning_rate': 0.10349522548035303, 'n_estimators': 899, 'max_depth': 4, 'subsample': 0.555082023218918, 'colsample_bytree': 0.8793973893071952, 'reg_alpha': 0.7801984284722705, 'reg_lambda': 0.5690288728119178}. Best is trial 64 with value: 0.3703148425787106.
[I 2024-12-15 12:35:13,722] Trial 80 finished with value: 0.4197901049475262 and parameters: {'boosting_type': 'goss', 'num_leaves': 222, 'learning_rate': 0.29980955602132836, 'n_estimators': 937, 'max_depth': 5, 'subsample': 0.5208444803660212, 'colsample_bytree': 0.8064444562946772, 'reg_alpha': 0.9649135530687901, 'reg_lambda': 0.11490393298364336}. Best is trial 64 with value: 0.3703148425787106.
[I 2024-12-15 12:35:14,675] Trial 81 finished with value: 0.38080959520239877 and parameters: {'boosting_type': 'gbdt', 'num_leaves': 191, 'learning_rate': 0.27118165778566233, 'n_estimators': 852, 'max_depth': 3, 'subsample': 0.655240515621455, 'colsample_bytree': 0.8633035090151143, 'reg_alpha': 0.8907537446525391, 'reg_lambda': 0.6618661139006646}. Best is trial 64 with value: 0.3703148425787106.
[I 2024-12-15 12:35:15,634] Trial 82 finished with value: 0.3793103448275862 and parameters: {'boosting_type': 'gbdt', 'num_leaves': 182, 'learning_rate': 0.28150000942585696, 'n_estimators': 977, 'max_depth': 4, 'subsample': 0.6029669238521173, 'colsample_bytree': 0.8393435527736718, 'reg_alpha': 0.9328386849270343, 'reg_lambda': 0.6188605103778863}. Best is trial 64 with value: 0.3703148425787106.
[I 2024-12-15 12:35:16,559] Trial 83 finished with value: 0.38380809595202403 and parameters: {'boosting_type': 'gbdt', 'num_leaves': 200, 'learning_rate': 0.2448953768031088, 'n_estimators': 863, 'max_depth': 3, 'subsample': 0.5701328531494098, 'colsample_bytree': 0.5022969054770192, 'reg_alpha': 0.9158593672102594, 'reg_lambda': 0.2803788799419409}. Best is trial 64 with value: 0.3703148425787106.
[I 2024-12-15 12:35:17,575] Trial 84 finished with value: 0.38380809595202403 and parameters: {'boosting_type': 'gbdt', 'num_leaves': 230, 'learning_rate': 0.2883970117895696, 'n_estimators': 942, 'max_depth': 3, 'subsample': 0.7240300212801529, 'colsample_bytree': 0.9039324919754328, 'reg_alpha': 0.8161832603742125, 'reg_lambda': 0.7712217531549211}. Best is trial 64 with value: 0.3703148425787106.
[I 2024-12-15 12:35:18,787] Trial 85 finished with value: 0.3853073463268366 and parameters: {'boosting_type': 'gbdt', 'num_leaves': 211, 'learning_rate': 0.221618473986731, 'n_estimators': 886, 'max_depth': 5, 'subsample': 0.6201377240502048, 'colsample_bytree': 0.7915090010855381, 'reg_alpha': 0.5828708193960415, 'reg_lambda': 0.48739879209048964}. Best is trial 64 with value: 0.3703148425787106.
[I 2024-12-15 12:35:19,689] Trial 86 finished with value: 0.38230884557721134 and parameters: {'boosting_type': 'gbdt', 'num_leaves': 194, 'learning_rate': 0.34548417892329747, 'n_estimators': 1000, 'max_depth': 4, 'subsample': 0.5914140572329133, 'colsample_bytree': 0.816961180460196, 'reg_alpha': 0.9481230954898281, 'reg_lambda': 0.7195267360250696}. Best is trial 64 with value: 0.3703148425787106.
[I 2024-12-15 12:35:20,482] Trial 87 finished with value: 0.38080959520239877 and parameters: {'boosting_type': 'gbdt', 'num_leaves': 145, 'learning_rate': 0.3938480279788972, 'n_estimators': 826, 'max_depth': 4, 'subsample': 0.5348369040384875, 'colsample_bytree': 0.7252217976368364, 'reg_alpha': 0.8618987736744059, 'reg_lambda': 0.4540773667499714}. Best is trial 64 with value: 0.3703148425787106.
[I 2024-12-15 12:35:21,308] Trial 88 finished with value: 0.38080959520239877 and parameters: {'boosting_type': 'gbdt', 'num_leaves': 55, 'learning_rate': 0.26008641161734536, 'n_estimators': 805, 'max_depth': 2, 'subsample': 0.6727797114187987, 'colsample_bytree': 0.8742259774639507, 'reg_alpha': 0.9740161817331979, 'reg_lambda': 0.5520825745479607}. Best is trial 64 with value: 0.3703148425787106.
[I 2024-12-15 12:35:22,287] Trial 89 finished with value: 0.3868065967016492 and parameters: {'boosting_type': 'gbdt', 'num_leaves': 160, 'learning_rate': 0.26983143754113087, 'n_estimators': 956, 'max_depth': 6, 'subsample': 0.560049833811336, 'colsample_bytree': 0.8557257169962206, 'reg_alpha': 0.8952360112611746, 'reg_lambda': 0.37183256219932975}. Best is trial 64 with value: 0.3703148425787106.
[I 2024-12-15 12:35:22,934] Trial 90 finished with value: 0.40329835082458776 and parameters: {'boosting_type': 'gbdt', 'num_leaves': 204, 'learning_rate': 0.31965255509801127, 'n_estimators': 918, 'max_depth': 1, 'subsample': 0.5443561374160987, 'colsample_bytree': 0.8941558244929493, 'reg_alpha': 0.829400659076244, 'reg_lambda': 0.17387822357757182}. Best is trial 64 with value: 0.3703148425787106.
[I 2024-12-15 12:35:31,215] Trial 91 finished with value: 0.38380809595202403 and parameters: {'boosting_type': 'dart', 'num_leaves': 247, 'learning_rate': 0.29006412781046054, 'n_estimators': 987, 'max_depth': 5, 'subsample': 0.5649586134407449, 'colsample_bytree': 0.8865124149509463, 'reg_alpha': 0.9878800151186687, 'reg_lambda': 0.29786305578372524}. Best is trial 64 with value: 0.3703148425787106.
[I 2024-12-15 12:35:38,919] Trial 92 finished with value: 0.3793103448275862 and parameters: {'boosting_type': 'dart', 'num_leaves': 255, 'learning_rate': 0.3993903743108467, 'n_estimators': 955, 'max_depth': 5, 'subsample': 0.5776786672521307, 'colsample_bytree': 0.8442006622718008, 'reg_alpha': 0.9435482906225793, 'reg_lambda': 0.32074211681765646}. Best is trial 64 with value: 0.3703148425787106.
[I 2024-12-15 12:35:46,886] Trial 93 finished with value: 0.3853073463268366 and parameters: {'boosting_type': 'dart', 'num_leaves': 248, 'learning_rate': 0.4645657514099142, 'n_estimators': 999, 'max_depth': 5, 'subsample': 0.5101441849502253, 'colsample_bytree': 0.8706212011342919, 'reg_alpha': 0.9760942435709051, 'reg_lambda': 0.2105347772663321}. Best is trial 64 with value: 0.3703148425787106.
[I 2024-12-15 12:35:52,918] Trial 94 finished with value: 0.3718140929535232 and parameters: {'boosting_type': 'dart', 'num_leaves': 75, 'learning_rate': 0.37421121448709904, 'n_estimators': 919, 'max_depth': 4, 'subsample': 0.6322767529211906, 'colsample_bytree': 0.8276338425407097, 'reg_alpha': 0.9141532582367496, 'reg_lambda': 0.3476394206464966}. Best is trial 64 with value: 0.3703148425787106.
[I 2024-12-15 12:35:58,547] Trial 95 finished with value: 0.37631184407796103 and parameters: {'boosting_type': 'dart', 'num_leaves': 11, 'learning_rate': 0.4253769669322563, 'n_estimators': 918, 'max_depth': 4, 'subsample': 0.64219876153531, 'colsample_bytree': 0.8309330504958967, 'reg_alpha': 0.9117970901450344, 'reg_lambda': 0.2536271166924893}. Best is trial 64 with value: 0.3703148425787106.
[I 2024-12-15 12:36:04,443] Trial 96 finished with value: 0.38080959520239877 and parameters: {'boosting_type': 'dart', 'num_leaves': 14, 'learning_rate': 0.4190720847240638, 'n_estimators': 913, 'max_depth': 4, 'subsample': 0.6339923753669081, 'colsample_bytree': 0.8293976250264273, 'reg_alpha': 0.8641108795199878, 'reg_lambda': 0.25209288252543205}. Best is trial 64 with value: 0.3703148425787106.
[I 2024-12-15 12:36:10,190] Trial 97 finished with value: 0.38380809595202403 and parameters: {'boosting_type': 'dart', 'num_leaves': 23, 'learning_rate': 0.44133046692109545, 'n_estimators': 889, 'max_depth': 4, 'subsample': 0.7029755178035478, 'colsample_bytree': 0.7629549700951879, 'reg_alpha': 0.8906505775804278, 'reg_lambda': 0.42999839885761143}. Best is trial 64 with value: 0.3703148425787106.
[I 2024-12-15 12:36:16,588] Trial 98 finished with value: 0.38830584707646176 and parameters: {'boosting_type': 'dart', 'num_leaves': 73, 'learning_rate': 0.370718858009256, 'n_estimators': 965, 'max_depth': 4, 'subsample': 0.6460334915874734, 'colsample_bytree': 0.7838269534012993, 'reg_alpha': 0.9170793562066629, 'reg_lambda': 0.08965512537545488}. Best is trial 64 with value: 0.3703148425787106.
[I 2024-12-15 12:36:22,876] Trial 99 finished with value: 0.38980509745127434 and parameters: {'boosting_type': 'dart', 'num_leaves': 12, 'learning_rate': 0.42794345866867833, 'n_estimators': 941, 'max_depth': 9, 'subsample': 0.6111801301556532, 'colsample_bytree': 0.8082160530674608, 'reg_alpha': 0.8363084690781275, 'reg_lambda': 0.35286058611056925}. Best is trial 64 with value: 0.3703148425787106.
