[I 2024-10-22 10:58:40,113] A new study created in memory with name: no-name-26601319-8dc9-4942-a847-d71dc86f2469
[I 2024-10-22 10:58:41,025] Trial 0 finished with value: 0.3413173652694611 and parameters: {'boosting_type': 'gbdt', 'num_leaves': 174, 'learning_rate': 0.29397223782084997, 'n_estimators': 943, 'max_depth': 0, 'subsample': 0.8832293183930726, 'colsample_bytree': 0.512415415087253, 'reg_alpha': 0.775576934379204, 'reg_lambda': 0.46104611286018227}. Best is trial 0 with value: 0.3413173652694611.
[I 2024-10-22 10:58:41,405] Trial 1 finished with value: 0.36227544910179643 and parameters: {'boosting_type': 'gbdt', 'num_leaves': 158, 'learning_rate': 0.33222726277394893, 'n_estimators': 439, 'max_depth': 4, 'subsample': 0.7664442542155753, 'colsample_bytree': 0.850496965588138, 'reg_alpha': 0.6060183787712665, 'reg_lambda': 0.36767525158838454}. Best is trial 0 with value: 0.3413173652694611.
[I 2024-10-22 10:58:41,643] Trial 2 finished with value: 0.3607784431137725 and parameters: {'boosting_type': 'gbdt', 'num_leaves': 3, 'learning_rate': 0.33581076079505556, 'n_estimators': 483, 'max_depth': 6, 'subsample': 0.6751656981154922, 'colsample_bytree': 0.9038154338586711, 'reg_alpha': 0.47771795666825867, 'reg_lambda': 0.7712097804971983}. Best is trial 0 with value: 0.3413173652694611.
[I 2024-10-22 10:58:42,305] Trial 3 finished with value: 0.34281437125748504 and parameters: {'boosting_type': 'gbdt', 'num_leaves': 254, 'learning_rate': 0.21282632329733983, 'n_estimators': 449, 'max_depth': 10, 'subsample': 0.9890898023205327, 'colsample_bytree': 0.9703324261943047, 'reg_alpha': 0.47388044516382943, 'reg_lambda': 0.821994037377213}. Best is trial 0 with value: 0.3413173652694611.
[I 2024-10-22 10:58:44,001] Trial 4 finished with value: 0.3607784431137725 and parameters: {'boosting_type': 'dart', 'num_leaves': 141, 'learning_rate': 0.4477934360820519, 'n_estimators': 560, 'max_depth': 4, 'subsample': 0.7035660536778222, 'colsample_bytree': 0.5423549736439317, 'reg_alpha': 0.02462649670029471, 'reg_lambda': 0.3462702568467867}. Best is trial 0 with value: 0.3413173652694611.
[I 2024-10-22 10:58:44,142] Trial 5 finished with value: 0.405688622754491 and parameters: {'boosting_type': 'goss', 'num_leaves': 2, 'learning_rate': 0.3960715040236178, 'n_estimators': 429, 'max_depth': 9, 'subsample': 0.5329226847343647, 'colsample_bytree': 0.8741057691986942, 'reg_alpha': 0.18825617647625803, 'reg_lambda': 0.6286050371144236}. Best is trial 0 with value: 0.3413173652694611.
[I 2024-10-22 10:58:44,682] Trial 6 finished with value: 0.3577844311377245 and parameters: {'boosting_type': 'gbdt', 'num_leaves': 100, 'learning_rate': 0.3379520017528025, 'n_estimators': 270, 'max_depth': 0, 'subsample': 0.592357438834872, 'colsample_bytree': 0.6704806148677952, 'reg_alpha': 0.18191882856205466, 'reg_lambda': 0.3841150781766308}. Best is trial 0 with value: 0.3413173652694611.
[I 2024-10-22 10:58:44,710] Trial 7 finished with value: 0.39820359281437123 and parameters: {'boosting_type': 'dart', 'num_leaves': 123, 'learning_rate': 0.4787794411175776, 'n_estimators': 19, 'max_depth': 3, 'subsample': 0.9711211543754004, 'colsample_bytree': 0.9416392913007585, 'reg_alpha': 0.981276213116797, 'reg_lambda': 0.025496258747707667}. Best is trial 0 with value: 0.3413173652694611.
[I 2024-10-22 10:58:44,822] Trial 8 finished with value: 0.36676646706586824 and parameters: {'boosting_type': 'goss', 'num_leaves': 196, 'learning_rate': 0.2418871010489046, 'n_estimators': 55, 'max_depth': 10, 'subsample': 0.9149799240024442, 'colsample_bytree': 0.7700524752507782, 'reg_alpha': 0.6851167237182996, 'reg_lambda': 0.008696688022428511}. Best is trial 0 with value: 0.3413173652694611.
[I 2024-10-22 10:58:45,693] Trial 9 finished with value: 0.3697604790419161 and parameters: {'boosting_type': 'goss', 'num_leaves': 129, 'learning_rate': 0.35444928487599203, 'n_estimators': 823, 'max_depth': 4, 'subsample': 0.5223339193913258, 'colsample_bytree': 0.5691349432146879, 'reg_alpha': 0.9168056263056673, 'reg_lambda': 0.973833085136111}. Best is trial 0 with value: 0.3413173652694611.
[I 2024-10-22 10:58:47,267] Trial 10 finished with value: 0.3413173652694611 and parameters: {'boosting_type': 'gbdt', 'num_leaves': 77, 'learning_rate': 0.06055600526310764, 'n_estimators': 977, 'max_depth': -1, 'subsample': 0.8386965594623443, 'colsample_bytree': 0.6490273989350253, 'reg_alpha': 0.7796585428129064, 'reg_lambda': 0.5499052435885772}. Best is trial 0 with value: 0.3413173652694611.
[I 2024-10-22 10:58:48,881] Trial 11 finished with value: 0.3458083832335329 and parameters: {'boosting_type': 'gbdt', 'num_leaves': 64, 'learning_rate': 0.054129412405197364, 'n_estimators': 999, 'max_depth': -1, 'subsample': 0.8396374311259908, 'colsample_bytree': 0.6318548387820726, 'reg_alpha': 0.7820650175044082, 'reg_lambda': 0.5143544865899636}. Best is trial 0 with value: 0.3413173652694611.
[I 2024-10-22 10:58:49,417] Trial 12 finished with value: 0.3772455089820359 and parameters: {'boosting_type': 'gbdt', 'num_leaves': 65, 'learning_rate': 0.1217035220086791, 'n_estimators': 995, 'max_depth': 1, 'subsample': 0.8159129254564438, 'colsample_bytree': 0.5005080720190351, 'reg_alpha': 0.7782339146466817, 'reg_lambda': 0.2151695101250488}. Best is trial 0 with value: 0.3413173652694611.
[I 2024-10-22 10:58:49,709] Trial 13 finished with value: 0.3847305389221557 and parameters: {'boosting_type': 'gbdt', 'num_leaves': 193, 'learning_rate': 0.16080695473335507, 'n_estimators': 767, 'max_depth': 1, 'subsample': 0.8873554021736059, 'colsample_bytree': 0.6717997035696637, 'reg_alpha': 0.8408124324482588, 'reg_lambda': 0.5721325416106476}. Best is trial 0 with value: 0.3413173652694611.
[I 2024-10-22 10:58:52,413] Trial 14 finished with value: 0.344311377245509 and parameters: {'boosting_type': 'gbdt', 'num_leaves': 76, 'learning_rate': 0.020458539211142213, 'n_estimators': 790, 'max_depth': -1, 'subsample': 0.8918736037765267, 'colsample_bytree': 0.7575716684844384, 'reg_alpha': 0.6116486500007485, 'reg_lambda': 0.7197287414490015}. Best is trial 0 with value: 0.3413173652694611.
[I 2024-10-22 10:58:54,209] Trial 15 finished with value: 0.37874251497005984 and parameters: {'boosting_type': 'dart', 'num_leaves': 186, 'learning_rate': 0.12220673459005985, 'n_estimators': 867, 'max_depth': 2, 'subsample': 0.7802945180973433, 'colsample_bytree': 0.5955172372901559, 'reg_alpha': 0.3369883984918393, 'reg_lambda': 0.25361569492388036}. Best is trial 0 with value: 0.3413173652694611.
[I 2024-10-22 10:58:54,701] Trial 16 finished with value: 0.35179640718562877 and parameters: {'boosting_type': 'gbdt', 'num_leaves': 248, 'learning_rate': 0.27577947846647294, 'n_estimators': 607, 'max_depth': 6, 'subsample': 0.70895211505518, 'colsample_bytree': 0.7002248571045373, 'reg_alpha': 0.6872493877402972, 'reg_lambda': 0.4645209924821286}. Best is trial 0 with value: 0.3413173652694611.
[I 2024-10-22 10:58:55,556] Trial 17 finished with value: 0.34730538922155685 and parameters: {'boosting_type': 'gbdt', 'num_leaves': 216, 'learning_rate': 0.18894231495003583, 'n_estimators': 690, 'max_depth': -1, 'subsample': 0.8428656853764301, 'colsample_bytree': 0.5031245003963944, 'reg_alpha': 0.8659824857569389, 'reg_lambda': 0.664243471821029}. Best is trial 0 with value: 0.3413173652694611.
[I 2024-10-22 10:58:55,865] Trial 18 finished with value: 0.37125748502994016 and parameters: {'boosting_type': 'goss', 'num_leaves': 45, 'learning_rate': 0.26601478281456914, 'n_estimators': 903, 'max_depth': 1, 'subsample': 0.9318301833269864, 'colsample_bytree': 0.8124391171030017, 'reg_alpha': 0.9896092695232691, 'reg_lambda': 0.215710743660951}. Best is trial 0 with value: 0.3413173652694611.
[I 2024-10-22 10:58:59,351] Trial 19 finished with value: 0.35179640718562877 and parameters: {'boosting_type': 'dart', 'num_leaves': 96, 'learning_rate': 0.08368984870142628, 'n_estimators': 679, 'max_depth': 6, 'subsample': 0.6285882558718529, 'colsample_bytree': 0.6148274595931307, 'reg_alpha': 0.5738205820313521, 'reg_lambda': 0.902458517817976}. Best is trial 0 with value: 0.3413173652694611.
[I 2024-10-22 10:58:59,583] Trial 20 finished with value: 0.44311377245508987 and parameters: {'boosting_type': 'gbdt', 'num_leaves': 33, 'learning_rate': 0.01161427686915524, 'n_estimators': 301, 'max_depth': 2, 'subsample': 0.8076442377030714, 'colsample_bytree': 0.5463747225512093, 'reg_alpha': 0.7298375885292203, 'reg_lambda': 0.46965103589569}. Best is trial 0 with value: 0.3413173652694611.
[I 2024-10-22 10:59:00,213] Trial 21 finished with value: 0.35928143712574845 and parameters: {'boosting_type': 'gbdt', 'num_leaves': 255, 'learning_rate': 0.21281806352217042, 'n_estimators': 316, 'max_depth': 8, 'subsample': 0.9993623168578648, 'colsample_bytree': 0.98401802887944, 'reg_alpha': 0.44523429744263265, 'reg_lambda': 0.839136105088107}. Best is trial 0 with value: 0.3413173652694611.
[I 2024-10-22 10:59:00,636] Trial 22 finished with value: 0.3577844311377245 and parameters: {'boosting_type': 'gbdt', 'num_leaves': 232, 'learning_rate': 0.280267075243178, 'n_estimators': 182, 'max_depth': 8, 'subsample': 0.9508643143849826, 'colsample_bytree': 0.7276775381601476, 'reg_alpha': 0.4027947613441938, 'reg_lambda': 0.7734249106205782}. Best is trial 0 with value: 0.3413173652694611.
[I 2024-10-22 10:59:01,700] Trial 23 finished with value: 0.3577844311377245 and parameters: {'boosting_type': 'gbdt', 'num_leaves': 156, 'learning_rate': 0.14697135946922973, 'n_estimators': 918, 'max_depth': 0, 'subsample': 0.8694111189099182, 'colsample_bytree': 0.8006864658507655, 'reg_alpha': 0.34002312289340353, 'reg_lambda': 0.5712208613167473}. Best is trial 0 with value: 0.3413173652694611.
[I 2024-10-22 10:59:02,364] Trial 24 finished with value: 0.35479041916167664 and parameters: {'boosting_type': 'gbdt', 'num_leaves': 171, 'learning_rate': 0.22865529232389137, 'n_estimators': 725, 'max_depth': 7, 'subsample': 0.998041782579359, 'colsample_bytree': 0.6442807051646258, 'reg_alpha': 0.5570007111516666, 'reg_lambda': 0.8781884933692277}. Best is trial 0 with value: 0.3413173652694611.
[I 2024-10-22 10:59:02,824] Trial 25 finished with value: 0.3488023952095808 and parameters: {'boosting_type': 'gbdt', 'num_leaves': 219, 'learning_rate': 0.39169777000735323, 'n_estimators': 587, 'max_depth': 10, 'subsample': 0.9266642134694589, 'colsample_bytree': 0.9872823730972998, 'reg_alpha': 0.6699431836424491, 'reg_lambda': 0.676247758836338}. Best is trial 0 with value: 0.3413173652694611.
[I 2024-10-22 10:59:03,887] Trial 26 finished with value: 0.35928143712574845 and parameters: {'boosting_type': 'gbdt', 'num_leaves': 106, 'learning_rate': 0.08038585301505657, 'n_estimators': 360, 'max_depth': 0, 'subsample': 0.8552888837581767, 'colsample_bytree': 0.707086250329501, 'reg_alpha': 0.5312704258745731, 'reg_lambda': 0.9774314052320008}. Best is trial 0 with value: 0.3413173652694611.
[I 2024-10-22 10:59:04,569] Trial 27 finished with value: 0.3577844311377245 and parameters: {'boosting_type': 'gbdt', 'num_leaves': 217, 'learning_rate': 0.30513902758598693, 'n_estimators': 928, 'max_depth': 2, 'subsample': 0.7984909773888986, 'colsample_bytree': 0.5841698584760704, 'reg_alpha': 0.81866062513617, 'reg_lambda': 0.13561956478790832}. Best is trial 0 with value: 0.3413173652694611.
[I 2024-10-22 10:59:05,023] Trial 28 finished with value: 0.3697604790419161 and parameters: {'boosting_type': 'dart', 'num_leaves': 79, 'learning_rate': 0.17947454785544964, 'n_estimators': 182, 'max_depth': 5, 'subsample': 0.7278047954152983, 'colsample_bytree': 0.9307020630352513, 'reg_alpha': 0.9163427101992422, 'reg_lambda': 0.42079481284949966}. Best is trial 0 with value: 0.3413173652694611.
[I 2024-10-22 10:59:05,317] Trial 29 finished with value: 0.37425149700598803 and parameters: {'boosting_type': 'goss', 'num_leaves': 155, 'learning_rate': 0.38077241058376676, 'n_estimators': 422, 'max_depth': 3, 'subsample': 0.7606153781126065, 'colsample_bytree': 0.8348697604088906, 'reg_alpha': 0.61758939927489, 'reg_lambda': 0.3370544650324602}. Best is trial 0 with value: 0.3413173652694611.
[I 2024-10-22 10:59:06,331] Trial 30 finished with value: 0.3607784431137725 and parameters: {'boosting_type': 'gbdt', 'num_leaves': 171, 'learning_rate': 0.2929544642072627, 'n_estimators': 838, 'max_depth': -1, 'subsample': 0.95576330227118, 'colsample_bytree': 0.5412948136522534, 'reg_alpha': 0.3056391547262195, 'reg_lambda': 0.5891273393654073}. Best is trial 0 with value: 0.3413173652694611.
[I 2024-10-22 10:59:08,234] Trial 31 finished with value: 0.34730538922155685 and parameters: {'boosting_type': 'gbdt', 'num_leaves': 32, 'learning_rate': 0.018715779085458444, 'n_estimators': 781, 'max_depth': -1, 'subsample': 0.8958909834449686, 'colsample_bytree': 0.8664849321529949, 'reg_alpha': 0.6398952154912425, 'reg_lambda': 0.733794506100285}. Best is trial 0 with value: 0.3413173652694611.
[I 2024-10-22 10:59:09,830] Trial 32 finished with value: 0.3488023952095808 and parameters: {'boosting_type': 'gbdt', 'num_leaves': 76, 'learning_rate': 0.05893792785458543, 'n_estimators': 958, 'max_depth': 0, 'subsample': 0.8922493826850227, 'colsample_bytree': 0.7404688848852048, 'reg_alpha': 0.7303402307300739, 'reg_lambda': 0.7480609053728258}. Best is trial 0 with value: 0.3413173652694611.
[I 2024-10-22 10:59:11,613] Trial 33 finished with value: 0.3488023952095808 and parameters: {'boosting_type': 'gbdt', 'num_leaves': 115, 'learning_rate': 0.03757525374414772, 'n_estimators': 515, 'max_depth': -1, 'subsample': 0.8318005080190249, 'colsample_bytree': 0.6672151714509678, 'reg_alpha': 0.4623713629237187, 'reg_lambda': 0.8210578675769513}. Best is trial 0 with value: 0.3413173652694611.
[I 2024-10-22 10:59:11,955] Trial 34 finished with value: 0.3802395209580839 and parameters: {'boosting_type': 'gbdt', 'num_leaves': 140, 'learning_rate': 0.09934164907910956, 'n_estimators': 871, 'max_depth': 1, 'subsample': 0.8788222240614694, 'colsample_bytree': 0.7639495399664104, 'reg_alpha': 0.6027339866342447, 'reg_lambda': 0.7015140223517352}. Best is trial 0 with value: 0.3413173652694611.
[I 2024-10-22 10:59:12,709] Trial 35 finished with value: 0.34281437125748504 and parameters: {'boosting_type': 'gbdt', 'num_leaves': 90, 'learning_rate': 0.13143429752417962, 'n_estimators': 504, 'max_depth': 0, 'subsample': 0.9755833892070312, 'colsample_bytree': 0.9061500646490632, 'reg_alpha': 0.7478578651907983, 'reg_lambda': 0.5310062671923342}. Best is trial 0 with value: 0.3413173652694611.
[I 2024-10-22 10:59:13,096] Trial 36 finished with value: 0.3488023952095808 and parameters: {'boosting_type': 'gbdt', 'num_leaves': 93, 'learning_rate': 0.21264039899413753, 'n_estimators': 489, 'max_depth': 3, 'subsample': 0.9773529542525096, 'colsample_bytree': 0.9213824197801908, 'reg_alpha': 0.8883880817628864, 'reg_lambda': 0.2985492618550012}. Best is trial 0 with value: 0.3413173652694611.
[I 2024-10-22 10:59:14,307] Trial 37 finished with value: 0.36676646706586824 and parameters: {'boosting_type': 'dart', 'num_leaves': 16, 'learning_rate': 0.156241132555691, 'n_estimators': 397, 'max_depth': 5, 'subsample': 0.9526169551873648, 'colsample_bytree': 0.9574534911356444, 'reg_alpha': 0.22006006942796874, 'reg_lambda': 0.5067829938130133}. Best is trial 0 with value: 0.3413173652694611.
[I 2024-10-22 10:59:15,173] Trial 38 finished with value: 0.3727544910179641 and parameters: {'boosting_type': 'goss', 'num_leaves': 136, 'learning_rate': 0.24862164189195568, 'n_estimators': 538, 'max_depth': 0, 'subsample': 0.9284417969776825, 'colsample_bytree': 0.8900663886182898, 'reg_alpha': 0.7379673459501811, 'reg_lambda': 0.41210457484471297}. Best is trial 0 with value: 0.3413173652694611.
[I 2024-10-22 10:59:15,656] Trial 39 finished with value: 0.3607784431137725 and parameters: {'boosting_type': 'gbdt', 'num_leaves': 56, 'learning_rate': 0.31643794877615894, 'n_estimators': 457, 'max_depth': 8, 'subsample': 0.9706417876185637, 'colsample_bytree': 0.964647515403295, 'reg_alpha': 0.48558611475036373, 'reg_lambda': 0.6130992701059832}. Best is trial 0 with value: 0.3413173652694611.
[I 2024-10-22 10:59:17,333] Trial 40 finished with value: 0.3562874251497006 and parameters: {'boosting_type': 'gbdt', 'num_leaves': 113, 'learning_rate': 0.42710842879777666, 'n_estimators': 628, 'max_depth': 0, 'subsample': 0.7836381056992242, 'colsample_bytree': 0.9029971267926805, 'reg_alpha': 0.01184409859618224, 'reg_lambda': 0.5202266148956772}. Best is trial 0 with value: 0.3413173652694611.
[I 2024-10-22 10:59:18,202] Trial 41 finished with value: 0.34281437125748504 and parameters: {'boosting_type': 'gbdt', 'num_leaves': 50, 'learning_rate': 0.11400956478073976, 'n_estimators': 795, 'max_depth': -1, 'subsample': 0.9127775590486167, 'colsample_bytree': 0.837347294333952, 'reg_alpha': 0.7995634078916583, 'reg_lambda': 0.6553080306331994}. Best is trial 0 with value: 0.3413173652694611.
[I 2024-10-22 10:59:18,582] Trial 42 finished with value: 0.3802395209580839 and parameters: {'boosting_type': 'gbdt', 'num_leaves': 87, 'learning_rate': 0.11937409279623878, 'n_estimators': 980, 'max_depth': 1, 'subsample': 0.9102133457242977, 'colsample_bytree': 0.838451541760533, 'reg_alpha': 0.8195937493042031, 'reg_lambda': 0.6430005714842012}. Best is trial 0 with value: 0.3413173652694611.
[I 2024-10-22 10:59:19,184] Trial 43 finished with value: 0.35029940119760483 and parameters: {'boosting_type': 'gbdt', 'num_leaves': 45, 'learning_rate': 0.1881865167975438, 'n_estimators': 658, 'max_depth': 0, 'subsample': 0.9804938919739988, 'colsample_bytree': 0.8760940960556428, 'reg_alpha': 0.7803614112682031, 'reg_lambda': 0.5500237592993218}. Best is trial 0 with value: 0.3413173652694611.
[I 2024-10-22 10:59:19,809] Trial 44 finished with value: 0.3338323353293413 and parameters: {'boosting_type': 'gbdt', 'num_leaves': 15, 'learning_rate': 0.13527948711799306, 'n_estimators': 552, 'max_depth': -1, 'subsample': 0.9397224435569539, 'colsample_bytree': 0.8066915019780172, 'reg_alpha': 0.934210514452044, 'reg_lambda': 0.42350505930733806}. Best is trial 44 with value: 0.3338323353293413.
[I 2024-10-22 10:59:20,346] Trial 45 finished with value: 0.344311377245509 and parameters: {'boosting_type': 'gbdt', 'num_leaves': 13, 'learning_rate': 0.13822160665207686, 'n_estimators': 478, 'max_depth': 9, 'subsample': 0.9493018576382392, 'colsample_bytree': 0.7963240107538875, 'reg_alpha': 0.9570786365000972, 'reg_lambda': 0.35529597890502407}. Best is trial 44 with value: 0.3338323353293413.
[I 2024-10-22 10:59:20,482] Trial 46 finished with value: 0.41017964071856283 and parameters: {'boosting_type': 'goss', 'num_leaves': 67, 'learning_rate': 0.06529377419605757, 'n_estimators': 212, 'max_depth': 2, 'subsample': 0.9413930382382831, 'colsample_bytree': 0.9635272752104881, 'reg_alpha': 0.9468132910610414, 'reg_lambda': 0.43175828864534443}. Best is trial 44 with value: 0.3338323353293413.
[I 2024-10-22 10:59:20,846] Trial 47 finished with value: 0.4116766467065869 and parameters: {'boosting_type': 'dart', 'num_leaves': 233, 'learning_rate': 0.33954502416235244, 'n_estimators': 374, 'max_depth': 1, 'subsample': 0.5547609654636936, 'colsample_bytree': 0.7810601785670586, 'reg_alpha': 0.8606596193661926, 'reg_lambda': 0.468785061692929}. Best is trial 44 with value: 0.3338323353293413.
[I 2024-10-22 10:59:21,209] Trial 48 finished with value: 0.35179640718562877 and parameters: {'boosting_type': 'gbdt', 'num_leaves': 124, 'learning_rate': 0.4976782083089011, 'n_estimators': 546, 'max_depth': 0, 'subsample': 0.8546589488302414, 'colsample_bytree': 0.9117658957714779, 'reg_alpha': 0.8978521881442889, 'reg_lambda': 0.314665329107441}. Best is trial 44 with value: 0.3338323353293413.
[I 2024-10-22 10:59:22,180] Trial 49 finished with value: 0.34281437125748504 and parameters: {'boosting_type': 'gbdt', 'num_leaves': 198, 'learning_rate': 0.09667972600977043, 'n_estimators': 574, 'max_depth': -1, 'subsample': 0.9760416851419326, 'colsample_bytree': 0.995790191222942, 'reg_alpha': 0.7441199517198075, 'reg_lambda': 0.38301983418016405}. Best is trial 44 with value: 0.3338323353293413.
[I 2024-10-22 10:59:22,267] Trial 50 finished with value: 0.4401197604790419 and parameters: {'boosting_type': 'gbdt', 'num_leaves': 2, 'learning_rate': 0.17469160376952322, 'n_estimators': 89, 'max_depth': 4, 'subsample': 0.8285532650345707, 'colsample_bytree': 0.5235102015067761, 'reg_alpha': 0.09283945176988695, 'reg_lambda': 0.11676016772284548}. Best is trial 44 with value: 0.3338323353293413.
[I 2024-10-22 10:59:23,134] Trial 51 finished with value: 0.33982035928143717 and parameters: {'boosting_type': 'gbdt', 'num_leaves': 27, 'learning_rate': 0.11460470154440613, 'n_estimators': 735, 'max_depth': -1, 'subsample': 0.9192849871900411, 'colsample_bytree': 0.8216514215305164, 'reg_alpha': 0.8001019172997486, 'reg_lambda': 0.5509337711500917}. Best is trial 44 with value: 0.3338323353293413.
[I 2024-10-22 10:59:23,935] Trial 52 finished with value: 0.34730538922155685 and parameters: {'boosting_type': 'gbdt', 'num_leaves': 34, 'learning_rate': 0.1355278355543803, 'n_estimators': 731, 'max_depth': -1, 'subsample': 0.9071125565555208, 'colsample_bytree': 0.8094431540796522, 'reg_alpha': 0.7000111690384953, 'reg_lambda': 0.4794162921850263}. Best is trial 44 with value: 0.3338323353293413.
[I 2024-10-22 10:59:24,290] Trial 53 finished with value: 0.3802395209580839 and parameters: {'boosting_type': 'gbdt', 'num_leaves': 21, 'learning_rate': 0.21077757602762046, 'n_estimators': 876, 'max_depth': 1, 'subsample': 0.9267231579829598, 'colsample_bytree': 0.8635608139061874, 'reg_alpha': 0.8523728375404068, 'reg_lambda': 0.5384377140160025}. Best is trial 44 with value: 0.3338323353293413.
