[I 2024-10-21 16:21:03,967] Trial 54 finished with value: 0.3514328808446455 and parameters: {'boosting_type': 'dart', 'num_leaves': 184, 'learning_rate': 0.34607432408487954, 'n_estimators': 283, 'max_depth': 6, 'subsample': 0.5220788812870887, 'colsample_bytree': 0.637595101652975, 'reg_alpha': 0.4282677290586386, 'reg_lambda': 0.05651959813651722}. Best is trial 17 with value: 0.3212669683257918.
[I 2024-10-21 16:21:04,416] Trial 55 finished with value: 0.34841628959276016 and parameters: {'boosting_type': 'dart', 'num_leaves': 150, 'learning_rate': 0.42124864901563447, 'n_estimators': 117, 'max_depth': 8, 'subsample': 0.7353904762217573, 'colsample_bytree': 0.6143850938980598, 'reg_alpha': 0.01030419186737377, 'reg_lambda': 0.5186512012975694}. Best is trial 17 with value: 0.3212669683257918.
[I 2024-10-21 16:21:05,352] Trial 56 finished with value: 0.3378582202111614 and parameters: {'boosting_type': 'dart', 'num_leaves': 98, 'learning_rate': 0.2868483863192466, 'n_estimators': 226, 'max_depth': 7, 'subsample': 0.5946302224596192, 'colsample_bytree': 0.557426237128722, 'reg_alpha': 0.323423266020767, 'reg_lambda': 0.22314850801038977}. Best is trial 17 with value: 0.3212669683257918.
[I 2024-10-21 16:21:06,779] Trial 57 finished with value: 0.33333333333333337 and parameters: {'boosting_type': 'dart', 'num_leaves': 130, 'learning_rate': 0.21909555075547493, 'n_estimators': 413, 'max_depth': 5, 'subsample': 0.5380620821985151, 'colsample_bytree': 0.6523779549241281, 'reg_alpha': 0.13231430391767837, 'reg_lambda': 0.4710228951419317}. Best is trial 17 with value: 0.3212669683257918.
[I 2024-10-21 16:21:07,026] Trial 58 finished with value: 0.34992458521870284 and parameters: {'boosting_type': 'goss', 'num_leaves': 58, 'learning_rate': 0.3575684945778139, 'n_estimators': 87, 'max_depth': 0, 'subsample': 0.8226921074011714, 'colsample_bytree': 0.5234515288829782, 'reg_alpha': 0.402445443416235, 'reg_lambda': 0.3485854709936531}. Best is trial 17 with value: 0.3212669683257918.
[I 2024-10-21 16:21:07,543] Trial 59 finished with value: 0.3318250377073907 and parameters: {'boosting_type': 'dart', 'num_leaves': 22, 'learning_rate': 0.18950287453075407, 'n_estimators': 174, 'max_depth': 6, 'subsample': 0.5777385783169009, 'colsample_bytree': 0.592434007691832, 'reg_alpha': 0.47677492434609026, 'reg_lambda': 0.41750991665707443}. Best is trial 17 with value: 0.3212669683257918.
[I 2024-10-21 16:21:07,625] Trial 60 finished with value: 0.36349924585218707 and parameters: {'boosting_type': 'dart', 'num_leaves': 62, 'learning_rate': 0.30782288433224536, 'n_estimators': 43, 'max_depth': 3, 'subsample': 0.7968077570048369, 'colsample_bytree': 0.5643520105601642, 'reg_alpha': 0.35193917583108625, 'reg_lambda': 0.9925564980890671}. Best is trial 17 with value: 0.3212669683257918.
[I 2024-10-21 16:21:08,909] Trial 61 finished with value: 0.3378582202111614 and parameters: {'boosting_type': 'dart', 'num_leaves': 236, 'learning_rate': 0.20605205164945675, 'n_estimators': 377, 'max_depth': 5, 'subsample': 0.9015864926341297, 'colsample_bytree': 0.690838338441913, 'reg_alpha': 0.3227926376150808, 'reg_lambda': 0.6054191098386713}. Best is trial 17 with value: 0.3212669683257918.
[I 2024-10-21 16:21:09,563] Trial 62 finished with value: 0.34087481146304677 and parameters: {'boosting_type': 'dart', 'num_leaves': 48, 'learning_rate': 0.23621702773601982, 'n_estimators': 279, 'max_depth': 4, 'subsample': 0.934238471091171, 'colsample_bytree': 0.6283166674774778, 'reg_alpha': 0.38133578924384004, 'reg_lambda': 0.5541255511717635}. Best is trial 17 with value: 0.3212669683257918.
[I 2024-10-21 16:21:10,320] Trial 63 finished with value: 0.32730015082956254 and parameters: {'boosting_type': 'dart', 'num_leaves': 158, 'learning_rate': 0.13295058724426806, 'n_estimators': 215, 'max_depth': 6, 'subsample': 0.8569892765531778, 'colsample_bytree': 0.6626679192939513, 'reg_alpha': 0.28511213306361416, 'reg_lambda': 0.6579352855347944}. Best is trial 17 with value: 0.3212669683257918.
[I 2024-10-21 16:21:11,305] Trial 64 finished with value: 0.34087481146304677 and parameters: {'boosting_type': 'dart', 'num_leaves': 37, 'learning_rate': 0.2579557409133254, 'n_estimators': 308, 'max_depth': 5, 'subsample': 0.7804497282446622, 'colsample_bytree': 0.6378777840326922, 'reg_alpha': 0.24056074881601863, 'reg_lambda': 0.7410095200865507}. Best is trial 17 with value: 0.3212669683257918.
[I 2024-10-21 16:21:11,794] Trial 65 finished with value: 0.33333333333333337 and parameters: {'boosting_type': 'dart', 'num_leaves': 66, 'learning_rate': 0.15087516736881673, 'n_estimators': 138, 'max_depth': 7, 'subsample': 0.7348154660454502, 'colsample_bytree': 0.6029782226805497, 'reg_alpha': 0.5062626902873801, 'reg_lambda': 0.32088640134453167}. Best is trial 17 with value: 0.3212669683257918.
[I 2024-10-21 16:21:14,830] Trial 66 finished with value: 0.34238310708898945 and parameters: {'boosting_type': 'dart', 'num_leaves': 80, 'learning_rate': 0.1762876775501291, 'n_estimators': 785, 'max_depth': 4, 'subsample': 0.8320599421652074, 'colsample_bytree': 0.7767132049793172, 'reg_alpha': 0.5621730560394442, 'reg_lambda': 0.39507769373914037}. Best is trial 17 with value: 0.3212669683257918.
[I 2024-10-21 16:21:15,349] Trial 67 finished with value: 0.33634992458521873 and parameters: {'boosting_type': 'dart', 'num_leaves': 181, 'learning_rate': 0.20455977684656595, 'n_estimators': 192, 'max_depth': 5, 'subsample': 0.8897749798734207, 'colsample_bytree': 0.7279508034031951, 'reg_alpha': 0.415525158919345, 'reg_lambda': 0.5774613060649946}. Best is trial 17 with value: 0.3212669683257918.
[I 2024-10-21 16:21:15,870] Trial 68 finished with value: 0.3514328808446455 and parameters: {'boosting_type': 'gbdt', 'num_leaves': 17, 'learning_rate': 0.277581341769531, 'n_estimators': 544, 'max_depth': 7, 'subsample': 0.7984797423904522, 'colsample_bytree': 0.6956287955669579, 'reg_alpha': 0.6340607585129214, 'reg_lambda': 0.779426691082052}. Best is trial 17 with value: 0.3212669683257918.
[I 2024-10-21 16:21:16,131] Trial 69 finished with value: 0.3544494720965309 and parameters: {'boosting_type': 'goss', 'num_leaves': 90, 'learning_rate': 0.23197878683579867, 'n_estimators': 236, 'max_depth': 4, 'subsample': 0.7716303921387552, 'colsample_bytree': 0.6151329853453618, 'reg_alpha': 0.4515742860908906, 'reg_lambda': 0.4542046400081532}. Best is trial 17 with value: 0.3212669683257918.
[I 2024-10-21 16:21:17,068] Trial 70 finished with value: 0.3514328808446455 and parameters: {'boosting_type': 'dart', 'num_leaves': 29, 'learning_rate': 0.2946723714756179, 'n_estimators': 441, 'max_depth': 3, 'subsample': 0.5514415142363943, 'colsample_bytree': 0.6424330769328634, 'reg_alpha': 0.1917664113573236, 'reg_lambda': 0.5282693970124626}. Best is trial 17 with value: 0.3212669683257918.
[I 2024-10-21 16:21:23,659] Trial 71 finished with value: 0.31975867269984914 and parameters: {'boosting_type': 'dart', 'num_leaves': 164, 'learning_rate': 0.04888356792570081, 'n_estimators': 981, 'max_depth': 6, 'subsample': 0.8684993045593552, 'colsample_bytree': 0.666302676463433, 'reg_alpha': 0.2866366937462772, 'reg_lambda': 0.6715077609766124}. Best is trial 71 with value: 0.31975867269984914.
[I 2024-10-21 16:21:31,499] Trial 72 finished with value: 0.3167420814479638 and parameters: {'boosting_type': 'dart', 'num_leaves': 159, 'learning_rate': 0.03267064446468397, 'n_estimators': 919, 'max_depth': 6, 'subsample': 0.8401715921230074, 'colsample_bytree': 0.6701736527642427, 'reg_alpha': 0.33838939626787234, 'reg_lambda': 0.7036830877356405}. Best is trial 72 with value: 0.3167420814479638.
[I 2024-10-21 16:21:37,966] Trial 73 finished with value: 0.31825037707390647 and parameters: {'boosting_type': 'dart', 'num_leaves': 177, 'learning_rate': 0.02187956815771202, 'n_estimators': 964, 'max_depth': 6, 'subsample': 0.9281415610563284, 'colsample_bytree': 0.5879639130483526, 'reg_alpha': 0.37171621012050227, 'reg_lambda': 0.8167486348386728}. Best is trial 72 with value: 0.3167420814479638.
[I 2024-10-21 16:21:45,341] Trial 74 finished with value: 0.330316742081448 and parameters: {'boosting_type': 'dart', 'num_leaves': 178, 'learning_rate': 0.016359612097238727, 'n_estimators': 975, 'max_depth': 6, 'subsample': 0.9229903044006494, 'colsample_bytree': 0.5853438074884855, 'reg_alpha': 0.2750478388955868, 'reg_lambda': 0.817241902387839}. Best is trial 72 with value: 0.3167420814479638.
[I 2024-10-21 16:21:51,652] Trial 75 finished with value: 0.32579185520361986 and parameters: {'boosting_type': 'dart', 'num_leaves': 205, 'learning_rate': 0.040631619279072245, 'n_estimators': 918, 'max_depth': 6, 'subsample': 0.9624120107764866, 'colsample_bytree': 0.6852707328818411, 'reg_alpha': 0.3363234659580761, 'reg_lambda': 0.8679345945956256}. Best is trial 72 with value: 0.3167420814479638.
[I 2024-10-21 16:21:56,080] Trial 76 finished with value: 0.330316742081448 and parameters: {'boosting_type': 'dart', 'num_leaves': 165, 'learning_rate': 0.049585304969974764, 'n_estimators': 872, 'max_depth': 5, 'subsample': 0.8745801168806777, 'colsample_bytree': 0.6610519537486262, 'reg_alpha': 0.21943532543695143, 'reg_lambda': 0.6999707173671585}. Best is trial 72 with value: 0.3167420814479638.
[I 2024-10-21 16:22:02,599] Trial 77 finished with value: 0.3212669683257918 and parameters: {'boosting_type': 'dart', 'num_leaves': 137, 'learning_rate': 0.030327304563542583, 'n_estimators': 954, 'max_depth': 6, 'subsample': 0.8470546914843295, 'colsample_bytree': 0.7396870042578803, 'reg_alpha': 0.16273312843195886, 'reg_lambda': 0.767919080328946}. Best is trial 72 with value: 0.3167420814479638.
[I 2024-10-21 16:22:08,796] Trial 78 finished with value: 0.3167420814479638 and parameters: {'boosting_type': 'dart', 'num_leaves': 159, 'learning_rate': 0.027533975395120078, 'n_estimators': 959, 'max_depth': 6, 'subsample': 0.839349001449065, 'colsample_bytree': 0.5443896427315981, 'reg_alpha': 0.16008195609882528, 'reg_lambda': 0.7814467110365276}. Best is trial 72 with value: 0.3167420814479638.
[I 2024-10-21 16:22:15,840] Trial 79 finished with value: 0.3227752639517345 and parameters: {'boosting_type': 'dart', 'num_leaves': 136, 'learning_rate': 0.02522491595557255, 'n_estimators': 1000, 'max_depth': 6, 'subsample': 0.843647159510484, 'colsample_bytree': 0.5449170163625235, 'reg_alpha': 0.13715667571198142, 'reg_lambda': 0.7773888902000171}. Best is trial 72 with value: 0.3167420814479638.
[I 2024-10-21 16:22:21,616] Trial 80 finished with value: 0.3318250377073907 and parameters: {'boosting_type': 'dart', 'num_leaves': 157, 'learning_rate': 0.0575474101089302, 'n_estimators': 918, 'max_depth': 6, 'subsample': 0.9433592002785592, 'colsample_bytree': 0.7491546457331956, 'reg_alpha': 0.19621166775537352, 'reg_lambda': 0.8683805471187414}. Best is trial 72 with value: 0.3167420814479638.
[I 2024-10-21 16:22:28,269] Trial 81 finished with value: 0.31825037707390647 and parameters: {'boosting_type': 'dart', 'num_leaves': 175, 'learning_rate': 0.03263560986513402, 'n_estimators': 963, 'max_depth': 6, 'subsample': 0.8417776154972468, 'colsample_bytree': 0.5460279595422379, 'reg_alpha': 0.17495709479976057, 'reg_lambda': 0.780732810629307}. Best is trial 72 with value: 0.3167420814479638.
[I 2024-10-21 16:22:34,751] Trial 82 finished with value: 0.3227752639517345 and parameters: {'boosting_type': 'dart', 'num_leaves': 188, 'learning_rate': 0.03336089762282299, 'n_estimators': 947, 'max_depth': 6, 'subsample': 0.9034434151282145, 'colsample_bytree': 0.5215913180755828, 'reg_alpha': 0.17432759216220314, 'reg_lambda': 0.7055678488401653}. Best is trial 72 with value: 0.3167420814479638.
[I 2024-10-21 16:22:40,341] Trial 83 finished with value: 0.33634992458521873 and parameters: {'boosting_type': 'dart', 'num_leaves': 177, 'learning_rate': 0.09950561231073529, 'n_estimators': 863, 'max_depth': 6, 'subsample': 0.8648064985252195, 'colsample_bytree': 0.5659663723406061, 'reg_alpha': 0.1713496852485355, 'reg_lambda': 0.664030199589892}. Best is trial 72 with value: 0.3167420814479638.
[I 2024-10-21 16:22:44,606] Trial 84 finished with value: 0.3318250377073907 and parameters: {'boosting_type': 'dart', 'num_leaves': 160, 'learning_rate': 0.07070095747843722, 'n_estimators': 814, 'max_depth': 5, 'subsample': 0.8124034154809786, 'colsample_bytree': 0.5529023320905938, 'reg_alpha': 0.0951706120962275, 'reg_lambda': 0.819368915956812}. Best is trial 72 with value: 0.3167420814479638.
[I 2024-10-21 16:22:52,696] Trial 85 finished with value: 0.32579185520361986 and parameters: {'boosting_type': 'dart', 'num_leaves': 172, 'learning_rate': 0.013373813964870218, 'n_estimators': 960, 'max_depth': 7, 'subsample': 0.8868950046456723, 'colsample_bytree': 0.5745208453299293, 'reg_alpha': 0.2445913201857593, 'reg_lambda': 0.7845316672821586}. Best is trial 72 with value: 0.3167420814479638.
[I 2024-10-21 16:22:57,483] Trial 86 finished with value: 0.31825037707390647 and parameters: {'boosting_type': 'dart', 'num_leaves': 128, 'learning_rate': 0.05992770062432838, 'n_estimators': 893, 'max_depth': 5, 'subsample': 0.8268203025863828, 'colsample_bytree': 0.5368275639454444, 'reg_alpha': 0.29721742842985466, 'reg_lambda': 0.8542980219770305}. Best is trial 72 with value: 0.3167420814479638.
[I 2024-10-21 16:22:59,004] Trial 87 finished with value: 0.3529411764705882 and parameters: {'boosting_type': 'gbdt', 'num_leaves': 200, 'learning_rate': 0.058292372033963945, 'n_estimators': 941, 'max_depth': 5, 'subsample': 0.8287629580357578, 'colsample_bytree': 0.5406959171926717, 'reg_alpha': 0.27163511008856245, 'reg_lambda': 0.868062484699495}. Best is trial 72 with value: 0.3167420814479638.
[I 2024-10-21 16:23:04,809] Trial 88 finished with value: 0.34238310708898945 and parameters: {'boosting_type': 'dart', 'num_leaves': 123, 'learning_rate': 0.08449107693050412, 'n_estimators': 895, 'max_depth': 6, 'subsample': 0.9171211440198793, 'colsample_bytree': 0.5124725551434764, 'reg_alpha': 0.15566268908662179, 'reg_lambda': 0.9279669110131521}. Best is trial 72 with value: 0.3167420814479638.
[I 2024-10-21 16:23:06,229] Trial 89 finished with value: 0.33484162895927605 and parameters: {'boosting_type': 'goss', 'num_leaves': 220, 'learning_rate': 0.030361881766157884, 'n_estimators': 849, 'max_depth': 6, 'subsample': 0.8480456023682662, 'colsample_bytree': 0.5334033117853897, 'reg_alpha': 0.21943914055475897, 'reg_lambda': 0.7305546276091208}. Best is trial 72 with value: 0.3167420814479638.
[I 2024-10-21 16:23:11,539] Trial 90 finished with value: 0.31825037707390647 and parameters: {'boosting_type': 'dart', 'num_leaves': 175, 'learning_rate': 0.045551797075661184, 'n_estimators': 716, 'max_depth': 7, 'subsample': 0.855531139762523, 'colsample_bytree': 0.5867342803853669, 'reg_alpha': 0.0632091148363339, 'reg_lambda': 0.7658188189420491}. Best is trial 72 with value: 0.3167420814479638.
[I 2024-10-21 16:23:19,279] Trial 91 finished with value: 0.33484162895927605 and parameters: {'boosting_type': 'dart', 'num_leaves': 175, 'learning_rate': 0.04849871293403819, 'n_estimators': 1000, 'max_depth': 7, 'subsample': 0.8388496663784273, 'colsample_bytree': 0.5883458182204016, 'reg_alpha': 0.054960213640654995, 'reg_lambda': 0.7603384753709544}. Best is trial 72 with value: 0.3167420814479638.
[I 2024-10-21 16:23:24,308] Trial 92 finished with value: 0.330316742081448 and parameters: {'boosting_type': 'dart', 'num_leaves': 187, 'learning_rate': 0.061741198081963475, 'n_estimators': 728, 'max_depth': 7, 'subsample': 0.8779854719288741, 'colsample_bytree': 0.568508438080644, 'reg_alpha': 0.1196603135246847, 'reg_lambda': 0.8961403941418173}. Best is trial 72 with value: 0.3167420814479638.
[I 2024-10-21 16:23:29,630] Trial 93 finished with value: 0.3212669683257918 and parameters: {'boosting_type': 'dart', 'num_leaves': 163, 'learning_rate': 0.041857280517050593, 'n_estimators': 824, 'max_depth': 6, 'subsample': 0.852667229488504, 'colsample_bytree': 0.5014480041333618, 'reg_alpha': 0.0990184110537437, 'reg_lambda': 0.8024216575831148}. Best is trial 72 with value: 0.3167420814479638.
[I 2024-10-21 16:23:34,937] Trial 94 finished with value: 0.3227752639517345 and parameters: {'boosting_type': 'dart', 'num_leaves': 156, 'learning_rate': 0.04202327733718825, 'n_estimators': 819, 'max_depth': 6, 'subsample': 0.8538569742062245, 'colsample_bytree': 0.5029472737482269, 'reg_alpha': 0.07165723014088222, 'reg_lambda': 0.8402448322244238}. Best is trial 72 with value: 0.3167420814479638.
[I 2024-10-21 16:23:43,384] Trial 95 finished with value: 0.33484162895927605 and parameters: {'boosting_type': 'dart', 'num_leaves': 144, 'learning_rate': 0.01059634696818752, 'n_estimators': 899, 'max_depth': 8, 'subsample': 0.8941950862663338, 'colsample_bytree': 0.5143680026600395, 'reg_alpha': 0.031377408956005395, 'reg_lambda': 0.7985163402296246}. Best is trial 72 with value: 0.3167420814479638.
[I 2024-10-21 16:23:49,576] Trial 96 finished with value: 0.31825037707390647 and parameters: {'boosting_type': 'dart', 'num_leaves': 163, 'learning_rate': 0.02522411674357966, 'n_estimators': 931, 'max_depth': 6, 'subsample': 0.8652172781895028, 'colsample_bytree': 0.80345742162374, 'reg_alpha': 0.0884299727347014, 'reg_lambda': 0.7579318900407856}. Best is trial 72 with value: 0.3167420814479638.
[I 2024-10-21 16:23:57,144] Trial 97 finished with value: 0.3092006033182504 and parameters: {'boosting_type': 'dart', 'num_leaves': 195, 'learning_rate': 0.021517575129460603, 'n_estimators': 937, 'max_depth': 7, 'subsample': 0.8700012310435822, 'colsample_bytree': 0.8469365078639839, 'reg_alpha': 0.3100486252804775, 'reg_lambda': 0.7537509823782487}. Best is trial 97 with value: 0.3092006033182504.
[I 2024-10-21 16:24:04,410] Trial 98 finished with value: 0.33484162895927605 and parameters: {'boosting_type': 'dart', 'num_leaves': 194, 'learning_rate': 0.10820728872172355, 'n_estimators': 929, 'max_depth': 7, 'subsample': 0.8678915423859779, 'colsample_bytree': 0.8277760803645475, 'reg_alpha': 0.293444557420284, 'reg_lambda': 0.676834653730777}. Best is trial 97 with value: 0.3092006033182504.
[I 2024-10-21 16:24:13,520] Trial 99 finished with value: 0.3393665158371041 and parameters: {'boosting_type': 'dart', 'num_leaves': 222, 'learning_rate': 0.08252522410047824, 'n_estimators': 977, 'max_depth': 8, 'subsample': 0.8189886272884799, 'colsample_bytree': 0.8370233300318616, 'reg_alpha': 0.37041293727866526, 'reg_lambda': 0.6408496057590318}. Best is trial 97 with value: 0.3092006033182504.
