[I 2024-10-22 10:59:25,526] Trial 54 finished with value: 0.3338323353293413 and parameters: {'boosting_type': 'gbdt', 'num_leaves': 25, 'learning_rate': 0.04157232277339734, 'n_estimators': 635, 'max_depth': 0, 'subsample': 0.8722147390589496, 'colsample_bytree': 0.937335434686576, 'reg_alpha': 0.9979575626978049, 'reg_lambda': 0.4366738044133986}. Best is trial 44 with value: 0.3338323353293413.
[I 2024-10-22 10:59:26,889] Trial 55 finished with value: 0.3293413173652695 and parameters: {'boosting_type': 'gbdt', 'num_leaves': 24, 'learning_rate': 0.04246184754267884, 'n_estimators': 739, 'max_depth': -1, 'subsample': 0.8704394459355786, 'colsample_bytree': 0.9463333375013556, 'reg_alpha': 0.9962624189088799, 'reg_lambda': 0.4367964445718045}. Best is trial 55 with value: 0.3293413173652695.
[I 2024-10-22 10:59:28,380] Trial 56 finished with value: 0.33982035928143717 and parameters: {'boosting_type': 'gbdt', 'num_leaves': 30, 'learning_rate': 0.03557370491755468, 'n_estimators': 732, 'max_depth': -1, 'subsample': 0.872058640719025, 'colsample_bytree': 0.6950848031505588, 'reg_alpha': 0.9948163330093573, 'reg_lambda': 0.4440916610218774}. Best is trial 55 with value: 0.3293413173652695.
[I 2024-10-22 10:59:29,775] Trial 57 finished with value: 0.3383233532934131 and parameters: {'boosting_type': 'gbdt', 'num_leaves': 23, 'learning_rate': 0.032053817487520606, 'n_estimators': 742, 'max_depth': -1, 'subsample': 0.8544006885107531, 'colsample_bytree': 0.9436722329824988, 'reg_alpha': 0.9970643715924181, 'reg_lambda': 0.4281448208230836}. Best is trial 55 with value: 0.3293413173652695.
[I 2024-10-22 10:59:31,143] Trial 58 finished with value: 0.3293413173652695 and parameters: {'boosting_type': 'gbdt', 'num_leaves': 23, 'learning_rate': 0.04032679531370857, 'n_estimators': 739, 'max_depth': -1, 'subsample': 0.8699899424751545, 'colsample_bytree': 0.9435913434919962, 'reg_alpha': 0.9944345959893058, 'reg_lambda': 0.4375314924048347}. Best is trial 55 with value: 0.3293413173652695.
[I 2024-10-22 10:59:31,887] Trial 59 finished with value: 0.35479041916167664 and parameters: {'boosting_type': 'goss', 'num_leaves': 12, 'learning_rate': 0.03901476089409153, 'n_estimators': 644, 'max_depth': -1, 'subsample': 0.6683018650825449, 'colsample_bytree': 0.9280244267080785, 'reg_alpha': 0.9524636612089369, 'reg_lambda': 0.2757820263707513}. Best is trial 55 with value: 0.3293413173652695.
[I 2024-10-22 10:59:32,875] Trial 60 finished with value: 0.3413173652694611 and parameters: {'boosting_type': 'gbdt', 'num_leaves': 21, 'learning_rate': 0.07797208036717805, 'n_estimators': 699, 'max_depth': -1, 'subsample': 0.8580170617260933, 'colsample_bytree': 0.9454045975800014, 'reg_alpha': 0.9336473558526605, 'reg_lambda': 0.3723233763119724}. Best is trial 55 with value: 0.3293413173652695.
[I 2024-10-22 10:59:34,364] Trial 61 finished with value: 0.34730538922155685 and parameters: {'boosting_type': 'gbdt', 'num_leaves': 27, 'learning_rate': 0.038257005470857024, 'n_estimators': 741, 'max_depth': -1, 'subsample': 0.8728200755975066, 'colsample_bytree': 0.8855767628782609, 'reg_alpha': 0.987121480486242, 'reg_lambda': 0.43475096045756034}. Best is trial 55 with value: 0.3293413173652695.
[I 2024-10-22 10:59:35,877] Trial 62 finished with value: 0.3323353293413174 and parameters: {'boosting_type': 'gbdt', 'num_leaves': 41, 'learning_rate': 0.04681184586673237, 'n_estimators': 821, 'max_depth': 0, 'subsample': 0.8230826163798393, 'colsample_bytree': 0.9434100355261024, 'reg_alpha': 0.9989743213699818, 'reg_lambda': 0.3926847189478705}. Best is trial 55 with value: 0.3293413173652695.
[I 2024-10-22 10:59:38,232] Trial 63 finished with value: 0.344311377245509 and parameters: {'boosting_type': 'gbdt', 'num_leaves': 41, 'learning_rate': 0.010733139194922497, 'n_estimators': 817, 'max_depth': 0, 'subsample': 0.8253589474759105, 'colsample_bytree': 0.9390817667214378, 'reg_alpha': 0.9608905804547319, 'reg_lambda': 0.40008173666549457}. Best is trial 55 with value: 0.3293413173652695.
[I 2024-10-22 10:59:39,109] Trial 64 finished with value: 0.344311377245509 and parameters: {'boosting_type': 'gbdt', 'num_leaves': 12, 'learning_rate': 0.053696259705095555, 'n_estimators': 681, 'max_depth': 0, 'subsample': 0.8031323060995227, 'colsample_bytree': 0.9520228210394184, 'reg_alpha': 0.9019314119287339, 'reg_lambda': 0.3333880019557289}. Best is trial 55 with value: 0.3293413173652695.
[I 2024-10-22 10:59:39,941] Trial 65 finished with value: 0.344311377245509 and parameters: {'boosting_type': 'gbdt', 'num_leaves': 55, 'learning_rate': 0.10063023216330869, 'n_estimators': 612, 'max_depth': 0, 'subsample': 0.8456568511833282, 'colsample_bytree': 0.9841091452673859, 'reg_alpha': 0.9907422018686114, 'reg_lambda': 0.48876170929808016}. Best is trial 55 with value: 0.3293413173652695.
[I 2024-10-22 10:59:46,499] Trial 66 finished with value: 0.344311377245509 and parameters: {'boosting_type': 'dart', 'num_leaves': 40, 'learning_rate': 0.029314351344115377, 'n_estimators': 763, 'max_depth': -1, 'subsample': 0.8864428197620599, 'colsample_bytree': 0.9792000714596687, 'reg_alpha': 0.9197699598856715, 'reg_lambda': 0.23035692577219422}. Best is trial 55 with value: 0.3293413173652695.
[I 2024-10-22 10:59:46,846] Trial 67 finished with value: 0.39520958083832336 and parameters: {'boosting_type': 'gbdt', 'num_leaves': 6, 'learning_rate': 0.07115654323219302, 'n_estimators': 836, 'max_depth': 1, 'subsample': 0.7875009661157577, 'colsample_bytree': 0.9252398107944254, 'reg_alpha': 0.9983312319736172, 'reg_lambda': 0.39188895230522997}. Best is trial 55 with value: 0.3293413173652695.
[I 2024-10-22 10:59:48,085] Trial 68 finished with value: 0.33083832335329344 and parameters: {'boosting_type': 'gbdt', 'num_leaves': 22, 'learning_rate': 0.04923414958309377, 'n_estimators': 711, 'max_depth': -1, 'subsample': 0.8200740986895992, 'colsample_bytree': 0.8525957092952761, 'reg_alpha': 0.872984253349061, 'reg_lambda': 0.5996937863643934}. Best is trial 55 with value: 0.3293413173652695.
[I 2024-10-22 10:59:49,297] Trial 69 finished with value: 0.3323353293413174 and parameters: {'boosting_type': 'gbdt', 'num_leaves': 22, 'learning_rate': 0.05401351293692867, 'n_estimators': 696, 'max_depth': 0, 'subsample': 0.8152990866292408, 'colsample_bytree': 0.9983627863468032, 'reg_alpha': 0.8772463945905863, 'reg_lambda': 0.451716885694487}. Best is trial 55 with value: 0.3293413173652695.
[I 2024-10-22 10:59:49,595] Trial 70 finished with value: 0.42664670658682635 and parameters: {'boosting_type': 'gbdt', 'num_leaves': 38, 'learning_rate': 0.04859816576070098, 'n_estimators': 704, 'max_depth': 1, 'subsample': 0.7630638015090706, 'colsample_bytree': 0.9991079608198573, 'reg_alpha': 0.8688978727701363, 'reg_lambda': 0.5873356089754138}. Best is trial 55 with value: 0.3293413173652695.
[I 2024-10-22 10:59:50,490] Trial 71 finished with value: 0.3323353293413174 and parameters: {'boosting_type': 'gbdt', 'num_leaves': 22, 'learning_rate': 0.08824620830341243, 'n_estimators': 655, 'max_depth': 0, 'subsample': 0.7364952912129835, 'colsample_bytree': 0.9724488677873961, 'reg_alpha': 0.9660063336848447, 'reg_lambda': 0.4591553431831085}. Best is trial 55 with value: 0.3293413173652695.
[I 2024-10-22 10:59:51,126] Trial 72 finished with value: 0.33532934131736525 and parameters: {'boosting_type': 'gbdt', 'num_leaves': 8, 'learning_rate': 0.09218529775298714, 'n_estimators': 656, 'max_depth': 0, 'subsample': 0.7338512299225443, 'colsample_bytree': 0.9684948078273313, 'reg_alpha': 0.926051545327213, 'reg_lambda': 0.4539009651562318}. Best is trial 55 with value: 0.3293413173652695.
[I 2024-10-22 10:59:52,064] Trial 73 finished with value: 0.344311377245509 and parameters: {'boosting_type': 'gbdt', 'num_leaves': 18, 'learning_rate': 0.059675560813507875, 'n_estimators': 586, 'max_depth': 0, 'subsample': 0.8182171032163703, 'colsample_bytree': 0.9745621252843819, 'reg_alpha': 0.8813350552318331, 'reg_lambda': 0.4952216491812659}. Best is trial 55 with value: 0.3293413173652695.
[I 2024-10-22 10:59:52,323] Trial 74 finished with value: 0.4011976047904192 and parameters: {'boosting_type': 'gbdt', 'num_leaves': 61, 'learning_rate': 0.07997214364487594, 'n_estimators': 614, 'max_depth': 1, 'subsample': 0.7413789825681699, 'colsample_bytree': 0.9013030557255596, 'reg_alpha': 0.957928277379669, 'reg_lambda': 0.362584693697112}. Best is trial 55 with value: 0.3293413173652695.
[I 2024-10-22 10:59:52,765] Trial 75 finished with value: 0.37574850299401197 and parameters: {'boosting_type': 'gbdt', 'num_leaves': 44, 'learning_rate': 0.04620530031976189, 'n_estimators': 810, 'max_depth': 2, 'subsample': 0.7122252237948445, 'colsample_bytree': 0.9153396496046766, 'reg_alpha': 0.8356009450615182, 'reg_lambda': 0.40072332382017284}. Best is trial 55 with value: 0.3293413173652695.
[I 2024-10-22 10:59:53,076] Trial 76 finished with value: 0.4446107784431138 and parameters: {'boosting_type': 'gbdt', 'num_leaves': 2, 'learning_rate': 0.017866749373195323, 'n_estimators': 767, 'max_depth': 0, 'subsample': 0.6862522247801561, 'colsample_bytree': 0.8575217226470689, 'reg_alpha': 0.9722085329462944, 'reg_lambda': 0.5016972340059569}. Best is trial 55 with value: 0.3293413173652695.
[I 2024-10-22 10:59:54,176] Trial 77 finished with value: 0.36227544910179643 and parameters: {'boosting_type': 'goss', 'num_leaves': 26, 'learning_rate': 0.06515908062222531, 'n_estimators': 670, 'max_depth': -1, 'subsample': 0.7754140457856893, 'colsample_bytree': 0.9544672336971177, 'reg_alpha': 0.9338404137519338, 'reg_lambda': 0.6118730521167488}. Best is trial 55 with value: 0.3293413173652695.
[I 2024-10-22 10:59:55,129] Trial 78 finished with value: 0.3488023952095808 and parameters: {'boosting_type': 'gbdt', 'num_leaves': 35, 'learning_rate': 0.08863613165015344, 'n_estimators': 703, 'max_depth': 0, 'subsample': 0.8120399343572594, 'colsample_bytree': 0.8881494059343126, 'reg_alpha': 0.9035006560314849, 'reg_lambda': 0.4600016298716011}. Best is trial 55 with value: 0.3293413173652695.
[I 2024-10-22 10:59:56,751] Trial 79 finished with value: 0.4161676646706587 and parameters: {'boosting_type': 'dart', 'num_leaves': 52, 'learning_rate': 0.025992337653008762, 'n_estimators': 642, 'max_depth': 3, 'subsample': 0.7549281689788603, 'colsample_bytree': 0.9331446398358217, 'reg_alpha': 0.9654919567607787, 'reg_lambda': 0.3337991756171173}. Best is trial 55 with value: 0.3293413173652695.
[I 2024-10-22 10:59:56,990] Trial 80 finished with value: 0.4296407185628742 and parameters: {'boosting_type': 'gbdt', 'num_leaves': 16, 'learning_rate': 0.048186320933915644, 'n_estimators': 529, 'max_depth': 1, 'subsample': 0.7897114618671452, 'colsample_bytree': 0.9752179949520796, 'reg_alpha': 0.9292926897541685, 'reg_lambda': 0.2799443739963726}. Best is trial 55 with value: 0.3293413173652695.
[I 2024-10-22 10:59:57,582] Trial 81 finished with value: 0.3458083832335329 and parameters: {'boosting_type': 'gbdt', 'num_leaves': 7, 'learning_rate': 0.10742644930127773, 'n_estimators': 668, 'max_depth': 0, 'subsample': 0.7361677796427379, 'colsample_bytree': 0.9651674149250067, 'reg_alpha': 0.9231758760063427, 'reg_lambda': 0.4628415612299817}. Best is trial 55 with value: 0.3293413173652695.
[I 2024-10-22 10:59:58,176] Trial 82 finished with value: 0.35029940119760483 and parameters: {'boosting_type': 'gbdt', 'num_leaves': 9, 'learning_rate': 0.09096275535153586, 'n_estimators': 573, 'max_depth': 0, 'subsample': 0.6979345359158807, 'colsample_bytree': 0.9857453048459413, 'reg_alpha': 0.8818021362238614, 'reg_lambda': 0.4441841332912555}. Best is trial 55 with value: 0.3293413173652695.
[I 2024-10-22 10:59:59,254] Trial 83 finished with value: 0.3323353293413174 and parameters: {'boosting_type': 'gbdt', 'num_leaves': 19, 'learning_rate': 0.07159569111307956, 'n_estimators': 634, 'max_depth': -1, 'subsample': 0.7170065894025132, 'colsample_bytree': 0.9469440855147451, 'reg_alpha': 0.969827399036519, 'reg_lambda': 0.41285547445239074}. Best is trial 55 with value: 0.3293413173652695.
[I 2024-10-22 11:00:00,323] Trial 84 finished with value: 0.32784431137724546 and parameters: {'boosting_type': 'gbdt', 'num_leaves': 22, 'learning_rate': 0.06883433624126407, 'n_estimators': 605, 'max_depth': -1, 'subsample': 0.6421730344732294, 'colsample_bytree': 0.9446405508771969, 'reg_alpha': 0.9647999298682268, 'reg_lambda': 0.3749140419631136}. Best is trial 84 with value: 0.32784431137724546.
[I 2024-10-22 11:00:01,253] Trial 85 finished with value: 0.3323353293413174 and parameters: {'boosting_type': 'gbdt', 'num_leaves': 17, 'learning_rate': 0.07262609848866558, 'n_estimators': 607, 'max_depth': -1, 'subsample': 0.7183007598788774, 'colsample_bytree': 0.9995789520943328, 'reg_alpha': 0.9532336199332135, 'reg_lambda': 0.3714943511395704}. Best is trial 84 with value: 0.32784431137724546.
[I 2024-10-22 11:00:02,361] Trial 86 finished with value: 0.344311377245509 and parameters: {'boosting_type': 'gbdt', 'num_leaves': 47, 'learning_rate': 0.07447255085204357, 'n_estimators': 784, 'max_depth': -1, 'subsample': 0.6691467515053956, 'colsample_bytree': 0.9972561554435008, 'reg_alpha': 0.9672440109910557, 'reg_lambda': 0.31306959493914444}. Best is trial 84 with value: 0.32784431137724546.
[I 2024-10-22 11:00:03,522] Trial 87 finished with value: 0.3368263473053892 and parameters: {'boosting_type': 'gbdt', 'num_leaves': 31, 'learning_rate': 0.06451156650530292, 'n_estimators': 598, 'max_depth': -1, 'subsample': 0.5832198699587251, 'colsample_bytree': 0.9516764947303348, 'reg_alpha': 0.8398480506752279, 'reg_lambda': 0.3736268012428989}. Best is trial 84 with value: 0.32784431137724546.
[I 2024-10-22 11:00:04,924] Trial 88 finished with value: 0.32784431137724546 and parameters: {'boosting_type': 'gbdt', 'num_leaves': 35, 'learning_rate': 0.05209809308719354, 'n_estimators': 711, 'max_depth': -1, 'subsample': 0.6324312257371834, 'colsample_bytree': 0.9617924844633509, 'reg_alpha': 0.9023500526016142, 'reg_lambda': 0.4086851705561554}. Best is trial 84 with value: 0.32784431137724546.
[I 2024-10-22 11:00:06,814] Trial 89 finished with value: 0.35029940119760483 and parameters: {'boosting_type': 'gbdt', 'num_leaves': 40, 'learning_rate': 0.024169770585817457, 'n_estimators': 710, 'max_depth': -1, 'subsample': 0.6455690979352364, 'colsample_bytree': 0.918699534817415, 'reg_alpha': 0.9055862038701719, 'reg_lambda': 0.3462011396705742}. Best is trial 84 with value: 0.32784431137724546.
[I 2024-10-22 11:00:08,292] Trial 90 finished with value: 0.33532934131736525 and parameters: {'boosting_type': 'gbdt', 'num_leaves': 35, 'learning_rate': 0.05102907972240926, 'n_estimators': 855, 'max_depth': -1, 'subsample': 0.612792969524343, 'colsample_bytree': 0.8946878089004672, 'reg_alpha': 0.8738129237646567, 'reg_lambda': 0.5182048095502799}. Best is trial 84 with value: 0.32784431137724546.
[I 2024-10-22 11:00:09,272] Trial 91 finished with value: 0.3413173652694611 and parameters: {'boosting_type': 'gbdt', 'num_leaves': 18, 'learning_rate': 0.07422985505275892, 'n_estimators': 688, 'max_depth': -1, 'subsample': 0.6443672951697483, 'colsample_bytree': 0.9600082739557453, 'reg_alpha': 0.9714481264604679, 'reg_lambda': 0.408228035548658}. Best is trial 84 with value: 0.32784431137724546.
[I 2024-10-22 11:00:10,436] Trial 92 finished with value: 0.32335329341317365 and parameters: {'boosting_type': 'gbdt', 'num_leaves': 25, 'learning_rate': 0.05593950235182082, 'n_estimators': 622, 'max_depth': -1, 'subsample': 0.5966281950041213, 'colsample_bytree': 0.9707140036547987, 'reg_alpha': 0.9462556838503537, 'reg_lambda': 0.3829045609871629}. Best is trial 92 with value: 0.32335329341317365.
[I 2024-10-22 11:00:11,674] Trial 93 finished with value: 0.3383233532934131 and parameters: {'boosting_type': 'gbdt', 'num_leaves': 23, 'learning_rate': 0.055415774510356924, 'n_estimators': 719, 'max_depth': -1, 'subsample': 0.599574245105974, 'colsample_bytree': 0.9737793460731655, 'reg_alpha': 0.9435445855857637, 'reg_lambda': 0.4800788400039727}. Best is trial 92 with value: 0.32335329341317365.
[I 2024-10-22 11:00:13,429] Trial 94 finished with value: 0.35179640718562877 and parameters: {'boosting_type': 'gbdt', 'num_leaves': 29, 'learning_rate': 0.013104449415626405, 'n_estimators': 755, 'max_depth': 0, 'subsample': 0.5005369723186647, 'colsample_bytree': 0.9476161059289376, 'reg_alpha': 0.9083881758852105, 'reg_lambda': 0.4122736658984604}. Best is trial 92 with value: 0.32335329341317365.
[I 2024-10-22 11:00:14,598] Trial 95 finished with value: 0.35029940119760483 and parameters: {'boosting_type': 'gbdt', 'num_leaves': 61, 'learning_rate': 0.08343674350010594, 'n_estimators': 895, 'max_depth': -1, 'subsample': 0.5819484720519628, 'colsample_bytree': 0.9873387362804252, 'reg_alpha': 0.8255141999518708, 'reg_lambda': 0.38701500937430483}. Best is trial 92 with value: 0.32335329341317365.
[I 2024-10-22 11:00:15,883] Trial 96 finished with value: 0.36377245508982037 and parameters: {'boosting_type': 'goss', 'num_leaves': 71, 'learning_rate': 0.10537080828190774, 'n_estimators': 794, 'max_depth': 0, 'subsample': 0.7968072291929528, 'colsample_bytree': 0.962318495304575, 'reg_alpha': 0.9725042109295713, 'reg_lambda': 0.5585431990089322}. Best is trial 92 with value: 0.32335329341317365.
[I 2024-10-22 11:00:17,785] Trial 97 finished with value: 0.33982035928143717 and parameters: {'boosting_type': 'gbdt', 'num_leaves': 47, 'learning_rate': 0.025824667981343877, 'n_estimators': 663, 'max_depth': -1, 'subsample': 0.6275318001252982, 'colsample_bytree': 0.9352456172059268, 'reg_alpha': 0.8949447966742631, 'reg_lambda': 0.3170114328383718}. Best is trial 92 with value: 0.32335329341317365.
[I 2024-10-22 11:00:23,015] Trial 98 finished with value: 0.3413173652694611 and parameters: {'boosting_type': 'dart', 'num_leaves': 35, 'learning_rate': 0.04046282356800142, 'n_estimators': 687, 'max_depth': 0, 'subsample': 0.7728547517341479, 'colsample_bytree': 0.8778477804509467, 'reg_alpha': 0.8552265844976756, 'reg_lambda': 0.26983669224687457}. Best is trial 92 with value: 0.32335329341317365.
[I 2024-10-22 11:00:24,082] Trial 99 finished with value: 0.33083832335329344 and parameters: {'boosting_type': 'gbdt', 'num_leaves': 22, 'learning_rate': 0.06072556521148682, 'n_estimators': 624, 'max_depth': -1, 'subsample': 0.5584412069911648, 'colsample_bytree': 0.9226209812234709, 'reg_alpha': 0.9430482746535063, 'reg_lambda': 0.35018620583839327}. Best is trial 92 with value: 0.32335329341317365.
