[I 2024-10-21 16:20:12,695] A new study created in memory with name: no-name-3e874bb3-04da-42a6-b6d2-ad2d845e6b6d
[I 2024-10-21 16:20:13,437] Trial 0 finished with value: 0.34087481146304677 and parameters: {'boosting_type': 'dart', 'num_leaves': 133, 'learning_rate': 0.3723936895116094, 'n_estimators': 154, 'max_depth': 9, 'subsample': 0.5314370854510568, 'colsample_bytree': 0.8769859370376275, 'reg_alpha': 0.5972742457197822, 'reg_lambda': 0.7542250162334591}. Best is trial 0 with value: 0.34087481146304677.
[I 2024-10-21 16:20:13,804] Trial 1 finished with value: 0.36651583710407243 and parameters: {'boosting_type': 'gbdt', 'num_leaves': 144, 'learning_rate': 0.4319675180231198, 'n_estimators': 881, 'max_depth': 1, 'subsample': 0.6090602062928125, 'colsample_bytree': 0.8549495706066266, 'reg_alpha': 0.40903773568153734, 'reg_lambda': 0.22628225189701545}. Best is trial 0 with value: 0.34087481146304677.
[I 2024-10-21 16:20:14,064] Trial 2 finished with value: 0.3544494720965309 and parameters: {'boosting_type': 'gbdt', 'num_leaves': 192, 'learning_rate': 0.4768728419021933, 'n_estimators': 155, 'max_depth': 6, 'subsample': 0.5870603892550436, 'colsample_bytree': 0.9493711592656566, 'reg_alpha': 0.5839855543483772, 'reg_lambda': 0.3075828348917611}. Best is trial 0 with value: 0.34087481146304677.
[I 2024-10-21 16:20:14,389] Trial 3 finished with value: 0.3680241327300151 and parameters: {'boosting_type': 'goss', 'num_leaves': 247, 'learning_rate': 0.21690137024877224, 'n_estimators': 908, 'max_depth': 1, 'subsample': 0.9717026412540746, 'colsample_bytree': 0.7993997752744734, 'reg_alpha': 0.7536976747399138, 'reg_lambda': 0.2592504653272858}. Best is trial 0 with value: 0.34087481146304677.
[I 2024-10-21 16:20:14,677] Trial 4 finished with value: 0.3770739064856712 and parameters: {'boosting_type': 'goss', 'num_leaves': 115, 'learning_rate': 0.4318448308926522, 'n_estimators': 604, 'max_depth': 1, 'subsample': 0.6835335907293227, 'colsample_bytree': 0.9556569969913371, 'reg_alpha': 0.6762830192373687, 'reg_lambda': 0.9275602103897481}. Best is trial 0 with value: 0.34087481146304677.
[I 2024-10-21 16:20:24,342] Trial 5 finished with value: 0.3378582202111614 and parameters: {'boosting_type': 'dart', 'num_leaves': 212, 'learning_rate': 0.09898255057860719, 'n_estimators': 838, 'max_depth': -1, 'subsample': 0.9253343380147374, 'colsample_bytree': 0.6873976575584666, 'reg_alpha': 0.5512339101591915, 'reg_lambda': 0.6880474488557695}. Best is trial 5 with value: 0.3378582202111614.
[I 2024-10-21 16:20:24,793] Trial 6 finished with value: 0.34238310708898945 and parameters: {'boosting_type': 'gbdt', 'num_leaves': 153, 'learning_rate': 0.32402706195436953, 'n_estimators': 716, 'max_depth': 9, 'subsample': 0.6790910955513787, 'colsample_bytree': 0.8765145106573786, 'reg_alpha': 0.8554524604243622, 'reg_lambda': 0.7250001469608253}. Best is trial 5 with value: 0.3378582202111614.
[I 2024-10-21 16:20:25,057] Trial 7 finished with value: 0.34841628959276016 and parameters: {'boosting_type': 'gbdt', 'num_leaves': 5, 'learning_rate': 0.11292679056221151, 'n_estimators': 506, 'max_depth': 2, 'subsample': 0.6124063764719181, 'colsample_bytree': 0.954854752013641, 'reg_alpha': 0.03430305461500982, 'reg_lambda': 0.19868955654105624}. Best is trial 5 with value: 0.3378582202111614.
[I 2024-10-21 16:20:25,502] Trial 8 finished with value: 0.3604826546003017 and parameters: {'boosting_type': 'goss', 'num_leaves': 197, 'learning_rate': 0.4576645742227204, 'n_estimators': 294, 'max_depth': 0, 'subsample': 0.9834598023509162, 'colsample_bytree': 0.9293193974307324, 'reg_alpha': 0.7939536355251171, 'reg_lambda': 0.23334146395867406}. Best is trial 5 with value: 0.3378582202111614.
[I 2024-10-21 16:20:26,101] Trial 9 finished with value: 0.3453996983408748 and parameters: {'boosting_type': 'gbdt', 'num_leaves': 3, 'learning_rate': 0.07362425101245496, 'n_estimators': 980, 'max_depth': 8, 'subsample': 0.6390106714693831, 'colsample_bytree': 0.5101158320728088, 'reg_alpha': 0.11299105370119789, 'reg_lambda': 0.9243288426315811}. Best is trial 5 with value: 0.3378582202111614.
[I 2024-10-21 16:20:29,011] Trial 10 finished with value: 0.38763197586726994 and parameters: {'boosting_type': 'dart', 'num_leaves': 250, 'learning_rate': 0.013344840135658634, 'n_estimators': 757, 'max_depth': 4, 'subsample': 0.8499384351151911, 'colsample_bytree': 0.6509861953070831, 'reg_alpha': 0.3486177845310356, 'reg_lambda': 0.5083805548128426}. Best is trial 5 with value: 0.3378582202111614.
[I 2024-10-21 16:20:29,207] Trial 11 finished with value: 0.3318250377073907 and parameters: {'boosting_type': 'dart', 'num_leaves': 85, 'learning_rate': 0.3006392222403399, 'n_estimators': 45, 'max_depth': 10, 'subsample': 0.842181880012012, 'colsample_bytree': 0.6941716456647503, 'reg_alpha': 0.49955829466801027, 'reg_lambda': 0.6561907025854047}. Best is trial 11 with value: 0.3318250377073907.
[I 2024-10-21 16:20:30,460] Trial 12 finished with value: 0.32730015082956254 and parameters: {'boosting_type': 'dart', 'num_leaves': 68, 'learning_rate': 0.20187110443522494, 'n_estimators': 371, 'max_depth': 5, 'subsample': 0.8468165597016796, 'colsample_bytree': 0.6706530294795213, 'reg_alpha': 0.32698962096432965, 'reg_lambda': 0.5732055644175342}. Best is trial 12 with value: 0.32730015082956254.
[I 2024-10-21 16:20:30,525] Trial 13 finished with value: 0.38612368024132726 and parameters: {'boosting_type': 'dart', 'num_leaves': 75, 'learning_rate': 0.2243546857264192, 'n_estimators': 13, 'max_depth': 6, 'subsample': 0.8178767352125347, 'colsample_bytree': 0.598427627030043, 'reg_alpha': 0.2550536951557711, 'reg_lambda': 0.48831078672345307}. Best is trial 12 with value: 0.32730015082956254.
[I 2024-10-21 16:20:33,369] Trial 14 finished with value: 0.3589743589743589 and parameters: {'boosting_type': 'dart', 'num_leaves': 72, 'learning_rate': 0.29043619410689925, 'n_estimators': 400, 'max_depth': 10, 'subsample': 0.7856272768706848, 'colsample_bytree': 0.7282435112859134, 'reg_alpha': 0.23008697214682336, 'reg_lambda': 0.006628897324206573}. Best is trial 12 with value: 0.32730015082956254.
[I 2024-10-21 16:20:33,434] Trial 15 finished with value: 0.39517345399698345 and parameters: {'boosting_type': 'dart', 'num_leaves': 51, 'learning_rate': 0.16764596751500777, 'n_estimators': 17, 'max_depth': 4, 'subsample': 0.8810257881638162, 'colsample_bytree': 0.5964438620873834, 'reg_alpha': 0.42185467669582744, 'reg_lambda': 0.55656737253931}. Best is trial 12 with value: 0.32730015082956254.
[I 2024-10-21 16:20:34,743] Trial 16 finished with value: 0.3378582202111614 and parameters: {'boosting_type': 'dart', 'num_leaves': 103, 'learning_rate': 0.34535123240853166, 'n_estimators': 291, 'max_depth': 7, 'subsample': 0.7389077438248011, 'colsample_bytree': 0.7840664380806138, 'reg_alpha': 0.29806126015653583, 'reg_lambda': 0.6185389662465247}. Best is trial 12 with value: 0.32730015082956254.
[I 2024-10-21 16:20:35,205] Trial 17 finished with value: 0.3212669683257918 and parameters: {'boosting_type': 'dart', 'num_leaves': 41, 'learning_rate': 0.27332767603988006, 'n_estimators': 179, 'max_depth': 5, 'subsample': 0.8973515922329085, 'colsample_bytree': 0.6228151441982896, 'reg_alpha': 0.4780277952268321, 'reg_lambda': 0.3968509321360135}. Best is trial 17 with value: 0.3212669683257918.
[I 2024-10-21 16:20:36,048] Trial 18 finished with value: 0.3469079939668175 and parameters: {'boosting_type': 'dart', 'num_leaves': 42, 'learning_rate': 0.16605182114812236, 'n_estimators': 372, 'max_depth': 3, 'subsample': 0.914529221891257, 'colsample_bytree': 0.5272336240471945, 'reg_alpha': 0.9908075717603412, 'reg_lambda': 0.38808533584655147}. Best is trial 17 with value: 0.3212669683257918.
[I 2024-10-21 16:20:36,658] Trial 19 finished with value: 0.3227752639517345 and parameters: {'boosting_type': 'dart', 'num_leaves': 37, 'learning_rate': 0.2592616235394247, 'n_estimators': 202, 'max_depth': 5, 'subsample': 0.7598388709738262, 'colsample_bytree': 0.5911036534015137, 'reg_alpha': 0.20918267800980128, 'reg_lambda': 0.4214295256572003}. Best is trial 17 with value: 0.3212669683257918.
[I 2024-10-21 16:20:36,943] Trial 20 finished with value: 0.35595776772247356 and parameters: {'boosting_type': 'goss', 'num_leaves': 30, 'learning_rate': 0.26164730112232065, 'n_estimators': 174, 'max_depth': 5, 'subsample': 0.7372640035660939, 'colsample_bytree': 0.5784231597604104, 'reg_alpha': 0.14376982839748997, 'reg_lambda': 0.09448980278276353}. Best is trial 17 with value: 0.3212669683257918.
[I 2024-10-21 16:20:37,712] Trial 21 finished with value: 0.3227752639517345 and parameters: {'boosting_type': 'dart', 'num_leaves': 35, 'learning_rate': 0.19032615315418716, 'n_estimators': 262, 'max_depth': 5, 'subsample': 0.7696682608748866, 'colsample_bytree': 0.627925499365408, 'reg_alpha': 0.43695790917577126, 'reg_lambda': 0.3827435253115391}. Best is trial 17 with value: 0.3212669683257918.
[I 2024-10-21 16:20:38,179] Trial 22 finished with value: 0.3544494720965309 and parameters: {'boosting_type': 'dart', 'num_leaves': 29, 'learning_rate': 0.25120555650176485, 'n_estimators': 268, 'max_depth': 3, 'subsample': 0.7835627336880051, 'colsample_bytree': 0.6237249176297736, 'reg_alpha': 0.45026744171609756, 'reg_lambda': 0.3987021038801287}. Best is trial 17 with value: 0.3212669683257918.
[I 2024-10-21 16:20:38,894] Trial 23 finished with value: 0.32880844645550533 and parameters: {'boosting_type': 'dart', 'num_leaves': 21, 'learning_rate': 0.377868450175293, 'n_estimators': 210, 'max_depth': 6, 'subsample': 0.7154996150431234, 'colsample_bytree': 0.5589746166600268, 'reg_alpha': 0.1451823163705157, 'reg_lambda': 0.41598251930497426}. Best is trial 17 with value: 0.3212669683257918.
[I 2024-10-21 16:20:41,408] Trial 24 finished with value: 0.3393665158371041 and parameters: {'boosting_type': 'dart', 'num_leaves': 51, 'learning_rate': 0.16387586011883615, 'n_estimators': 476, 'max_depth': 7, 'subsample': 0.8031046997709277, 'colsample_bytree': 0.6295625609324276, 'reg_alpha': 0.6762051925673751, 'reg_lambda': 0.32993253086661295}. Best is trial 17 with value: 0.3212669683257918.
[I 2024-10-21 16:20:41,557] Trial 25 finished with value: 0.35746606334841624 and parameters: {'boosting_type': 'dart', 'num_leaves': 99, 'learning_rate': 0.26764075697894785, 'n_estimators': 87, 'max_depth': 3, 'subsample': 0.9047101687124853, 'colsample_bytree': 0.5511462251701559, 'reg_alpha': 0.21108043385491923, 'reg_lambda': 0.4666583393114737}. Best is trial 17 with value: 0.3212669683257918.
[I 2024-10-21 16:20:42,223] Trial 26 finished with value: 0.32579185520361986 and parameters: {'boosting_type': 'dart', 'num_leaves': 54, 'learning_rate': 0.19521833093813107, 'n_estimators': 236, 'max_depth': 5, 'subsample': 0.7673179919868729, 'colsample_bytree': 0.7254447783837291, 'reg_alpha': 0.006470166963765678, 'reg_lambda': 0.15447250719169714}. Best is trial 17 with value: 0.3212669683257918.
[I 2024-10-21 16:20:42,560] Trial 27 finished with value: 0.3318250377073907 and parameters: {'boosting_type': 'dart', 'num_leaves': 22, 'learning_rate': 0.13069835970733482, 'n_estimators': 114, 'max_depth': 7, 'subsample': 0.6830876465646885, 'colsample_bytree': 0.6388023004452518, 'reg_alpha': 0.37106259115881257, 'reg_lambda': 0.34248949885816554}. Best is trial 17 with value: 0.3212669683257918.
[I 2024-10-21 16:20:44,021] Trial 28 finished with value: 0.3469079939668175 and parameters: {'boosting_type': 'dart', 'num_leaves': 88, 'learning_rate': 0.3334747528367877, 'n_estimators': 483, 'max_depth': 4, 'subsample': 0.8882357790733467, 'colsample_bytree': 0.7646872223719859, 'reg_alpha': 0.5024099056440138, 'reg_lambda': 0.8273220454216831}. Best is trial 17 with value: 0.3212669683257918.
[I 2024-10-21 16:20:44,587] Trial 29 finished with value: 0.3529411764705882 and parameters: {'boosting_type': 'goss', 'num_leaves': 129, 'learning_rate': 0.35885678954990274, 'n_estimators': 326, 'max_depth': 6, 'subsample': 0.9487335119984536, 'colsample_bytree': 0.5410846185160706, 'reg_alpha': 0.6417696031694671, 'reg_lambda': 0.44199880300380945}. Best is trial 17 with value: 0.3212669683257918.
[I 2024-10-21 16:20:45,082] Trial 30 finished with value: 0.3378582202111614 and parameters: {'boosting_type': 'dart', 'num_leaves': 166, 'learning_rate': 0.24025634780930288, 'n_estimators': 125, 'max_depth': 8, 'subsample': 0.5382220496408104, 'colsample_bytree': 0.6014745554727986, 'reg_alpha': 0.5079771911123281, 'reg_lambda': 0.5406724197412327}. Best is trial 17 with value: 0.3212669683257918.
[I 2024-10-21 16:20:45,679] Trial 31 finished with value: 0.3393665158371041 and parameters: {'boosting_type': 'dart', 'num_leaves': 56, 'learning_rate': 0.19184114880922368, 'n_estimators': 216, 'max_depth': 5, 'subsample': 0.7685897354747135, 'colsample_bytree': 0.7343049267890961, 'reg_alpha': 0.0031560620748489754, 'reg_lambda': 0.15835695999214658}. Best is trial 17 with value: 0.3212669683257918.
[I 2024-10-21 16:20:46,343] Trial 32 finished with value: 0.3318250377073907 and parameters: {'boosting_type': 'dart', 'num_leaves': 36, 'learning_rate': 0.29668384683665905, 'n_estimators': 238, 'max_depth': 5, 'subsample': 0.707663917250974, 'colsample_bytree': 0.7037953412171822, 'reg_alpha': 0.07793628031815991, 'reg_lambda': 0.11858934060040471}. Best is trial 17 with value: 0.3212669683257918.
[I 2024-10-21 16:20:46,780] Trial 33 finished with value: 0.34238310708898945 and parameters: {'boosting_type': 'dart', 'num_leaves': 15, 'learning_rate': 0.13741851783806885, 'n_estimators': 185, 'max_depth': 4, 'subsample': 0.7571679925387409, 'colsample_bytree': 0.8195035428133179, 'reg_alpha': 0.19982794867172496, 'reg_lambda': 0.2913320828470057}. Best is trial 17 with value: 0.3212669683257918.
[I 2024-10-21 16:20:46,987] Trial 34 finished with value: 0.34087481146304677 and parameters: {'boosting_type': 'gbdt', 'num_leaves': 60, 'learning_rate': 0.3943037298181686, 'n_estimators': 97, 'max_depth': 6, 'subsample': 0.8336026494105165, 'colsample_bytree': 0.6525927043946167, 'reg_alpha': 0.2791296653219537, 'reg_lambda': 0.007935543051456828}. Best is trial 17 with value: 0.3212669683257918.
[I 2024-10-21 16:20:47,876] Trial 35 finished with value: 0.3514328808446455 and parameters: {'boosting_type': 'dart', 'num_leaves': 41, 'learning_rate': 0.1957193699404053, 'n_estimators': 436, 'max_depth': 3, 'subsample': 0.6498462919667543, 'colsample_bytree': 0.71252741777098, 'reg_alpha': 0.05882126623401223, 'reg_lambda': 0.3619770412179689}. Best is trial 17 with value: 0.3212669683257918.
[I 2024-10-21 16:20:50,277] Trial 36 finished with value: 0.3453996983408748 and parameters: {'boosting_type': 'dart', 'num_leaves': 120, 'learning_rate': 0.23716481763664765, 'n_estimators': 569, 'max_depth': 5, 'subsample': 0.8722414125271073, 'colsample_bytree': 0.8299270546764678, 'reg_alpha': 0.38722665475061424, 'reg_lambda': 0.2727405361550115}. Best is trial 17 with value: 0.3212669683257918.
[I 2024-10-21 16:20:50,485] Trial 37 finished with value: 0.38612368024132726 and parameters: {'boosting_type': 'goss', 'num_leaves': 11, 'learning_rate': 0.07059669685002534, 'n_estimators': 336, 'max_depth': 2, 'subsample': 0.8098438460855566, 'colsample_bytree': 0.6724463243332963, 'reg_alpha': 0.6109900243361241, 'reg_lambda': 0.1747676610691678}. Best is trial 17 with value: 0.3212669683257918.
[I 2024-10-21 16:20:50,609] Trial 38 finished with value: 0.3544494720965309 and parameters: {'boosting_type': 'gbdt', 'num_leaves': 82, 'learning_rate': 0.27371641008036307, 'n_estimators': 153, 'max_depth': 2, 'subsample': 0.715199910533715, 'colsample_bytree': 0.7520433445563379, 'reg_alpha': 0.17487180992899187, 'reg_lambda': 0.08567237677005246}. Best is trial 17 with value: 0.3212669683257918.
[I 2024-10-21 16:20:51,801] Trial 39 finished with value: 0.3438914027149321 and parameters: {'boosting_type': 'dart', 'num_leaves': 45, 'learning_rate': 0.2117023270205775, 'n_estimators': 249, 'max_depth': 8, 'subsample': 0.9569025406519183, 'colsample_bytree': 0.57331312431838, 'reg_alpha': 0.570697255868873, 'reg_lambda': 0.22262171269172054}. Best is trial 17 with value: 0.3212669683257918.
[I 2024-10-21 16:20:52,028] Trial 40 finished with value: 0.3242835595776772 and parameters: {'boosting_type': 'dart', 'num_leaves': 147, 'learning_rate': 0.31929684497784167, 'n_estimators': 72, 'max_depth': 7, 'subsample': 0.5772494274768859, 'colsample_bytree': 0.6122582213406343, 'reg_alpha': 0.45490793308249566, 'reg_lambda': 0.31149892191429784}. Best is trial 17 with value: 0.3212669683257918.
[I 2024-10-21 16:20:52,276] Trial 41 finished with value: 0.32579185520361986 and parameters: {'boosting_type': 'dart', 'num_leaves': 149, 'learning_rate': 0.32181097251556334, 'n_estimators': 80, 'max_depth': 7, 'subsample': 0.5018578745494038, 'colsample_bytree': 0.6030454146325089, 'reg_alpha': 0.45068644927433993, 'reg_lambda': 0.2946346851111274}. Best is trial 17 with value: 0.3212669683257918.
[I 2024-10-21 16:20:52,795] Trial 42 finished with value: 0.330316742081448 and parameters: {'boosting_type': 'dart', 'num_leaves': 169, 'learning_rate': 0.3111104683399051, 'n_estimators': 152, 'max_depth': 6, 'subsample': 0.6080289362274285, 'colsample_bytree': 0.5064134438313459, 'reg_alpha': 0.5290102627702262, 'reg_lambda': 0.4466845728940911}. Best is trial 17 with value: 0.3212669683257918.
[I 2024-10-21 16:20:52,911] Trial 43 finished with value: 0.34992458521870284 and parameters: {'boosting_type': 'dart', 'num_leaves': 139, 'learning_rate': 0.40055855198292756, 'n_estimators': 59, 'max_depth': 4, 'subsample': 0.9954841364552358, 'colsample_bytree': 0.6200027891618476, 'reg_alpha': 0.4425808170368761, 'reg_lambda': 0.25373880740373306}. Best is trial 17 with value: 0.3212669683257918.
[I 2024-10-21 16:20:53,256] Trial 44 finished with value: 0.34087481146304677 and parameters: {'boosting_type': 'gbdt', 'num_leaves': 169, 'learning_rate': 0.2846365529633886, 'n_estimators': 205, 'max_depth': 5, 'subsample': 0.56248619691419, 'colsample_bytree': 0.9046396390038883, 'reg_alpha': 0.7431441293865468, 'reg_lambda': 0.3693815893819436}. Best is trial 17 with value: 0.3212669683257918.
[I 2024-10-21 16:20:55,171] Trial 45 finished with value: 0.34238310708898945 and parameters: {'boosting_type': 'dart', 'num_leaves': 193, 'learning_rate': 0.1786463078255885, 'n_estimators': 312, 'max_depth': 9, 'subsample': 0.6369257809487707, 'colsample_bytree': 0.6713289981864112, 'reg_alpha': 0.3089788878426064, 'reg_lambda': 0.4982711328494871}. Best is trial 17 with value: 0.3212669683257918.
[I 2024-10-21 16:20:55,478] Trial 46 finished with value: 0.3393665158371041 and parameters: {'boosting_type': 'goss', 'num_leaves': 211, 'learning_rate': 0.2233128166262591, 'n_estimators': 136, 'max_depth': 7, 'subsample': 0.7833239527984238, 'colsample_bytree': 0.5763748105863635, 'reg_alpha': 0.09480304410752168, 'reg_lambda': 0.31992201553320154}. Best is trial 17 with value: 0.3212669683257918.
[I 2024-10-21 16:21:00,148] Trial 47 finished with value: 0.35595776772247356 and parameters: {'boosting_type': 'dart', 'num_leaves': 109, 'learning_rate': 0.4985289016773581, 'n_estimators': 655, 'max_depth': 8, 'subsample': 0.6594987238198663, 'colsample_bytree': 0.9872409533619673, 'reg_alpha': 0.3571904678880474, 'reg_lambda': 0.2007477929126564}. Best is trial 17 with value: 0.3212669683257918.
[I 2024-10-21 16:21:01,113] Trial 48 finished with value: 0.3318250377073907 and parameters: {'boosting_type': 'dart', 'num_leaves': 70, 'learning_rate': 0.244682363695428, 'n_estimators': 261, 'max_depth': 6, 'subsample': 0.7552119082069427, 'colsample_bytree': 0.6554436715628227, 'reg_alpha': 0.475202872716553, 'reg_lambda': 0.6023560922438578}. Best is trial 17 with value: 0.3212669683257918.
[I 2024-10-21 16:21:01,190] Trial 49 finished with value: 0.42383107088989447 and parameters: {'boosting_type': 'dart', 'num_leaves': 3, 'learning_rate': 0.08902151593961949, 'n_estimators': 54, 'max_depth': 5, 'subsample': 0.8624099424062259, 'colsample_bytree': 0.6802470456428277, 'reg_alpha': 0.4075539621722909, 'reg_lambda': 0.14241038293539304}. Best is trial 17 with value: 0.3212669683257918.
[I 2024-10-21 16:21:01,596] Trial 50 finished with value: 0.3438914027149321 and parameters: {'boosting_type': 'gbdt', 'num_leaves': 31, 'learning_rate': 0.1530190575303063, 'n_estimators': 355, 'max_depth': 4, 'subsample': 0.7026951928848716, 'colsample_bytree': 0.7147593135682604, 'reg_alpha': 0.25494581361618934, 'reg_lambda': 0.42009133170360785}. Best is trial 17 with value: 0.3212669683257918.
[I 2024-10-21 16:21:01,856] Trial 51 finished with value: 0.33333333333333337 and parameters: {'boosting_type': 'dart', 'num_leaves': 119, 'learning_rate': 0.32835491781908893, 'n_estimators': 81, 'max_depth': 7, 'subsample': 0.5050888185533141, 'colsample_bytree': 0.6081054470983908, 'reg_alpha': 0.5398233949729565, 'reg_lambda': 0.2682274755184537}. Best is trial 17 with value: 0.3212669683257918.
[I 2024-10-21 16:21:02,743] Trial 52 finished with value: 0.34238310708898945 and parameters: {'boosting_type': 'dart', 'num_leaves': 153, 'learning_rate': 0.31505543054198076, 'n_estimators': 181, 'max_depth': 9, 'subsample': 0.5668537416615765, 'colsample_bytree': 0.5865829736861694, 'reg_alpha': 0.5968115400416651, 'reg_lambda': 0.3020684870757262}. Best is trial 17 with value: 0.3212669683257918.
[I 2024-10-21 16:21:02,899] Trial 53 finished with value: 0.3469079939668175 and parameters: {'boosting_type': 'dart', 'num_leaves': 142, 'learning_rate': 0.26696500634765724, 'n_estimators': 21, 'max_depth': -1, 'subsample': 0.5034433591307164, 'colsample_bytree': 0.5346645433743855, 'reg_alpha': 0.4629597054719, 'reg_lambda': 0.3759591812020472}. Best is trial 17 with value: 0.3212669683257918.
