[I 2024-10-21 17:48:03,905] A new study created in memory with name: no-name-5c1d2166-0c9f-4a78-9970-b41a93852f10
[I 2024-10-21 17:48:04,336] Trial 0 finished with value: 0.13522537562604342 and parameters: {'boosting_type': 'dart', 'num_leaves': 167, 'learning_rate': 0.28966597411664996, 'n_estimators': 317, 'max_depth': 9, 'subsample': 0.7947726169829463, 'colsample_bytree': 0.8266512580823526, 'reg_alpha': 0.6809640837534017, 'reg_lambda': 0.3113624767749671}. Best is trial 0 with value: 0.13522537562604342.
[I 2024-10-21 17:48:04,498] Trial 1 finished with value: 0.13689482470784642 and parameters: {'boosting_type': 'gbdt', 'num_leaves': 105, 'learning_rate': 0.3742235735293526, 'n_estimators': 386, 'max_depth': 8, 'subsample': 0.5743076814694836, 'colsample_bytree': 0.5851269517480504, 'reg_alpha': 0.4087758009982363, 'reg_lambda': 0.8072638798188759}. Best is trial 0 with value: 0.13522537562604342.
[I 2024-10-21 17:48:05,605] Trial 2 finished with value: 0.13689482470784642 and parameters: {'boosting_type': 'dart', 'num_leaves': 92, 'learning_rate': 0.11758947365011553, 'n_estimators': 885, 'max_depth': 5, 'subsample': 0.5249817034847541, 'colsample_bytree': 0.5388231268440387, 'reg_alpha': 0.13093518727783549, 'reg_lambda': 0.06931903710661813}. Best is trial 0 with value: 0.13522537562604342.
[I 2024-10-21 17:48:05,657] Trial 3 finished with value: 0.13355592654424042 and parameters: {'boosting_type': 'gbdt', 'num_leaves': 63, 'learning_rate': 0.47498178897769266, 'n_estimators': 76, 'max_depth': 6, 'subsample': 0.6079547472868755, 'colsample_bytree': 0.8628481032936447, 'reg_alpha': 0.15579818969646775, 'reg_lambda': 0.714530880384491}. Best is trial 3 with value: 0.13355592654424042.
[I 2024-10-21 17:48:06,367] Trial 4 finished with value: 0.12854757929883143 and parameters: {'boosting_type': 'dart', 'num_leaves': 8, 'learning_rate': 0.4848095712983017, 'n_estimators': 857, 'max_depth': 4, 'subsample': 0.8251880171556755, 'colsample_bytree': 0.8804831630644885, 'reg_alpha': 0.2269629609609093, 'reg_lambda': 0.20286017204734863}. Best is trial 4 with value: 0.12854757929883143.
[I 2024-10-21 17:48:06,722] Trial 5 finished with value: 0.1435726210350584 and parameters: {'boosting_type': 'dart', 'num_leaves': 10, 'learning_rate': 0.09084915633361137, 'n_estimators': 443, 'max_depth': 7, 'subsample': 0.7000938294730132, 'colsample_bytree': 0.6375339172567251, 'reg_alpha': 0.8987858459426336, 'reg_lambda': 0.6452300845274638}. Best is trial 4 with value: 0.12854757929883143.
[I 2024-10-21 17:48:06,840] Trial 6 finished with value: 0.13188647746243742 and parameters: {'boosting_type': 'gbdt', 'num_leaves': 85, 'learning_rate': 0.4297126528479171, 'n_estimators': 653, 'max_depth': 9, 'subsample': 0.6262522822673471, 'colsample_bytree': 0.5460306724280259, 'reg_alpha': 0.5151000312225251, 'reg_lambda': 0.11825936674753545}. Best is trial 4 with value: 0.12854757929883143.
[I 2024-10-21 17:48:06,925] Trial 7 finished with value: 0.1569282136894825 and parameters: {'boosting_type': 'gbdt', 'num_leaves': 78, 'learning_rate': 0.3209516173225331, 'n_estimators': 731, 'max_depth': 1, 'subsample': 0.6183943416674061, 'colsample_bytree': 0.8448355221924271, 'reg_alpha': 0.17387328782479594, 'reg_lambda': 0.22825385368486273}. Best is trial 4 with value: 0.12854757929883143.
[I 2024-10-21 17:48:07,108] Trial 8 finished with value: 0.13355592654424042 and parameters: {'boosting_type': 'goss', 'num_leaves': 211, 'learning_rate': 0.4126541727240932, 'n_estimators': 633, 'max_depth': 4, 'subsample': 0.5473512342996457, 'colsample_bytree': 0.5446393046658174, 'reg_alpha': 0.5443161185810977, 'reg_lambda': 0.8434600951611427}. Best is trial 4 with value: 0.12854757929883143.
[I 2024-10-21 17:48:07,797] Trial 9 finished with value: 0.1535893155258765 and parameters: {'boosting_type': 'dart', 'num_leaves': 220, 'learning_rate': 0.03311999325459397, 'n_estimators': 438, 'max_depth': 8, 'subsample': 0.8501361420176805, 'colsample_bytree': 0.5286757418640262, 'reg_alpha': 0.2644453592228466, 'reg_lambda': 0.47284923537846935}. Best is trial 4 with value: 0.12854757929883143.
[I 2024-10-21 17:48:08,148] Trial 10 finished with value: 0.13021702838063443 and parameters: {'boosting_type': 'goss', 'num_leaves': 6, 'learning_rate': 0.19066988037139043, 'n_estimators': 994, 'max_depth': -1, 'subsample': 0.9939440140887243, 'colsample_bytree': 0.9997892951505115, 'reg_alpha': 0.004634880157656673, 'reg_lambda': 0.42907201386514593}. Best is trial 4 with value: 0.12854757929883143.
[I 2024-10-21 17:48:08,317] Trial 11 finished with value: 0.1519198664440734 and parameters: {'boosting_type': 'goss', 'num_leaves': 2, 'learning_rate': 0.19891052046066987, 'n_estimators': 971, 'max_depth': -1, 'subsample': 0.9963496621197518, 'colsample_bytree': 0.9836526405018982, 'reg_alpha': 0.0017335019367105044, 'reg_lambda': 0.4120943867731812}. Best is trial 4 with value: 0.12854757929883143.
[I 2024-10-21 17:48:08,535] Trial 12 finished with value: 0.13021702838063443 and parameters: {'boosting_type': 'goss', 'num_leaves': 28, 'learning_rate': 0.1950708536144961, 'n_estimators': 831, 'max_depth': 3, 'subsample': 0.9910112944714972, 'colsample_bytree': 0.9616788282932667, 'reg_alpha': 0.01892772722990496, 'reg_lambda': 0.25621141072760995}. Best is trial 4 with value: 0.12854757929883143.
[I 2024-10-21 17:48:08,988] Trial 13 finished with value: 0.13021702838063443 and parameters: {'boosting_type': 'goss', 'num_leaves': 44, 'learning_rate': 0.1972498404060393, 'n_estimators': 996, 'max_depth': -1, 'subsample': 0.9030910153640173, 'colsample_bytree': 0.9236274867349561, 'reg_alpha': 0.29613527368190107, 'reg_lambda': 0.5941280089619271}. Best is trial 4 with value: 0.12854757929883143.
[I 2024-10-21 17:48:09,167] Trial 14 finished with value: 0.12520868113522543 and parameters: {'boosting_type': 'goss', 'num_leaves': 133, 'learning_rate': 0.3472855736479842, 'n_estimators': 848, 'max_depth': 2, 'subsample': 0.9090425264344902, 'colsample_bytree': 0.7122702377667112, 'reg_alpha': 0.35482616617333007, 'reg_lambda': 0.0031938471426247173}. Best is trial 14 with value: 0.12520868113522543.
[I 2024-10-21 17:48:09,588] Trial 15 finished with value: 0.13689482470784642 and parameters: {'boosting_type': 'dart', 'num_leaves': 142, 'learning_rate': 0.49070276403397567, 'n_estimators': 780, 'max_depth': 2, 'subsample': 0.9056720702395307, 'colsample_bytree': 0.7117933538402142, 'reg_alpha': 0.39602313644758314, 'reg_lambda': 0.9961297874989243}. Best is trial 14 with value: 0.12520868113522543.
[I 2024-10-21 17:48:09,886] Trial 16 finished with value: 0.14023372287145242 and parameters: {'boosting_type': 'dart', 'num_leaves': 161, 'learning_rate': 0.35095532716547484, 'n_estimators': 596, 'max_depth': 2, 'subsample': 0.7573723250262479, 'colsample_bytree': 0.7469867817945989, 'reg_alpha': 0.7028246785526583, 'reg_lambda': 0.029394757279274437}. Best is trial 14 with value: 0.12520868113522543.
[I 2024-10-21 17:48:09,987] Trial 17 finished with value: 0.1435726210350584 and parameters: {'boosting_type': 'goss', 'num_leaves': 255, 'learning_rate': 0.4260741762891269, 'n_estimators': 237, 'max_depth': 4, 'subsample': 0.8314888344791209, 'colsample_bytree': 0.6881520490035735, 'reg_alpha': 0.33969655128012344, 'reg_lambda': 0.14586432073314515}. Best is trial 14 with value: 0.12520868113522543.
[I 2024-10-21 17:48:10,178] Trial 18 finished with value: 0.1702838063439065 and parameters: {'boosting_type': 'dart', 'num_leaves': 117, 'learning_rate': 0.2684627807113451, 'n_estimators': 568, 'max_depth': 1, 'subsample': 0.7015869837790203, 'colsample_bytree': 0.7827367213750166, 'reg_alpha': 0.6367586491289556, 'reg_lambda': 0.0009355880159678939}. Best is trial 14 with value: 0.12520868113522543.
[I 2024-10-21 17:48:10,430] Trial 19 finished with value: 0.1435726210350584 and parameters: {'boosting_type': 'goss', 'num_leaves': 138, 'learning_rate': 0.3824182030874863, 'n_estimators': 721, 'max_depth': 5, 'subsample': 0.9138427772224382, 'colsample_bytree': 0.8840294313791425, 'reg_alpha': 0.9765183067965407, 'reg_lambda': 0.18684963184902692}. Best is trial 14 with value: 0.12520868113522543.
[I 2024-10-21 17:48:10,587] Trial 20 finished with value: 0.1602671118530885 and parameters: {'boosting_type': 'goss', 'num_leaves': 185, 'learning_rate': 0.49967674541530155, 'n_estimators': 875, 'max_depth': 1, 'subsample': 0.8396451117183097, 'colsample_bytree': 0.7809655186261527, 'reg_alpha': 0.2167253170687669, 'reg_lambda': 0.34693363446318926}. Best is trial 14 with value: 0.12520868113522543.
[I 2024-10-21 17:48:11,092] Trial 21 finished with value: 0.13689482470784642 and parameters: {'boosting_type': 'goss', 'num_leaves': 32, 'learning_rate': 0.12797203601211923, 'n_estimators': 921, 'max_depth': 0, 'subsample': 0.9441775958017997, 'colsample_bytree': 0.9357706379189024, 'reg_alpha': 0.06745264202656787, 'reg_lambda': 0.5294195763643396}. Best is trial 14 with value: 0.12520868113522543.
[I 2024-10-21 17:48:11,305] Trial 22 finished with value: 0.13188647746243742 and parameters: {'boosting_type': 'goss', 'num_leaves': 50, 'learning_rate': 0.24469251652548107, 'n_estimators': 800, 'max_depth': 3, 'subsample': 0.9577983551702999, 'colsample_bytree': 0.9987203086061431, 'reg_alpha': 0.10561054261143442, 'reg_lambda': 0.35653148635222903}. Best is trial 14 with value: 0.12520868113522543.
[I 2024-10-21 17:48:11,718] Trial 23 finished with value: 0.13021702838063443 and parameters: {'boosting_type': 'goss', 'num_leaves': 64, 'learning_rate': 0.23603570995933912, 'n_estimators': 984, 'max_depth': 0, 'subsample': 0.8915041182173862, 'colsample_bytree': 0.9036642028112257, 'reg_alpha': 0.41893811362597433, 'reg_lambda': 0.10569302210000453}. Best is trial 14 with value: 0.12520868113522543.
[I 2024-10-21 17:48:11,964] Trial 24 finished with value: 0.13021702838063443 and parameters: {'boosting_type': 'goss', 'num_leaves': 25, 'learning_rate': 0.32411793846586834, 'n_estimators': 907, 'max_depth': 3, 'subsample': 0.9545274825431893, 'colsample_bytree': 0.6586172009517889, 'reg_alpha': 0.262613117046256, 'reg_lambda': 0.22644536697482437}. Best is trial 14 with value: 0.12520868113522543.
[I 2024-10-21 17:48:12,363] Trial 25 finished with value: 0.1552587646076795 and parameters: {'boosting_type': 'dart', 'num_leaves': 119, 'learning_rate': 0.1669986636379575, 'n_estimators': 744, 'max_depth': 2, 'subsample': 0.8678899029322333, 'colsample_bytree': 0.8175288850395852, 'reg_alpha': 0.3394534438680911, 'reg_lambda': 0.5028528449327234}. Best is trial 14 with value: 0.12520868113522543.
[I 2024-10-21 17:48:12,518] Trial 26 finished with value: 0.1602671118530885 and parameters: {'boosting_type': 'goss', 'num_leaves': 2, 'learning_rate': 0.44449024547396176, 'n_estimators': 837, 'max_depth': 6, 'subsample': 0.7988901184697295, 'colsample_bytree': 0.9553777305740302, 'reg_alpha': 0.21086762946177007, 'reg_lambda': 0.4127724668813701}. Best is trial 14 with value: 0.12520868113522543.
[I 2024-10-21 17:48:12,880] Trial 27 finished with value: 0.14023372287145242 and parameters: {'boosting_type': 'goss', 'num_leaves': 62, 'learning_rate': 0.30108777552678057, 'n_estimators': 691, 'max_depth': 0, 'subsample': 0.9479590979509611, 'colsample_bytree': 0.7347559889206258, 'reg_alpha': 0.06470520545667094, 'reg_lambda': 0.28478460108912423}. Best is trial 14 with value: 0.12520868113522543.
[I 2024-10-21 17:48:13,032] Trial 28 finished with value: 0.13522537562604342 and parameters: {'boosting_type': 'gbdt', 'num_leaves': 158, 'learning_rate': 0.38729416205797423, 'n_estimators': 528, 'max_depth': -1, 'subsample': 0.8107494956652163, 'colsample_bytree': 0.7835990826886101, 'reg_alpha': 0.44023278996442844, 'reg_lambda': 0.13996169291290467}. Best is trial 14 with value: 0.12520868113522543.
[I 2024-10-21 17:48:14,712] Trial 29 finished with value: 0.13522537562604342 and parameters: {'boosting_type': 'dart', 'num_leaves': 100, 'learning_rate': 0.4591515951864281, 'n_estimators': 942, 'max_depth': 10, 'subsample': 0.7351405500641165, 'colsample_bytree': 0.8244309770377158, 'reg_alpha': 0.5840567704527024, 'reg_lambda': 0.31218569131222645}. Best is trial 14 with value: 0.12520868113522543.
[I 2024-10-21 17:48:14,870] Trial 30 finished with value: 0.13522537562604342 and parameters: {'boosting_type': 'dart', 'num_leaves': 183, 'learning_rate': 0.2769042066107347, 'n_estimators': 232, 'max_depth': 4, 'subsample': 0.7745568150413451, 'colsample_bytree': 0.6150109632360066, 'reg_alpha': 0.8140273196961746, 'reg_lambda': 0.05371174118035842}. Best is trial 14 with value: 0.12520868113522543.
[I 2024-10-21 17:48:15,086] Trial 31 finished with value: 0.1419031719532554 and parameters: {'boosting_type': 'goss', 'num_leaves': 23, 'learning_rate': 0.21064988666356885, 'n_estimators': 804, 'max_depth': 3, 'subsample': 0.9973556886412063, 'colsample_bytree': 0.9581094246538555, 'reg_alpha': 0.0664181548469685, 'reg_lambda': 0.25295153477206805}. Best is trial 14 with value: 0.12520868113522543.
[I 2024-10-21 17:48:15,322] Trial 32 finished with value: 0.12520868113522543 and parameters: {'boosting_type': 'goss', 'num_leaves': 39, 'learning_rate': 0.1515200416793958, 'n_estimators': 878, 'max_depth': 3, 'subsample': 0.9731778882357859, 'colsample_bytree': 0.9622216676110846, 'reg_alpha': 0.07816208397788783, 'reg_lambda': 0.42107291810435227}. Best is trial 14 with value: 0.12520868113522543.
[I 2024-10-21 17:48:15,646] Trial 33 finished with value: 0.13856427378964942 and parameters: {'boosting_type': 'goss', 'num_leaves': 43, 'learning_rate': 0.15643970521427478, 'n_estimators': 870, 'max_depth': 5, 'subsample': 0.8716786034462669, 'colsample_bytree': 0.8996692922759222, 'reg_alpha': 0.12686129086334497, 'reg_lambda': 0.4190713734325083}. Best is trial 14 with value: 0.12520868113522543.
[I 2024-10-21 17:48:16,021] Trial 34 finished with value: 0.13188647746243742 and parameters: {'boosting_type': 'goss', 'num_leaves': 15, 'learning_rate': 0.07749352813793577, 'n_estimators': 922, 'max_depth': 6, 'subsample': 0.9248336363533208, 'colsample_bytree': 0.995800737270309, 'reg_alpha': 0.2036938151167953, 'reg_lambda': 0.5722283562849324}. Best is trial 14 with value: 0.12520868113522543.
[I 2024-10-21 17:48:16,184] Trial 35 finished with value: 0.13522537562604342 and parameters: {'boosting_type': 'gbdt', 'num_leaves': 72, 'learning_rate': 0.15508988864979695, 'n_estimators': 859, 'max_depth': 2, 'subsample': 0.9655322300768158, 'colsample_bytree': 0.9217709462830556, 'reg_alpha': 0.12052106601489083, 'reg_lambda': 0.7508278697021554}. Best is trial 14 with value: 0.12520868113522543.
[I 2024-10-21 17:48:16,249] Trial 36 finished with value: 0.1502504173622704 and parameters: {'boosting_type': 'goss', 'num_leaves': 43, 'learning_rate': 0.08216365822994798, 'n_estimators': 73, 'max_depth': 4, 'subsample': 0.8760865779223526, 'colsample_bytree': 0.8731197899045415, 'reg_alpha': 0.3272831834026591, 'reg_lambda': 0.1867924642445744}. Best is trial 14 with value: 0.12520868113522543.
[I 2024-10-21 17:48:17,587] Trial 37 finished with value: 0.13355592654424042 and parameters: {'boosting_type': 'dart', 'num_leaves': 95, 'learning_rate': 0.11071616120891703, 'n_estimators': 771, 'max_depth': 7, 'subsample': 0.9274528555967732, 'colsample_bytree': 0.9663705628850093, 'reg_alpha': 0.17091995325635176, 'reg_lambda': 0.6464090443336034}. Best is trial 14 with value: 0.12520868113522543.
[I 2024-10-21 17:48:17,700] Trial 38 finished with value: 0.1652754590984975 and parameters: {'boosting_type': 'gbdt', 'num_leaves': 15, 'learning_rate': 0.2368084704239475, 'n_estimators': 690, 'max_depth': 1, 'subsample': 0.966600904692102, 'colsample_bytree': 0.8503168691823257, 'reg_alpha': 0.4620270109917495, 'reg_lambda': 0.35064420347887915}. Best is trial 14 with value: 0.12520868113522543.
[I 2024-10-21 17:48:18,054] Trial 39 finished with value: 0.13021702838063443 and parameters: {'boosting_type': 'goss', 'num_leaves': 118, 'learning_rate': 0.35884400008558304, 'n_estimators': 997, 'max_depth': 5, 'subsample': 0.8219215760526534, 'colsample_bytree': 0.6929486586705236, 'reg_alpha': 0.25654159013834305, 'reg_lambda': 0.458032315033688}. Best is trial 14 with value: 0.12520868113522543.
[I 2024-10-21 17:48:18,847] Trial 40 finished with value: 0.1552587646076795 and parameters: {'boosting_type': 'dart', 'num_leaves': 57, 'learning_rate': 0.03575370473161937, 'n_estimators': 923, 'max_depth': 3, 'subsample': 0.9740910883157977, 'colsample_bytree': 0.5801755923522256, 'reg_alpha': 0.026018601373494543, 'reg_lambda': 0.0939934350430563}. Best is trial 14 with value: 0.12520868113522543.
[I 2024-10-21 17:48:19,069] Trial 41 finished with value: 0.13522537562604342 and parameters: {'boosting_type': 'goss', 'num_leaves': 32, 'learning_rate': 0.2186756575689553, 'n_estimators': 830, 'max_depth': 3, 'subsample': 0.9882339651296496, 'colsample_bytree': 0.9719751623574133, 'reg_alpha': 0.013075650454589, 'reg_lambda': 0.2949518288243816}. Best is trial 14 with value: 0.12520868113522543.
[I 2024-10-21 17:48:19,344] Trial 42 finished with value: 0.12854757929883143 and parameters: {'boosting_type': 'goss', 'num_leaves': 14, 'learning_rate': 0.17256584772368413, 'n_estimators': 846, 'max_depth': 4, 'subsample': 0.9345230187004623, 'colsample_bytree': 0.9325678465453369, 'reg_alpha': 0.08111528503968281, 'reg_lambda': 0.1850688411318988}. Best is trial 14 with value: 0.12520868113522543.
[I 2024-10-21 17:48:19,518] Trial 43 finished with value: 0.1552587646076795 and parameters: {'boosting_type': 'goss', 'num_leaves': 2, 'learning_rate': 0.1750275963937669, 'n_estimators': 945, 'max_depth': 4, 'subsample': 0.9364524461883045, 'colsample_bytree': 0.9384569934520671, 'reg_alpha': 0.10035906728306289, 'reg_lambda': 0.17042688519958274}. Best is trial 14 with value: 0.12520868113522543.
[I 2024-10-21 17:48:19,869] Trial 44 finished with value: 0.13021702838063443 and parameters: {'boosting_type': 'goss', 'num_leaves': 16, 'learning_rate': 0.11646927245540914, 'n_estimators': 875, 'max_depth': 6, 'subsample': 0.8582685395485816, 'colsample_bytree': 0.9421981373172201, 'reg_alpha': 0.3770155827548916, 'reg_lambda': 0.20814278523193686}. Best is trial 14 with value: 0.12520868113522543.
[I 2024-10-21 17:48:20,029] Trial 45 finished with value: 0.13355592654424042 and parameters: {'boosting_type': 'goss', 'num_leaves': 82, 'learning_rate': 0.14082543753911528, 'n_estimators': 667, 'max_depth': 2, 'subsample': 0.8884058257212144, 'colsample_bytree': 0.9139276027052885, 'reg_alpha': 0.15424103874189238, 'reg_lambda': 0.06408721758383462}. Best is trial 14 with value: 0.12520868113522543.
[I 2024-10-21 17:48:20,266] Trial 46 finished with value: 0.13021702838063443 and parameters: {'boosting_type': 'gbdt', 'num_leaves': 36, 'learning_rate': 0.1890965894995228, 'n_estimators': 752, 'max_depth': 4, 'subsample': 0.9163349067129691, 'colsample_bytree': 0.8923282790145459, 'reg_alpha': 0.08080204405594613, 'reg_lambda': 0.004792047957603575}. Best is trial 14 with value: 0.12520868113522543.
[I 2024-10-21 17:48:20,463] Trial 47 finished with value: 0.13355592654424042 and parameters: {'boosting_type': 'goss', 'num_leaves': 13, 'learning_rate': 0.062353495741218734, 'n_estimators': 432, 'max_depth': 7, 'subsample': 0.9786563366680676, 'colsample_bytree': 0.9825522271962419, 'reg_alpha': 0.17998106839479497, 'reg_lambda': 0.3892198002059379}. Best is trial 14 with value: 0.12520868113522543.
[I 2024-10-21 17:48:22,702] Trial 48 finished with value: 0.14023372287145242 and parameters: {'boosting_type': 'dart', 'num_leaves': 138, 'learning_rate': 0.3158771448756456, 'n_estimators': 805, 'max_depth': 0, 'subsample': 0.6777950355881768, 'colsample_bytree': 0.8538545189947429, 'reg_alpha': 0.040822389404384235, 'reg_lambda': 0.5580376508393151}. Best is trial 14 with value: 0.12520868113522543.
[I 2024-10-21 17:48:23,054] Trial 49 finished with value: 0.12854757929883143 and parameters: {'boosting_type': 'goss', 'num_leaves': 24, 'learning_rate': 0.18121423398878103, 'n_estimators': 955, 'max_depth': 5, 'subsample': 0.8931551863863229, 'colsample_bytree': 0.8027274128200519, 'reg_alpha': 0.23861174988083192, 'reg_lambda': 0.456448759532628}. Best is trial 14 with value: 0.12520868113522543.
[I 2024-10-21 17:48:23,147] Trial 50 finished with value: 0.1435726210350584 and parameters: {'boosting_type': 'goss', 'num_leaves': 71, 'learning_rate': 0.4030239628328697, 'n_estimators': 151, 'max_depth': 5, 'subsample': 0.8495499821988961, 'colsample_bytree': 0.8066965869816924, 'reg_alpha': 0.29333216162348463, 'reg_lambda': 0.47171455543809876}. Best is trial 14 with value: 0.12520868113522543.
[I 2024-10-21 17:48:23,446] Trial 51 finished with value: 0.12186978297161932 and parameters: {'boosting_type': 'goss', 'num_leaves': 22, 'learning_rate': 0.1351007149739064, 'n_estimators': 960, 'max_depth': 4, 'subsample': 0.8967632898035558, 'colsample_bytree': 0.7682220747339181, 'reg_alpha': 0.23572687959855546, 'reg_lambda': 0.6416433923037366}. Best is trial 51 with value: 0.12186978297161932.
[I 2024-10-21 17:48:23,746] Trial 52 finished with value: 0.13021702838063443 and parameters: {'boosting_type': 'goss', 'num_leaves': 23, 'learning_rate': 0.10228371684889541, 'n_estimators': 957, 'max_depth': 4, 'subsample': 0.9003452519777374, 'colsample_bytree': 0.7588857767591842, 'reg_alpha': 0.24560337081474626, 'reg_lambda': 0.6506714101067427}. Best is trial 51 with value: 0.12186978297161932.
[I 2024-10-21 17:48:24,076] Trial 53 finished with value: 0.13188647746243742 and parameters: {'boosting_type': 'goss', 'num_leaves': 47, 'learning_rate': 0.1348447235239258, 'n_estimators': 890, 'max_depth': 5, 'subsample': 0.884342860450428, 'colsample_bytree': 0.7192091307733388, 'reg_alpha': 0.308966055969938, 'reg_lambda': 0.8843750246062817}. Best is trial 51 with value: 0.12186978297161932.
