[I 2024-10-21 17:48:24,302] Trial 54 finished with value: 0.13522537562604342 and parameters: {'boosting_type': 'goss', 'num_leaves': 30, 'learning_rate': 0.17874748723581352, 'n_estimators': 842, 'max_depth': 3, 'subsample': 0.9360170073471321, 'colsample_bytree': 0.7968341611021464, 'reg_alpha': 0.38511585176833785, 'reg_lambda': 0.6192293132982206}. Best is trial 51 with value: 0.12186978297161932.
[I 2024-10-21 17:48:24,504] Trial 55 finished with value: 0.13856427378964942 and parameters: {'boosting_type': 'goss', 'num_leaves': 53, 'learning_rate': 0.22061061215480873, 'n_estimators': 956, 'max_depth': 2, 'subsample': 0.7783998489516429, 'colsample_bytree': 0.5062326010529001, 'reg_alpha': 0.4885845543247798, 'reg_lambda': 0.6883640023850366}. Best is trial 51 with value: 0.12186978297161932.
[I 2024-10-21 17:48:24,553] Trial 56 finished with value: 0.1719532554257095 and parameters: {'boosting_type': 'goss', 'num_leaves': 151, 'learning_rate': 0.15001632941890997, 'n_estimators': 13, 'max_depth': 5, 'subsample': 0.9050366053137465, 'colsample_bytree': 0.7576749761576743, 'reg_alpha': 0.1565805515532943, 'reg_lambda': 0.5078093988192223}. Best is trial 51 with value: 0.12186978297161932.
[I 2024-10-21 17:48:25,439] Trial 57 finished with value: 0.13355592654424042 and parameters: {'boosting_type': 'dart', 'num_leaves': 40, 'learning_rate': 0.26183377524268747, 'n_estimators': 896, 'max_depth': 4, 'subsample': 0.8337097966582029, 'colsample_bytree': 0.874066026726087, 'reg_alpha': 0.2289494494438757, 'reg_lambda': 0.7517956961541221}. Best is trial 51 with value: 0.12186978297161932.
[I 2024-10-21 17:48:25,556] Trial 58 finished with value: 0.1502504173622704 and parameters: {'boosting_type': 'goss', 'num_leaves': 8, 'learning_rate': 0.04953941809516796, 'n_estimators': 334, 'max_depth': 3, 'subsample': 0.8485908191326582, 'colsample_bytree': 0.671615621332157, 'reg_alpha': 0.2906799415339136, 'reg_lambda': 0.5421664278214101}. Best is trial 51 with value: 0.12186978297161932.
[I 2024-10-21 17:48:25,770] Trial 59 finished with value: 0.12854757929883143 and parameters: {'boosting_type': 'goss', 'num_leaves': 128, 'learning_rate': 0.4727381989887872, 'n_estimators': 616, 'max_depth': 4, 'subsample': 0.5140252200594411, 'colsample_bytree': 0.7357672606375842, 'reg_alpha': 0.19811601549245178, 'reg_lambda': 0.1496200823506877}. Best is trial 51 with value: 0.12186978297161932.
[I 2024-10-21 17:48:26,127] Trial 60 finished with value: 0.13856427378964942 and parameters: {'boosting_type': 'gbdt', 'num_leaves': 108, 'learning_rate': 0.10102088095133782, 'n_estimators': 729, 'max_depth': 6, 'subsample': 0.5622319256426647, 'colsample_bytree': 0.7776074548969532, 'reg_alpha': 0.3483396912984825, 'reg_lambda': 0.25612715776576095}. Best is trial 51 with value: 0.12186978297161932.
[I 2024-10-21 17:48:26,345] Trial 61 finished with value: 0.13355592654424042 and parameters: {'boosting_type': 'goss', 'num_leaves': 245, 'learning_rate': 0.48444730228319444, 'n_estimators': 635, 'max_depth': 4, 'subsample': 0.6463992139162533, 'colsample_bytree': 0.7275085479655234, 'reg_alpha': 0.19787374113530534, 'reg_lambda': 0.10646512987026355}. Best is trial 51 with value: 0.12186978297161932.
[I 2024-10-21 17:48:26,541] Trial 62 finished with value: 0.13355592654424042 and parameters: {'boosting_type': 'goss', 'num_leaves': 184, 'learning_rate': 0.453965618367849, 'n_estimators': 480, 'max_depth': 5, 'subsample': 0.500627068051738, 'colsample_bytree': 0.7084770546920945, 'reg_alpha': 0.13774489446549895, 'reg_lambda': 0.0497160481962981}. Best is trial 51 with value: 0.12186978297161932.
[I 2024-10-21 17:48:26,807] Trial 63 finished with value: 0.13355592654424042 and parameters: {'boosting_type': 'goss', 'num_leaves': 208, 'learning_rate': 0.46618236504849314, 'n_estimators': 810, 'max_depth': 4, 'subsample': 0.5952678258039742, 'colsample_bytree': 0.8405045072968609, 'reg_alpha': 0.27421908654907606, 'reg_lambda': 0.16491880707430479}. Best is trial 51 with value: 0.12186978297161932.
[I 2024-10-21 17:48:26,985] Trial 64 finished with value: 0.13355592654424042 and parameters: {'boosting_type': 'goss', 'num_leaves': 17, 'learning_rate': 0.41667382823613963, 'n_estimators': 604, 'max_depth': 3, 'subsample': 0.7271808171120302, 'colsample_bytree': 0.7398092743163874, 'reg_alpha': 0.2426672911705259, 'reg_lambda': 0.13617319792028298}. Best is trial 51 with value: 0.12186978297161932.
[I 2024-10-21 17:48:27,196] Trial 65 finished with value: 0.13355592654424042 and parameters: {'boosting_type': 'goss', 'num_leaves': 126, 'learning_rate': 0.435650954905174, 'n_estimators': 975, 'max_depth': 2, 'subsample': 0.9149567437261208, 'colsample_bytree': 0.6966337784621626, 'reg_alpha': 0.09613507652399092, 'reg_lambda': 0.3689789256613983}. Best is trial 51 with value: 0.12186978297161932.
[I 2024-10-21 17:48:27,781] Trial 66 finished with value: 0.13689482470784642 and parameters: {'boosting_type': 'dart', 'num_leaves': 128, 'learning_rate': 0.4901263129447496, 'n_estimators': 784, 'max_depth': 3, 'subsample': 0.9437562839373379, 'colsample_bytree': 0.766547841566492, 'reg_alpha': 0.18604629467424683, 'reg_lambda': 0.30962200751378144}. Best is trial 51 with value: 0.12186978297161932.
[I 2024-10-21 17:48:27,955] Trial 67 finished with value: 0.1636060100166945 and parameters: {'boosting_type': 'goss', 'num_leaves': 147, 'learning_rate': 0.3635822334011203, 'n_estimators': 909, 'max_depth': 1, 'subsample': 0.8128271898036246, 'colsample_bytree': 0.6479316583609751, 'reg_alpha': 0.21968078982384004, 'reg_lambda': 0.22156578549522288}. Best is trial 51 with value: 0.12186978297161932.
[I 2024-10-21 17:48:28,182] Trial 68 finished with value: 0.12687813021702843 and parameters: {'boosting_type': 'goss', 'num_leaves': 24, 'learning_rate': 0.1636502821971062, 'n_estimators': 846, 'max_depth': 3, 'subsample': 0.8650765595767174, 'colsample_bytree': 0.673080742607747, 'reg_alpha': 0.3568428155711069, 'reg_lambda': 0.08295431829003996}. Best is trial 51 with value: 0.12186978297161932.
[I 2024-10-21 17:48:28,661] Trial 69 finished with value: 0.1469115191986644 and parameters: {'boosting_type': 'dart', 'num_leaves': 25, 'learning_rate': 0.13362666714399807, 'n_estimators': 848, 'max_depth': 2, 'subsample': 0.8655173121048574, 'colsample_bytree': 0.8286350011468453, 'reg_alpha': 0.36358701507935903, 'reg_lambda': 0.08446806145129261}. Best is trial 51 with value: 0.12186978297161932.
[I 2024-10-21 17:48:29,056] Trial 70 finished with value: 0.13021702838063443 and parameters: {'boosting_type': 'goss', 'num_leaves': 37, 'learning_rate': 0.1686820088490574, 'n_estimators': 933, 'max_depth': 7, 'subsample': 0.8945251343702785, 'colsample_bytree': 0.6735717539270494, 'reg_alpha': 0.4200763112485558, 'reg_lambda': 0.027365653375746996}. Best is trial 51 with value: 0.12186978297161932.
[I 2024-10-21 17:48:29,334] Trial 71 finished with value: 0.12020033388981632 and parameters: {'boosting_type': 'goss', 'num_leaves': 20, 'learning_rate': 0.2062765006155251, 'n_estimators': 888, 'max_depth': 4, 'subsample': 0.8807907221004894, 'colsample_bytree': 0.6210865840931973, 'reg_alpha': 0.541065702805734, 'reg_lambda': 0.11980063957776316}. Best is trial 71 with value: 0.12020033388981632.
[I 2024-10-21 17:48:29,568] Trial 72 finished with value: 0.12687813021702843 and parameters: {'boosting_type': 'goss', 'num_leaves': 10, 'learning_rate': 0.20634167897670064, 'n_estimators': 878, 'max_depth': 3, 'subsample': 0.9248040663746235, 'colsample_bytree': 0.5898751837357386, 'reg_alpha': 0.6150696147830506, 'reg_lambda': 0.12187421097421493}. Best is trial 71 with value: 0.12020033388981632.
[I 2024-10-21 17:48:29,792] Trial 73 finished with value: 0.12520868113522543 and parameters: {'boosting_type': 'goss', 'num_leaves': 6, 'learning_rate': 0.20562796909232045, 'n_estimators': 876, 'max_depth': 3, 'subsample': 0.9256334582162361, 'colsample_bytree': 0.6179755542448432, 'reg_alpha': 0.5509310034445292, 'reg_lambda': 0.12555966443386563}. Best is trial 71 with value: 0.12020033388981632.
[I 2024-10-21 17:48:30,022] Trial 74 finished with value: 0.13021702838063443 and parameters: {'boosting_type': 'goss', 'num_leaves': 7, 'learning_rate': 0.20651196785857673, 'n_estimators': 878, 'max_depth': 3, 'subsample': 0.9213871438785163, 'colsample_bytree': 0.6225615933257732, 'reg_alpha': 0.5556887878415975, 'reg_lambda': 0.10903799110478626}. Best is trial 71 with value: 0.12020033388981632.
[I 2024-10-21 17:48:30,169] Trial 75 finished with value: 0.1552587646076795 and parameters: {'boosting_type': 'goss', 'num_leaves': 2, 'learning_rate': 0.24489733170668423, 'n_estimators': 762, 'max_depth': 3, 'subsample': 0.9509371407784537, 'colsample_bytree': 0.6141795036049021, 'reg_alpha': 0.6424368580093058, 'reg_lambda': 0.03383309021731283}. Best is trial 71 with value: 0.12020033388981632.
[I 2024-10-21 17:48:30,408] Trial 76 finished with value: 0.12854757929883143 and parameters: {'boosting_type': 'goss', 'num_leaves': 18, 'learning_rate': 0.28806806704306254, 'n_estimators': 900, 'max_depth': 2, 'subsample': 0.8735811604094323, 'colsample_bytree': 0.5699328916349617, 'reg_alpha': 0.7351403343404266, 'reg_lambda': 0.07595844384165748}. Best is trial 71 with value: 0.12020033388981632.
[I 2024-10-21 17:48:30,597] Trial 77 finished with value: 0.14023372287145242 and parameters: {'boosting_type': 'goss', 'num_leaves': 31, 'learning_rate': 0.20070127642351718, 'n_estimators': 862, 'max_depth': 2, 'subsample': 0.8815003138390707, 'colsample_bytree': 0.6295700026606234, 'reg_alpha': 0.5950948753438422, 'reg_lambda': 0.12421540296240415}. Best is trial 71 with value: 0.12020033388981632.
[I 2024-10-21 17:48:30,790] Trial 78 finished with value: 0.13522537562604342 and parameters: {'boosting_type': 'gbdt', 'num_leaves': 20, 'learning_rate': 0.22678172641261043, 'n_estimators': 826, 'max_depth': 3, 'subsample': 0.9608948045893697, 'colsample_bytree': 0.6022321051918363, 'reg_alpha': 0.5230983212183392, 'reg_lambda': 0.009152397705616615}. Best is trial 71 with value: 0.12020033388981632.
[I 2024-10-21 17:48:31,083] Trial 79 finished with value: 0.1602671118530885 and parameters: {'boosting_type': 'dart', 'num_leaves': 10, 'learning_rate': 0.33787868162862916, 'n_estimators': 704, 'max_depth': 1, 'subsample': 0.9097486858618989, 'colsample_bytree': 0.551888922357846, 'reg_alpha': 0.47608047431383926, 'reg_lambda': 0.20563908138555356}. Best is trial 71 with value: 0.12020033388981632.
[I 2024-10-21 17:48:31,351] Trial 80 finished with value: 0.12854757929883143 and parameters: {'boosting_type': 'goss', 'num_leaves': 57, 'learning_rate': 0.16195860844371063, 'n_estimators': 785, 'max_depth': 3, 'subsample': 0.9807605333230527, 'colsample_bytree': 0.5983924611602158, 'reg_alpha': 0.6598773231153667, 'reg_lambda': 0.06619011191687618}. Best is trial 71 with value: 0.12020033388981632.
[I 2024-10-21 17:48:31,621] Trial 81 finished with value: 0.13856427378964942 and parameters: {'boosting_type': 'goss', 'num_leaves': 10, 'learning_rate': 0.1470839305714213, 'n_estimators': 858, 'max_depth': 4, 'subsample': 0.9254743157416054, 'colsample_bytree': 0.6561391819647212, 'reg_alpha': 0.6031022993368242, 'reg_lambda': 0.1598947839776451}. Best is trial 71 with value: 0.12020033388981632.
[I 2024-10-21 17:48:31,939] Trial 82 finished with value: 0.12186978297161932 and parameters: {'boosting_type': 'goss', 'num_leaves': 35, 'learning_rate': 0.12526042643947913, 'n_estimators': 820, 'max_depth': 4, 'subsample': 0.9383703220050474, 'colsample_bytree': 0.59434177418074, 'reg_alpha': 0.5546067331538524, 'reg_lambda': 0.12297871873067084}. Best is trial 71 with value: 0.12020033388981632.
[I 2024-10-21 17:48:32,283] Trial 83 finished with value: 0.13355592654424042 and parameters: {'boosting_type': 'goss', 'num_leaves': 35, 'learning_rate': 0.19016516886312543, 'n_estimators': 916, 'max_depth': 4, 'subsample': 0.8630555492860618, 'colsample_bytree': 0.5651530554035611, 'reg_alpha': 0.550493100167076, 'reg_lambda': 0.039510885254402564}. Best is trial 71 with value: 0.12020033388981632.
[I 2024-10-21 17:48:32,466] Trial 84 finished with value: 0.14023372287145242 and parameters: {'boosting_type': 'goss', 'num_leaves': 45, 'learning_rate': 0.1143189401941594, 'n_estimators': 817, 'max_depth': 2, 'subsample': 0.8433803665502688, 'colsample_bytree': 0.6435651070400359, 'reg_alpha': 0.5100848599921799, 'reg_lambda': 0.11975175395127442}. Best is trial 71 with value: 0.12020033388981632.
[I 2024-10-21 17:48:32,719] Trial 85 finished with value: 0.12520868113522543 and parameters: {'boosting_type': 'goss', 'num_leaves': 28, 'learning_rate': 0.1220741231423237, 'n_estimators': 968, 'max_depth': 3, 'subsample': 0.9457779195729477, 'colsample_bytree': 0.5782473391184797, 'reg_alpha': 0.6840287047756574, 'reg_lambda': 0.0821548458916851}. Best is trial 71 with value: 0.12020033388981632.
[I 2024-10-21 17:48:33,039] Trial 86 finished with value: 0.13021702838063443 and parameters: {'boosting_type': 'goss', 'num_leaves': 28, 'learning_rate': 0.1254108000894112, 'n_estimators': 994, 'max_depth': 3, 'subsample': 0.9695532579847272, 'colsample_bytree': 0.5910916537647065, 'reg_alpha': 0.7295975059966009, 'reg_lambda': 0.08504168209615678}. Best is trial 71 with value: 0.12020033388981632.
[I 2024-10-21 17:48:33,351] Trial 87 finished with value: 0.13689482470784642 and parameters: {'boosting_type': 'goss', 'num_leaves': 52, 'learning_rate': 0.08171217234189519, 'n_estimators': 975, 'max_depth': 3, 'subsample': 0.9500908643828878, 'colsample_bytree': 0.5822614881905535, 'reg_alpha': 0.6958129196535676, 'reg_lambda': 0.8380036413659047}. Best is trial 71 with value: 0.12020033388981632.
[I 2024-10-21 17:48:33,596] Trial 88 finished with value: 0.1469115191986644 and parameters: {'boosting_type': 'goss', 'num_leaves': 21, 'learning_rate': 0.12410093725272225, 'n_estimators': 890, 'max_depth': 2, 'subsample': 0.9378983283612261, 'colsample_bytree': 0.5291913691551237, 'reg_alpha': 0.6201308020301514, 'reg_lambda': 0.016505680700276915}. Best is trial 71 with value: 0.12020033388981632.
[I 2024-10-21 17:48:33,948] Trial 89 finished with value: 0.12353923205342232 and parameters: {'boosting_type': 'goss', 'num_leaves': 67, 'learning_rate': 0.10044136962028333, 'n_estimators': 932, 'max_depth': 4, 'subsample': 0.9034560964219546, 'colsample_bytree': 0.5554517578420505, 'reg_alpha': 0.7898788929337637, 'reg_lambda': 0.13427020208473123}. Best is trial 71 with value: 0.12020033388981632.
[I 2024-10-21 17:48:34,304] Trial 90 finished with value: 0.13188647746243742 and parameters: {'boosting_type': 'goss', 'num_leaves': 64, 'learning_rate': 0.09145504533870664, 'n_estimators': 935, 'max_depth': 4, 'subsample': 0.9071558479378214, 'colsample_bytree': 0.5599048029084126, 'reg_alpha': 0.7728388126762996, 'reg_lambda': 0.23810397562407606}. Best is trial 71 with value: 0.12020033388981632.
[I 2024-10-21 17:48:34,630] Trial 91 finished with value: 0.13021702838063443 and parameters: {'boosting_type': 'goss', 'num_leaves': 38, 'learning_rate': 0.15673722174012122, 'n_estimators': 963, 'max_depth': 3, 'subsample': 0.9322691898230067, 'colsample_bytree': 0.605025586005869, 'reg_alpha': 0.8669801119782797, 'reg_lambda': 0.1273762882753621}. Best is trial 71 with value: 0.12020033388981632.
[I 2024-10-21 17:48:34,926] Trial 92 finished with value: 0.13021702838063443 and parameters: {'boosting_type': 'goss', 'num_leaves': 30, 'learning_rate': 0.14463670772720782, 'n_estimators': 929, 'max_depth': 4, 'subsample': 0.9601680495690924, 'colsample_bytree': 0.6336504615389975, 'reg_alpha': 0.5746299095655439, 'reg_lambda': 0.18079467442944486}. Best is trial 71 with value: 0.12020033388981632.
[I 2024-10-21 17:48:35,212] Trial 93 finished with value: 0.14023372287145242 and parameters: {'boosting_type': 'goss', 'num_leaves': 170, 'learning_rate': 0.06783944466836733, 'n_estimators': 879, 'max_depth': 3, 'subsample': 0.9176598314498203, 'colsample_bytree': 0.5760562561095027, 'reg_alpha': 0.4476931262287922, 'reg_lambda': 0.05276314217350854}. Best is trial 71 with value: 0.12020033388981632.
[I 2024-10-21 17:48:35,550] Trial 94 finished with value: 0.13689482470784642 and parameters: {'boosting_type': 'goss', 'num_leaves': 89, 'learning_rate': 0.09898957506783981, 'n_estimators': 913, 'max_depth': 4, 'subsample': 0.8950541551268724, 'colsample_bytree': 0.5095355073333274, 'reg_alpha': 0.6687683652294769, 'reg_lambda': 0.09393774064489893}. Best is trial 71 with value: 0.12020033388981632.
[I 2024-10-21 17:48:35,916] Trial 95 finished with value: 0.14023372287145242 and parameters: {'boosting_type': 'goss', 'num_leaves': 41, 'learning_rate': 0.018281767581359437, 'n_estimators': 836, 'max_depth': 5, 'subsample': 0.8793161373901035, 'colsample_bytree': 0.5323381630139788, 'reg_alpha': 0.8336486201807071, 'reg_lambda': 0.1533383131219011}. Best is trial 71 with value: 0.12020033388981632.
[I 2024-10-21 17:48:36,230] Trial 96 finished with value: 0.13856427378964942 and parameters: {'boosting_type': 'goss', 'num_leaves': 24, 'learning_rate': 0.2123641543799038, 'n_estimators': 999, 'max_depth': 3, 'subsample': 0.9468351630572243, 'colsample_bytree': 0.5469996550608416, 'reg_alpha': 0.5309805124285208, 'reg_lambda': 0.07162370438209228}. Best is trial 71 with value: 0.12020033388981632.
[I 2024-10-21 17:48:36,438] Trial 97 finished with value: 0.13856427378964942 and parameters: {'boosting_type': 'goss', 'num_leaves': 48, 'learning_rate': 0.18556866782106046, 'n_estimators': 940, 'max_depth': 2, 'subsample': 0.9874647743112103, 'colsample_bytree': 0.6816193844669566, 'reg_alpha': 0.9494120582377876, 'reg_lambda': 0.1357841000917456}. Best is trial 71 with value: 0.12020033388981632.
[I 2024-10-21 17:48:36,753] Trial 98 finished with value: 0.13355592654424042 and parameters: {'boosting_type': 'goss', 'num_leaves': 11, 'learning_rate': 0.24586849637906222, 'n_estimators': 795, 'max_depth': 4, 'subsample': 0.9011223282390043, 'colsample_bytree': 0.591915949421437, 'reg_alpha': 0.5697643324125816, 'reg_lambda': 0.1060506766047987}. Best is trial 71 with value: 0.12020033388981632.
[I 2024-10-21 17:48:37,002] Trial 99 finished with value: 0.12854757929883143 and parameters: {'boosting_type': 'goss', 'num_leaves': 7, 'learning_rate': 0.13522041617483474, 'n_estimators': 863, 'max_depth': 4, 'subsample': 0.9246087917537157, 'colsample_bytree': 0.6192717413564688, 'reg_alpha': 0.4935458908788613, 'reg_lambda': 0.20200689703880648}. Best is trial 71 with value: 0.12020033388981632.
