[I 2024-12-15 13:48:43,997] Trial 56 finished with value: 0.1233333333333333 and parameters: {'boosting_type': 'goss', 'num_leaves': 244, 'learning_rate': 0.3662419617731853, 'n_estimators': 813, 'max_depth': 10, 'subsample': 0.6546891417543927, 'colsample_bytree': 0.8295857546074837, 'reg_alpha': 0.9936116257464607, 'reg_lambda': 0.41180379161300446}. Best is trial 56 with value: 0.1233333333333333.
[I 2024-12-15 13:48:44,399] Trial 57 finished with value: 0.13 and parameters: {'boosting_type': 'goss', 'num_leaves': 244, 'learning_rate': 0.37171617197462564, 'n_estimators': 821, 'max_depth': 7, 'subsample': 0.6424019001464124, 'colsample_bytree': 0.8343010031937477, 'reg_alpha': 0.8653590133031497, 'reg_lambda': 0.22438562501922563}. Best is trial 56 with value: 0.1233333333333333.
[I 2024-12-15 13:48:44,701] Trial 58 finished with value: 0.1333333333333333 and parameters: {'boosting_type': 'goss', 'num_leaves': 93, 'learning_rate': 0.41319740056493703, 'n_estimators': 751, 'max_depth': 4, 'subsample': 0.589979014843746, 'colsample_bytree': 0.8192578188331354, 'reg_alpha': 0.9543342353840139, 'reg_lambda': 0.16802351137312335}. Best is trial 56 with value: 0.1233333333333333.
[I 2024-12-15 13:48:45,080] Trial 59 finished with value: 0.1333333333333333 and parameters: {'boosting_type': 'goss', 'num_leaves': 256, 'learning_rate': 0.4804021596863566, 'n_estimators': 888, 'max_depth': 6, 'subsample': 0.9036298220331138, 'colsample_bytree': 0.8725517138336222, 'reg_alpha': 0.7841324075666675, 'reg_lambda': 0.051092824235178746}. Best is trial 56 with value: 0.1233333333333333.
[I 2024-12-15 13:48:45,300] Trial 60 finished with value: 0.14166666666666672 and parameters: {'boosting_type': 'goss', 'num_leaves': 214, 'learning_rate': 0.44136781378065243, 'n_estimators': 635, 'max_depth': 3, 'subsample': 0.653744525557171, 'colsample_bytree': 0.8450506596248641, 'reg_alpha': 0.5623663307433351, 'reg_lambda': 0.40387349113383253}. Best is trial 56 with value: 0.1233333333333333.
[I 2024-12-15 13:48:45,847] Trial 61 finished with value: 0.1316666666666667 and parameters: {'boosting_type': 'goss', 'num_leaves': 229, 'learning_rate': 0.3974856901921634, 'n_estimators': 949, 'max_depth': 10, 'subsample': 0.6889233147681728, 'colsample_bytree': 0.8130683678892503, 'reg_alpha': 0.13720958467604866, 'reg_lambda': 0.4761626110358346}. Best is trial 56 with value: 0.1233333333333333.
[I 2024-12-15 13:48:46,329] Trial 62 finished with value: 0.13 and parameters: {'boosting_type': 'goss', 'num_leaves': 201, 'learning_rate': 0.27803060938816115, 'n_estimators': 864, 'max_depth': 10, 'subsample': 0.7280490753802519, 'colsample_bytree': 0.7564732212267369, 'reg_alpha': 0.4590085337098945, 'reg_lambda': 0.2797119339142109}. Best is trial 56 with value: 0.1233333333333333.
[I 2024-12-15 13:48:46,516] Trial 63 finished with value: 0.1316666666666667 and parameters: {'boosting_type': 'gbdt', 'num_leaves': 238, 'learning_rate': 0.33638661440231976, 'n_estimators': 501, 'max_depth': 9, 'subsample': 0.6250930727043522, 'colsample_bytree': 0.5822904016145052, 'reg_alpha': 0.9947977193352265, 'reg_lambda': 0.3322225037813584}. Best is trial 56 with value: 0.1233333333333333.
[I 2024-12-15 13:48:48,646] Trial 64 finished with value: 0.1266666666666667 and parameters: {'boosting_type': 'dart', 'num_leaves': 142, 'learning_rate': 0.1641170925823368, 'n_estimators': 800, 'max_depth': 9, 'subsample': 0.6714516704622643, 'colsample_bytree': 0.8977035922911724, 'reg_alpha': 0.6256132573820731, 'reg_lambda': 0.3729509600368936}. Best is trial 56 with value: 0.1233333333333333.
[I 2024-12-15 13:48:49,107] Trial 65 finished with value: 0.1333333333333333 and parameters: {'boosting_type': 'goss', 'num_leaves': 120, 'learning_rate': 0.3664875710770781, 'n_estimators': 698, 'max_depth': 10, 'subsample': 0.7074557624650618, 'colsample_bytree': 0.8630161290761658, 'reg_alpha': 0.07972813237457532, 'reg_lambda': 0.237946868891581}. Best is trial 56 with value: 0.1233333333333333.
[I 2024-12-15 13:48:49,460] Trial 66 finished with value: 0.1316666666666667 and parameters: {'boosting_type': 'gbdt', 'num_leaves': 173, 'learning_rate': 0.311746146453762, 'n_estimators': 393, 'max_depth': 8, 'subsample': 0.6079384667330994, 'colsample_bytree': 0.7803116913841891, 'reg_alpha': 0.030183587956474862, 'reg_lambda': 0.12322744311920136}. Best is trial 56 with value: 0.1233333333333333.
[I 2024-12-15 13:48:49,630] Trial 67 finished with value: 0.18999999999999995 and parameters: {'boosting_type': 'goss', 'num_leaves': 228, 'learning_rate': 0.015256194317407934, 'n_estimators': 590, 'max_depth': 2, 'subsample': 0.6375650301392768, 'colsample_bytree': 0.9296546469689102, 'reg_alpha': 0.00013724263620996935, 'reg_lambda': 0.4195360517895057}. Best is trial 56 with value: 0.1233333333333333.
[I 2024-12-15 13:48:52,630] Trial 68 finished with value: 0.1266666666666667 and parameters: {'boosting_type': 'dart', 'num_leaves': 248, 'learning_rate': 0.25252913878032046, 'n_estimators': 976, 'max_depth': 10, 'subsample': 0.7647625355951726, 'colsample_bytree': 0.6558488542101434, 'reg_alpha': 0.1261860786932587, 'reg_lambda': 0.3075470406765871}. Best is trial 56 with value: 0.1233333333333333.
[I 2024-12-15 13:48:52,779] Trial 69 finished with value: 0.15000000000000002 and parameters: {'boosting_type': 'gbdt', 'num_leaves': 152, 'learning_rate': 0.2899715235190699, 'n_estimators': 908, 'max_depth': 1, 'subsample': 0.6826154000624632, 'colsample_bytree': 0.6225714676304646, 'reg_alpha': 0.22460722375141376, 'reg_lambda': 0.3572239920058353}. Best is trial 56 with value: 0.1233333333333333.
[I 2024-12-15 13:48:53,158] Trial 70 finished with value: 0.1333333333333333 and parameters: {'boosting_type': 'goss', 'num_leaves': 205, 'learning_rate': 0.4252986974870068, 'n_estimators': 746, 'max_depth': 9, 'subsample': 0.7154428830659626, 'colsample_bytree': 0.5360040680843547, 'reg_alpha': 0.7403337243943586, 'reg_lambda': 0.5382097045686887}. Best is trial 56 with value: 0.1233333333333333.
[I 2024-12-15 13:48:54,161] Trial 71 finished with value: 0.1233333333333333 and parameters: {'boosting_type': 'dart', 'num_leaves': 127, 'learning_rate': 0.2482489538907913, 'n_estimators': 450, 'max_depth': 10, 'subsample': 0.6627171011093805, 'colsample_bytree': 0.5514104500371352, 'reg_alpha': 0.033212014464876684, 'reg_lambda': 0.6548224073295248}. Best is trial 56 with value: 0.1233333333333333.
[I 2024-12-15 13:48:55,290] Trial 72 finished with value: 0.1333333333333333 and parameters: {'boosting_type': 'dart', 'num_leaves': 131, 'learning_rate': 0.22609749613959151, 'n_estimators': 486, 'max_depth': 10, 'subsample': 0.6676505242844223, 'colsample_bytree': 0.5079527839210315, 'reg_alpha': 0.07111997554096028, 'reg_lambda': 0.7012517963436342}. Best is trial 56 with value: 0.1233333333333333.
[I 2024-12-15 13:48:56,242] Trial 73 finished with value: 0.1283333333333333 and parameters: {'boosting_type': 'dart', 'num_leaves': 111, 'learning_rate': 0.2102577236749225, 'n_estimators': 429, 'max_depth': 10, 'subsample': 0.9319335396308055, 'colsample_bytree': 0.5574764943565347, 'reg_alpha': 0.03246662566644576, 'reg_lambda': 0.5024005589168232}. Best is trial 56 with value: 0.1233333333333333.
[I 2024-12-15 13:48:57,178] Trial 74 finished with value: 0.1316666666666667 and parameters: {'boosting_type': 'dart', 'num_leaves': 124, 'learning_rate': 0.27053905444897197, 'n_estimators': 454, 'max_depth': 9, 'subsample': 0.5699708935344675, 'colsample_bytree': 0.589980677547949, 'reg_alpha': 0.10468767164808662, 'reg_lambda': 0.7578452514856527}. Best is trial 56 with value: 0.1233333333333333.
[I 2024-12-15 13:48:57,658] Trial 75 finished with value: 0.1216666666666667 and parameters: {'boosting_type': 'dart', 'num_leaves': 188, 'learning_rate': 0.38428160005655077, 'n_estimators': 509, 'max_depth': 4, 'subsample': 0.6559754388621826, 'colsample_bytree': 0.8412231805484726, 'reg_alpha': 0.1561332810889737, 'reg_lambda': 0.6018638473866333}. Best is trial 75 with value: 0.1216666666666667.
[I 2024-12-15 13:48:58,185] Trial 76 finished with value: 0.1333333333333333 and parameters: {'boosting_type': 'dart', 'num_leaves': 143, 'learning_rate': 0.35868542835228845, 'n_estimators': 548, 'max_depth': 4, 'subsample': 0.5938186697609714, 'colsample_bytree': 0.8428889835565436, 'reg_alpha': 0.14382759668328474, 'reg_lambda': 0.6585375140843831}. Best is trial 75 with value: 0.1216666666666667.
[I 2024-12-15 13:48:58,697] Trial 77 finished with value: 0.1316666666666667 and parameters: {'boosting_type': 'dart', 'num_leaves': 186, 'learning_rate': 0.3863612925990988, 'n_estimators': 517, 'max_depth': 4, 'subsample': 0.6273709224218134, 'colsample_bytree': 0.818046692605473, 'reg_alpha': 0.18200745272314112, 'reg_lambda': 0.6055381880836376}. Best is trial 75 with value: 0.1216666666666667.
[I 2024-12-15 13:48:58,976] Trial 78 finished with value: 0.1333333333333333 and parameters: {'boosting_type': 'dart', 'num_leaves': 163, 'learning_rate': 0.32854273152973257, 'n_estimators': 397, 'max_depth': 3, 'subsample': 0.651238894221251, 'colsample_bytree': 0.8845111024173595, 'reg_alpha': 0.061470860271561706, 'reg_lambda': 0.6804855365189206}. Best is trial 75 with value: 0.1216666666666667.
[I 2024-12-15 13:48:59,797] Trial 79 finished with value: 0.1333333333333333 and parameters: {'boosting_type': 'dart', 'num_leaves': 155, 'learning_rate': 0.40909047814755756, 'n_estimators': 620, 'max_depth': 5, 'subsample': 0.6140935296668479, 'colsample_bytree': 0.7116008125607528, 'reg_alpha': 0.32537460002568014, 'reg_lambda': 0.5542684392086527}. Best is trial 75 with value: 0.1216666666666667.
[I 2024-12-15 13:49:00,119] Trial 80 finished with value: 0.14166666666666672 and parameters: {'boosting_type': 'dart', 'num_leaves': 223, 'learning_rate': 0.3427810518211889, 'n_estimators': 565, 'max_depth': 2, 'subsample': 0.7415200994717793, 'colsample_bytree': 0.8636690794201077, 'reg_alpha': 0.09315487254888122, 'reg_lambda': 0.7903399754543825}. Best is trial 75 with value: 0.1216666666666667.
[I 2024-12-15 13:49:00,488] Trial 81 finished with value: 0.13 and parameters: {'boosting_type': 'gbdt', 'num_leaves': 197, 'learning_rate': 0.3787063887791302, 'n_estimators': 302, 'max_depth': 10, 'subsample': 0.6810347513119979, 'colsample_bytree': 0.520799467598816, 'reg_alpha': 0.04041543138333485, 'reg_lambda': 0.6102384625098921}. Best is trial 75 with value: 0.1216666666666667.
[I 2024-12-15 13:49:00,672] Trial 82 finished with value: 0.1383333333333333 and parameters: {'boosting_type': 'goss', 'num_leaves': 170, 'learning_rate': 0.24638974832665606, 'n_estimators': 507, 'max_depth': 3, 'subsample': 0.6940394312197198, 'colsample_bytree': 0.8039827770957941, 'reg_alpha': 0.014546050602335407, 'reg_lambda': 0.17937362967198536}. Best is trial 75 with value: 0.1216666666666667.
[I 2024-12-15 13:49:01,085] Trial 83 finished with value: 0.1233333333333333 and parameters: {'boosting_type': 'dart', 'num_leaves': 101, 'learning_rate': 0.26542518314692276, 'n_estimators': 460, 'max_depth': 4, 'subsample': 0.656332347404457, 'colsample_bytree': 0.5729668882984255, 'reg_alpha': 0.11326663842584105, 'reg_lambda': 0.4608200504426683}. Best is trial 75 with value: 0.1216666666666667.
[I 2024-12-15 13:49:01,877] Trial 84 finished with value: 0.125 and parameters: {'boosting_type': 'dart', 'num_leaves': 101, 'learning_rate': 0.35689382903436395, 'n_estimators': 721, 'max_depth': 4, 'subsample': 0.6378006446237846, 'colsample_bytree': 0.570554052631445, 'reg_alpha': 0.156641558073999, 'reg_lambda': 0.5715413296133011}. Best is trial 75 with value: 0.1216666666666667.
[I 2024-12-15 13:49:02,594] Trial 85 finished with value: 0.1283333333333333 and parameters: {'boosting_type': 'dart', 'num_leaves': 84, 'learning_rate': 0.29908544034877116, 'n_estimators': 674, 'max_depth': 4, 'subsample': 0.6329098858731496, 'colsample_bytree': 0.5648533919699925, 'reg_alpha': 0.2094761119277147, 'reg_lambda': 0.4967034994225167}. Best is trial 75 with value: 0.1216666666666667.
[I 2024-12-15 13:49:02,881] Trial 86 finished with value: 0.14500000000000002 and parameters: {'boosting_type': 'dart', 'num_leaves': 104, 'learning_rate': 0.22913263801743214, 'n_estimators': 338, 'max_depth': 4, 'subsample': 0.653579837634858, 'colsample_bytree': 0.5793876085601677, 'reg_alpha': 0.1535737834515612, 'reg_lambda': 0.571658853675782}. Best is trial 75 with value: 0.1216666666666667.
[I 2024-12-15 13:49:03,419] Trial 87 finished with value: 0.1233333333333333 and parameters: {'boosting_type': 'dart', 'num_leaves': 92, 'learning_rate': 0.320930953619469, 'n_estimators': 473, 'max_depth': 5, 'subsample': 0.6571399658568126, 'colsample_bytree': 0.6140208967145967, 'reg_alpha': 0.10369156291398708, 'reg_lambda': 0.6239331551180086}. Best is trial 75 with value: 0.1216666666666667.
[I 2024-12-15 13:49:03,858] Trial 88 finished with value: 0.14166666666666672 and parameters: {'boosting_type': 'dart', 'num_leaves': 71, 'learning_rate': 0.3586938595930353, 'n_estimators': 475, 'max_depth': 4, 'subsample': 0.6612917116619811, 'colsample_bytree': 0.6064604609558463, 'reg_alpha': 0.11381081320797035, 'reg_lambda': 0.5857379054934533}. Best is trial 75 with value: 0.1216666666666667.
[I 2024-12-15 13:49:04,309] Trial 89 finished with value: 0.13 and parameters: {'boosting_type': 'dart', 'num_leaves': 60, 'learning_rate': 0.3129871550790686, 'n_estimators': 415, 'max_depth': 5, 'subsample': 0.6779751053421729, 'colsample_bytree': 0.5736445240687763, 'reg_alpha': 0.2678120354837273, 'reg_lambda': 0.6416303821642935}. Best is trial 75 with value: 0.1216666666666667.
[I 2024-12-15 13:49:04,740] Trial 90 finished with value: 0.125 and parameters: {'boosting_type': 'dart', 'num_leaves': 89, 'learning_rate': 0.34582269856534714, 'n_estimators': 564, 'max_depth': 3, 'subsample': 0.599628760608838, 'colsample_bytree': 0.6323109055150866, 'reg_alpha': 0.1592887497489713, 'reg_lambda': 0.6296766327980284}. Best is trial 75 with value: 0.1216666666666667.
[I 2024-12-15 13:49:05,165] Trial 91 finished with value: 0.1333333333333333 and parameters: {'boosting_type': 'dart', 'num_leaves': 91, 'learning_rate': 0.3252012894616999, 'n_estimators': 562, 'max_depth': 3, 'subsample': 0.5973904149215821, 'colsample_bytree': 0.6170440144273579, 'reg_alpha': 0.24188922697578752, 'reg_lambda': 0.628422972550983}. Best is trial 75 with value: 0.1216666666666667.
[I 2024-12-15 13:49:05,643] Trial 92 finished with value: 0.13 and parameters: {'boosting_type': 'dart', 'num_leaves': 97, 'learning_rate': 0.3480021717728329, 'n_estimators': 601, 'max_depth': 3, 'subsample': 0.6163107541029521, 'colsample_bytree': 0.6767174410770265, 'reg_alpha': 0.1948022439179709, 'reg_lambda': 0.6797707381225149}. Best is trial 75 with value: 0.1216666666666667.
[I 2024-12-15 13:49:06,167] Trial 93 finished with value: 0.13666666666666671 and parameters: {'boosting_type': 'dart', 'num_leaves': 104, 'learning_rate': 0.3360945681650375, 'n_estimators': 462, 'max_depth': 5, 'subsample': 0.5605882176357433, 'colsample_bytree': 0.6354234375269154, 'reg_alpha': 0.16083515659700248, 'reg_lambda': 0.5503258778401237}. Best is trial 75 with value: 0.1216666666666667.
[I 2024-12-15 13:49:06,466] Trial 94 finished with value: 0.15000000000000002 and parameters: {'boosting_type': 'dart', 'num_leaves': 79, 'learning_rate': 0.37042008077227573, 'n_estimators': 538, 'max_depth': 2, 'subsample': 0.5020532090920022, 'colsample_bytree': 0.6462630056411223, 'reg_alpha': 0.06554833504825586, 'reg_lambda': 0.6135230332643776}. Best is trial 75 with value: 0.1216666666666667.
[I 2024-12-15 13:49:07,150] Trial 95 finished with value: 0.1266666666666667 and parameters: {'boosting_type': 'dart', 'num_leaves': 115, 'learning_rate': 0.28326879528338067, 'n_estimators': 486, 'max_depth': 6, 'subsample': 0.5316459002349115, 'colsample_bytree': 0.5896080478951686, 'reg_alpha': 0.11534457436789403, 'reg_lambda': 0.5218175682615501}. Best is trial 75 with value: 0.1216666666666667.
[I 2024-12-15 13:49:07,504] Trial 96 finished with value: 0.135 and parameters: {'boosting_type': 'dart', 'num_leaves': 100, 'learning_rate': 0.3918301577504371, 'n_estimators': 381, 'max_depth': 4, 'subsample': 0.6357482034391124, 'colsample_bytree': 0.5359139329997944, 'reg_alpha': 0.40307632657429976, 'reg_lambda': 0.4570907521745835}. Best is trial 75 with value: 0.1216666666666667.
[I 2024-12-15 13:49:07,888] Trial 97 finished with value: 0.125 and parameters: {'boosting_type': 'dart', 'num_leaves': 81, 'learning_rate': 0.35564684054338574, 'n_estimators': 432, 'max_depth': 4, 'subsample': 0.6588995525836923, 'colsample_bytree': 0.6171471631954122, 'reg_alpha': 0.09023357631211763, 'reg_lambda': 0.6649792465058492}. Best is trial 75 with value: 0.1216666666666667.
[I 2024-12-15 13:49:08,487] Trial 98 finished with value: 0.125 and parameters: {'boosting_type': 'dart', 'num_leaves': 136, 'learning_rate': 0.29804641365086565, 'n_estimators': 516, 'max_depth': 5, 'subsample': 0.6432639734636236, 'colsample_bytree': 0.5611211668963922, 'reg_alpha': 0.1408597910722227, 'reg_lambda': 0.7552559877931437}. Best is trial 75 with value: 0.1216666666666667.
[I 2024-12-15 13:49:08,715] Trial 99 finished with value: 0.14 and parameters: {'boosting_type': 'dart', 'num_leaves': 86, 'learning_rate': 0.4045609090177229, 'n_estimators': 335, 'max_depth': 3, 'subsample': 0.5798064253224439, 'colsample_bytree': 0.5997815375115891, 'reg_alpha': 0.17694363773066024, 'reg_lambda': 0.5962310040680516}. Best is trial 75 with value: 0.1216666666666667.
Traceback (most recent call last):
  File "/nfs/home/igolovkin/lgbm_sirna_class.py", line 270, in <module>
    fpr, tpr, thresholds = roc_curve(y_valid, y_pred_prob_test)
  File "/nfs/home/igolovkin/venv/lib/python3.10/site-packages/sklearn/utils/_param_validation.py", line 213, in wrapper
    return func(*args, **kwargs)
  File "/nfs/home/igolovkin/venv/lib/python3.10/site-packages/sklearn/metrics/_ranking.py", line 1108, in roc_curve
    fps, tps, thresholds = _binary_clf_curve(
  File "/nfs/home/igolovkin/venv/lib/python3.10/site-packages/sklearn/metrics/_ranking.py", line 834, in _binary_clf_curve
    pos_label = _check_pos_label_consistency(pos_label, y_true)
  File "/nfs/home/igolovkin/venv/lib/python3.10/site-packages/sklearn/utils/validation.py", line 2454, in _check_pos_label_consistency
    raise ValueError(
ValueError: y_true takes value in {1, 2} and pos_label is not specified: either make y_true take value in {0, 1} or {-1, 1} or pass pos_label explicitly.
