[I 2024-10-22 10:46:57,308] Trial 55 finished with value: 0.13 and parameters: {'boosting_type': 'dart', 'num_leaves': 224, 'learning_rate': 0.1654618688505221, 'n_estimators': 996, 'max_depth': 8, 'subsample': 0.604529509704743, 'colsample_bytree': 0.5238913865185943, 'reg_alpha': 0.49601077445023456, 'reg_lambda': 0.34740887693841005}. Best is trial 1 with value: 0.1233333333333333.
[I 2024-10-22 10:46:57,572] Trial 56 finished with value: 0.13 and parameters: {'boosting_type': 'gbdt', 'num_leaves': 30, 'learning_rate': 0.28602020336106526, 'n_estimators': 876, 'max_depth': 9, 'subsample': 0.7242452118508216, 'colsample_bytree': 0.5527629355482618, 'reg_alpha': 0.2796043376527488, 'reg_lambda': 0.5009582775617305}. Best is trial 1 with value: 0.1233333333333333.
[I 2024-10-22 10:46:57,848] Trial 57 finished with value: 0.1266666666666667 and parameters: {'boosting_type': 'goss', 'num_leaves': 49, 'learning_rate': 0.24707377619083806, 'n_estimators': 638, 'max_depth': 10, 'subsample': 0.6255426542709968, 'colsample_bytree': 0.74951896678634, 'reg_alpha': 0.41688455299429106, 'reg_lambda': 0.24195556320531808}. Best is trial 1 with value: 0.1233333333333333.
[I 2024-10-22 10:46:59,294] Trial 58 finished with value: 0.135 and parameters: {'boosting_type': 'dart', 'num_leaves': 100, 'learning_rate': 0.3545917434781726, 'n_estimators': 715, 'max_depth': 9, 'subsample': 0.8569679936069122, 'colsample_bytree': 0.815867390708463, 'reg_alpha': 0.11799221846381533, 'reg_lambda': 0.29492100608159066}. Best is trial 1 with value: 0.1233333333333333.
[I 2024-10-22 10:46:59,463] Trial 59 finished with value: 0.14 and parameters: {'boosting_type': 'gbdt', 'num_leaves': 9, 'learning_rate': 0.301267419338615, 'n_estimators': 795, 'max_depth': 6, 'subsample': 0.8001957289758131, 'colsample_bytree': 0.9059632924059993, 'reg_alpha': 0.5864123990446648, 'reg_lambda': 0.5591933916913225}. Best is trial 1 with value: 0.1233333333333333.
[I 2024-10-22 10:46:59,521] Trial 60 finished with value: 0.1466666666666666 and parameters: {'boosting_type': 'dart', 'num_leaves': 165, 'learning_rate': 0.2712353242369062, 'n_estimators': 39, 'max_depth': 7, 'subsample': 0.675570344094577, 'colsample_bytree': 0.7001449421619687, 'reg_alpha': 0.32114704104078906, 'reg_lambda': 0.44364481391097094}. Best is trial 1 with value: 0.1233333333333333.
[I 2024-10-22 10:46:59,923] Trial 61 finished with value: 0.1283333333333333 and parameters: {'boosting_type': 'gbdt', 'num_leaves': 132, 'learning_rate': 0.23434655460792672, 'n_estimators': 841, 'max_depth': 8, 'subsample': 0.8272748740818928, 'colsample_bytree': 0.6175754943801792, 'reg_alpha': 0.04480533561372779, 'reg_lambda': 0.4684653328497991}. Best is trial 1 with value: 0.1233333333333333.
[I 2024-10-22 10:47:00,316] Trial 62 finished with value: 0.1283333333333333 and parameters: {'boosting_type': 'gbdt', 'num_leaves': 113, 'learning_rate': 0.2045298444638823, 'n_estimators': 817, 'max_depth': 8, 'subsample': 0.8135761553086344, 'colsample_bytree': 0.5972318688244684, 'reg_alpha': 0.12771598879751495, 'reg_lambda': 0.5018049526737806}. Best is trial 1 with value: 0.1233333333333333.
[I 2024-10-22 10:47:00,640] Trial 63 finished with value: 0.1233333333333333 and parameters: {'boosting_type': 'gbdt', 'num_leaves': 137, 'learning_rate': 0.17385948312295765, 'n_estimators': 949, 'max_depth': 7, 'subsample': 0.7683137748846361, 'colsample_bytree': 0.5744363850707846, 'reg_alpha': 0.38681201834741835, 'reg_lambda': 0.3710125042714576}. Best is trial 1 with value: 0.1233333333333333.
[I 2024-10-22 10:47:00,935] Trial 64 finished with value: 0.125 and parameters: {'boosting_type': 'gbdt', 'num_leaves': 182, 'learning_rate': 0.1343868067642485, 'n_estimators': 934, 'max_depth': 7, 'subsample': 0.7725492149591318, 'colsample_bytree': 0.5735267323429775, 'reg_alpha': 0.46095779203169274, 'reg_lambda': 0.3696766910822488}. Best is trial 1 with value: 0.1233333333333333.
[I 2024-10-22 10:47:01,265] Trial 65 finished with value: 0.1266666666666667 and parameters: {'boosting_type': 'gbdt', 'num_leaves': 193, 'learning_rate': 0.17392007121905448, 'n_estimators': 964, 'max_depth': 5, 'subsample': 0.9059951013497916, 'colsample_bytree': 0.5468687788019332, 'reg_alpha': 0.3913937029884087, 'reg_lambda': 0.32142790209300676}. Best is trial 1 with value: 0.1233333333333333.
[I 2024-10-22 10:47:02,708] Trial 66 finished with value: 0.13 and parameters: {'boosting_type': 'dart', 'num_leaves': 154, 'learning_rate': 0.1082001577066197, 'n_estimators': 888, 'max_depth': 6, 'subsample': 0.582148574589169, 'colsample_bytree': 0.5049894721169765, 'reg_alpha': 0.4399669107750463, 'reg_lambda': 0.4186234007392301}. Best is trial 1 with value: 0.1233333333333333.
[I 2024-10-22 10:47:03,106] Trial 67 finished with value: 0.1316666666666667 and parameters: {'boosting_type': 'goss', 'num_leaves': 19, 'learning_rate': 0.14770775797578964, 'n_estimators': 924, 'max_depth': 9, 'subsample': 0.5341554930109318, 'colsample_bytree': 0.6274210073901628, 'reg_alpha': 0.38001825869729455, 'reg_lambda': 0.980022765557463}. Best is trial 1 with value: 0.1233333333333333.
[I 2024-10-22 10:47:03,322] Trial 68 finished with value: 0.1316666666666667 and parameters: {'boosting_type': 'gbdt', 'num_leaves': 62, 'learning_rate': 0.21694344438803997, 'n_estimators': 958, 'max_depth': 7, 'subsample': 0.514581908358379, 'colsample_bytree': 0.8702683902134647, 'reg_alpha': 0.5256065425035216, 'reg_lambda': 0.15439688395165418}. Best is trial 1 with value: 0.1233333333333333.
[I 2024-10-22 10:47:05,298] Trial 69 finished with value: 0.1283333333333333 and parameters: {'boosting_type': 'dart', 'num_leaves': 40, 'learning_rate': 0.19604524993966846, 'n_estimators': 860, 'max_depth': 10, 'subsample': 0.7555939991504106, 'colsample_bytree': 0.5209499035883698, 'reg_alpha': 0.25978879047713943, 'reg_lambda': 0.7551844133912446}. Best is trial 1 with value: 0.1233333333333333.
[I 2024-10-22 10:47:05,524] Trial 70 finished with value: 0.17166666666666663 and parameters: {'boosting_type': 'dart', 'num_leaves': 2, 'learning_rate': 0.33411016900072965, 'n_estimators': 609, 'max_depth': 8, 'subsample': 0.8809151594643887, 'colsample_bytree': 0.5831610659671015, 'reg_alpha': 0.48534167435877384, 'reg_lambda': 0.6631959082131627}. Best is trial 1 with value: 0.1233333333333333.
[I 2024-10-22 10:47:05,799] Trial 71 finished with value: 0.1316666666666667 and parameters: {'boosting_type': 'gbdt', 'num_leaves': 129, 'learning_rate': 0.2273168113082606, 'n_estimators': 912, 'max_depth': 8, 'subsample': 0.7903119033654985, 'colsample_bytree': 0.6008531496301573, 'reg_alpha': 0.15152570721422737, 'reg_lambda': 0.40537520405365884}. Best is trial 1 with value: 0.1233333333333333.
[I 2024-10-22 10:47:06,054] Trial 72 finished with value: 0.1283333333333333 and parameters: {'boosting_type': 'gbdt', 'num_leaves': 144, 'learning_rate': 0.16839120538732666, 'n_estimators': 758, 'max_depth': 7, 'subsample': 0.8184344336579797, 'colsample_bytree': 0.6052652048154159, 'reg_alpha': 0.3363160170843453, 'reg_lambda': 0.35292017560151295}. Best is trial 1 with value: 0.1233333333333333.
[I 2024-10-22 10:47:06,371] Trial 73 finished with value: 0.1266666666666667 and parameters: {'boosting_type': 'gbdt', 'num_leaves': 115, 'learning_rate': 0.25572112378235423, 'n_estimators': 840, 'max_depth': 6, 'subsample': 0.7793712590301366, 'colsample_bytree': 0.6581512056893234, 'reg_alpha': 0.08001329357275694, 'reg_lambda': 0.48895076275138327}. Best is trial 1 with value: 0.1233333333333333.
[I 2024-10-22 10:47:06,683] Trial 74 finished with value: 0.13 and parameters: {'boosting_type': 'gbdt', 'num_leaves': 93, 'learning_rate': 0.19400131006438126, 'n_estimators': 545, 'max_depth': 9, 'subsample': 0.8021539226865178, 'colsample_bytree': 0.765756361211565, 'reg_alpha': 0.1055621671392513, 'reg_lambda': 0.6049615413902343}. Best is trial 1 with value: 0.1233333333333333.
[I 2024-10-22 10:47:06,971] Trial 75 finished with value: 0.1283333333333333 and parameters: {'boosting_type': 'gbdt', 'num_leaves': 102, 'learning_rate': 0.22035948644522824, 'n_estimators': 938, 'max_depth': 8, 'subsample': 0.639936409770206, 'colsample_bytree': 0.5634105030821319, 'reg_alpha': 0.3612840599660176, 'reg_lambda': 0.4541227974382203}. Best is trial 1 with value: 0.1233333333333333.
[I 2024-10-22 10:47:07,259] Trial 76 finished with value: 0.1283333333333333 and parameters: {'boosting_type': 'gbdt', 'num_leaves': 256, 'learning_rate': 0.15339484735600328, 'n_estimators': 807, 'max_depth': 10, 'subsample': 0.5492603228650343, 'colsample_bytree': 0.7220993417242207, 'reg_alpha': 0.291849043683832, 'reg_lambda': 0.30375486305130006}. Best is trial 1 with value: 0.1233333333333333.
[I 2024-10-22 10:47:09,087] Trial 77 finished with value: 0.1266666666666667 and parameters: {'boosting_type': 'dart', 'num_leaves': 121, 'learning_rate': 0.23950941472557638, 'n_estimators': 975, 'max_depth': 7, 'subsample': 0.7298021387187752, 'colsample_bytree': 0.5716622049912461, 'reg_alpha': 0.2326173163097155, 'reg_lambda': 0.5385203934371182}. Best is trial 1 with value: 0.1233333333333333.
[I 2024-10-22 10:47:09,443] Trial 78 finished with value: 0.13 and parameters: {'boosting_type': 'gbdt', 'num_leaves': 156, 'learning_rate': 0.2766819813849017, 'n_estimators': 889, 'max_depth': 6, 'subsample': 0.7570673469671867, 'colsample_bytree': 0.8496316650415795, 'reg_alpha': 0.03301198823575913, 'reg_lambda': 0.2576306101189751}. Best is trial 1 with value: 0.1233333333333333.
[I 2024-10-22 10:47:09,784] Trial 79 finished with value: 0.1266666666666667 and parameters: {'boosting_type': 'goss', 'num_leaves': 77, 'learning_rate': 0.17753298845401624, 'n_estimators': 772, 'max_depth': 9, 'subsample': 0.5009775197861386, 'colsample_bytree': 0.6287793433044497, 'reg_alpha': 0.1922682635310189, 'reg_lambda': 0.43008067788031784}. Best is trial 1 with value: 0.1233333333333333.
[I 2024-10-22 10:47:10,580] Trial 80 finished with value: 0.1333333333333333 and parameters: {'boosting_type': 'dart', 'num_leaves': 241, 'learning_rate': 0.09995708362781791, 'n_estimators': 846, 'max_depth': 4, 'subsample': 0.614009455592428, 'colsample_bytree': 0.6846035431112885, 'reg_alpha': 0.4344766359255911, 'reg_lambda': 0.32948303594396794}. Best is trial 1 with value: 0.1233333333333333.
[I 2024-10-22 10:47:10,881] Trial 81 finished with value: 0.1333333333333333 and parameters: {'boosting_type': 'gbdt', 'num_leaves': 84, 'learning_rate': 0.3019709685818913, 'n_estimators': 948, 'max_depth': 7, 'subsample': 0.7923655331852129, 'colsample_bytree': 0.5289222709302278, 'reg_alpha': 0.1392207044261803, 'reg_lambda': 0.3704113754288788}. Best is trial 1 with value: 0.1233333333333333.
[I 2024-10-22 10:47:11,224] Trial 82 finished with value: 0.1283333333333333 and parameters: {'boosting_type': 'gbdt', 'num_leaves': 131, 'learning_rate': 0.27803625673782567, 'n_estimators': 918, 'max_depth': 7, 'subsample': 0.7824058915992332, 'colsample_bytree': 0.5145114010134528, 'reg_alpha': 0.09758569456982907, 'reg_lambda': 0.3885185911594829}. Best is trial 1 with value: 0.1233333333333333.
[I 2024-10-22 10:47:11,457] Trial 83 finished with value: 0.1266666666666667 and parameters: {'boosting_type': 'gbdt', 'num_leaves': 30, 'learning_rate': 0.32256748058964035, 'n_estimators': 983, 'max_depth': 8, 'subsample': 0.8492496745214307, 'colsample_bytree': 0.5457520527343867, 'reg_alpha': 0.40096414611618386, 'reg_lambda': 0.3628187154284029}. Best is trial 1 with value: 0.1233333333333333.
[I 2024-10-22 10:47:11,690] Trial 84 finished with value: 0.1266666666666667 and parameters: {'boosting_type': 'gbdt', 'num_leaves': 49, 'learning_rate': 0.2591686377441297, 'n_estimators': 882, 'max_depth': 5, 'subsample': 0.5888822520130659, 'colsample_bytree': 0.7819657532634446, 'reg_alpha': 0.24590864202475352, 'reg_lambda': 0.4683411984302626}. Best is trial 1 with value: 0.1233333333333333.
[I 2024-10-22 10:47:12,025] Trial 85 finished with value: 0.1283333333333333 and parameters: {'boosting_type': 'gbdt', 'num_leaves': 172, 'learning_rate': 0.21288309296397057, 'n_estimators': 947, 'max_depth': 7, 'subsample': 0.6630053159845228, 'colsample_bytree': 0.591682780965755, 'reg_alpha': 0.1672647680846949, 'reg_lambda': 0.8550062472423812}. Best is trial 1 with value: 0.1233333333333333.
[I 2024-10-22 10:47:12,205] Trial 86 finished with value: 0.1433333333333333 and parameters: {'boosting_type': 'gbdt', 'num_leaves': 89, 'learning_rate': 0.12722890798113606, 'n_estimators': 857, 'max_depth': 2, 'subsample': 0.6947849900849582, 'colsample_bytree': 0.5297054100346249, 'reg_alpha': 0.4786194255322267, 'reg_lambda': 0.4048979836131163}. Best is trial 1 with value: 0.1233333333333333.
[I 2024-10-22 10:47:13,595] Trial 87 finished with value: 0.1316666666666667 and parameters: {'boosting_type': 'dart', 'num_leaves': 147, 'learning_rate': 0.24653788332753415, 'n_estimators': 917, 'max_depth': 6, 'subsample': 0.8296244440421963, 'colsample_bytree': 0.8142149352704471, 'reg_alpha': 0.21727235378586046, 'reg_lambda': 0.5199840534083593}. Best is trial 1 with value: 0.1233333333333333.
[I 2024-10-22 10:47:13,765] Trial 88 finished with value: 0.1283333333333333 and parameters: {'boosting_type': 'gbdt', 'num_leaves': 21, 'learning_rate': 0.1944645977049116, 'n_estimators': 330, 'max_depth': 8, 'subsample': 0.8631845539104964, 'colsample_bytree': 0.5609751075433315, 'reg_alpha': 0.9262326668089796, 'reg_lambda': 0.5593129943690613}. Best is trial 1 with value: 0.1233333333333333.
[I 2024-10-22 10:47:14,986] Trial 89 finished with value: 0.13666666666666671 and parameters: {'boosting_type': 'dart', 'num_leaves': 10, 'learning_rate': 0.06119760671454927, 'n_estimators': 994, 'max_depth': 10, 'subsample': 0.5678383458595597, 'colsample_bytree': 0.5394775309629604, 'reg_alpha': 0.3267245418621166, 'reg_lambda': 0.4346383411278304}. Best is trial 1 with value: 0.1233333333333333.
[I 2024-10-22 10:47:15,184] Trial 90 finished with value: 0.13666666666666671 and parameters: {'boosting_type': 'gbdt', 'num_leaves': 106, 'learning_rate': 0.29341472477103414, 'n_estimators': 814, 'max_depth': 9, 'subsample': 0.8101071256741382, 'colsample_bytree': 0.6557504188548952, 'reg_alpha': 0.36434371377346636, 'reg_lambda': 0.2725494191092551}. Best is trial 1 with value: 0.1233333333333333.
[I 2024-10-22 10:47:15,518] Trial 91 finished with value: 0.1333333333333333 and parameters: {'boosting_type': 'gbdt', 'num_leaves': 180, 'learning_rate': 0.1458513254283833, 'n_estimators': 941, 'max_depth': 7, 'subsample': 0.7695355847280557, 'colsample_bytree': 0.581742544004744, 'reg_alpha': 0.4568886498783799, 'reg_lambda': 0.3816038412838353}. Best is trial 1 with value: 0.1233333333333333.
[I 2024-10-22 10:47:15,868] Trial 92 finished with value: 0.125 and parameters: {'boosting_type': 'gbdt', 'num_leaves': 213, 'learning_rate': 0.13573489091965846, 'n_estimators': 898, 'max_depth': 7, 'subsample': 0.7337505262683932, 'colsample_bytree': 0.5022671739349837, 'reg_alpha': 0.41228189263609305, 'reg_lambda': 0.362577257531131}. Best is trial 1 with value: 0.1233333333333333.
[I 2024-10-22 10:47:16,199] Trial 93 finished with value: 0.1266666666666667 and parameters: {'boosting_type': 'gbdt', 'num_leaves': 200, 'learning_rate': 0.12126762532617019, 'n_estimators': 964, 'max_depth': 6, 'subsample': 0.7423509921678829, 'colsample_bytree': 0.5486487175008348, 'reg_alpha': 0.5769296560451243, 'reg_lambda': 0.34763544871769064}. Best is trial 1 with value: 0.1233333333333333.
[I 2024-10-22 10:47:16,451] Trial 94 finished with value: 0.1283333333333333 and parameters: {'boosting_type': 'gbdt', 'num_leaves': 190, 'learning_rate': 0.26503326085448903, 'n_estimators': 931, 'max_depth': 8, 'subsample': 0.7743641612223243, 'colsample_bytree': 0.5746466177591861, 'reg_alpha': 0.5212744086101547, 'reg_lambda': 0.45653403441537427}. Best is trial 1 with value: 0.1233333333333333.
[I 2024-10-22 10:47:16,619] Trial 95 finished with value: 0.13 and parameters: {'boosting_type': 'gbdt', 'num_leaves': 178, 'learning_rate': 0.4940397719687942, 'n_estimators': 879, 'max_depth': 3, 'subsample': 0.7897488014257527, 'colsample_bytree': 0.6091457741141464, 'reg_alpha': 0.6627930185075661, 'reg_lambda': 0.29970698192927414}. Best is trial 1 with value: 0.1233333333333333.
[I 2024-10-22 10:47:16,860] Trial 96 finished with value: 0.1266666666666667 and parameters: {'boosting_type': 'gbdt', 'num_leaves': 165, 'learning_rate': 0.22702550950101627, 'n_estimators': 661, 'max_depth': 7, 'subsample': 0.712947650725004, 'colsample_bytree': 0.5119294498898425, 'reg_alpha': 0.4712014423757709, 'reg_lambda': 0.223359000405251}. Best is trial 1 with value: 0.1233333333333333.
[I 2024-10-22 10:47:18,651] Trial 97 finished with value: 0.1383333333333333 and parameters: {'boosting_type': 'dart', 'num_leaves': 140, 'learning_rate': 0.09218832661810641, 'n_estimators': 971, 'max_depth': 7, 'subsample': 0.7501235937404983, 'colsample_bytree': 0.6326091833743296, 'reg_alpha': 0.43750754563459676, 'reg_lambda': 0.4930489566562354}. Best is trial 1 with value: 0.1233333333333333.
[I 2024-10-22 10:47:19,084] Trial 98 finished with value: 0.1383333333333333 and parameters: {'boosting_type': 'goss', 'num_leaves': 27, 'learning_rate': 0.2005585872661112, 'n_estimators': 856, 'max_depth': 8, 'subsample': 0.5261785613385735, 'colsample_bytree': 0.5882696683775832, 'reg_alpha': 0.29603586049878394, 'reg_lambda': 0.4093596749826041}. Best is trial 1 with value: 0.1233333333333333.
[I 2024-10-22 10:47:19,488] Trial 99 finished with value: 0.1283333333333333 and parameters: {'boosting_type': 'gbdt', 'num_leaves': 126, 'learning_rate': 0.16151249146717517, 'n_estimators': 1000, 'max_depth': 6, 'subsample': 0.7595418167215002, 'colsample_bytree': 0.6471940107350952, 'reg_alpha': 0.05198574420015675, 'reg_lambda': 0.3382942568171588}. Best is trial 1 with value: 0.1233333333333333.
