[I 2024-10-22 10:46:25,776] A new study created in memory with name: no-name-6104daa8-68b2-4f2d-98a5-3709209744f4
[I 2024-10-22 10:46:25,889] Trial 0 finished with value: 0.15666666666666662 and parameters: {'boosting_type': 'goss', 'num_leaves': 61, 'learning_rate': 0.024051804577436026, 'n_estimators': 425, 'max_depth': 4, 'subsample': 0.6803497925963329, 'colsample_bytree': 0.9425865786441854, 'reg_alpha': 0.8375348894777526, 'reg_lambda': 0.1295984038012018}. Best is trial 0 with value: 0.15666666666666662.
[I 2024-10-22 10:46:26,103] Trial 1 finished with value: 0.1233333333333333 and parameters: {'boosting_type': 'gbdt', 'num_leaves': 189, 'learning_rate': 0.19821350284995848, 'n_estimators': 922, 'max_depth': 7, 'subsample': 0.5965288874796458, 'colsample_bytree': 0.6228864649748422, 'reg_alpha': 0.420041392562877, 'reg_lambda': 0.6847792252695079}. Best is trial 1 with value: 0.1233333333333333.
[I 2024-10-22 10:46:26,282] Trial 2 finished with value: 0.13666666666666671 and parameters: {'boosting_type': 'goss', 'num_leaves': 214, 'learning_rate': 0.4715518317988702, 'n_estimators': 870, 'max_depth': 2, 'subsample': 0.5473952911455965, 'colsample_bytree': 0.5914879077504144, 'reg_alpha': 0.9000023366593604, 'reg_lambda': 0.7325339657387745}. Best is trial 1 with value: 0.1233333333333333.
[I 2024-10-22 10:46:26,323] Trial 3 finished with value: 0.14833333333333332 and parameters: {'boosting_type': 'dart', 'num_leaves': 160, 'learning_rate': 0.4339576050715498, 'n_estimators': 121, 'max_depth': 3, 'subsample': 0.8282091015843842, 'colsample_bytree': 0.7662524274534857, 'reg_alpha': 0.796813241517048, 'reg_lambda': 0.7633986283739654}. Best is trial 1 with value: 0.1233333333333333.
[I 2024-10-22 10:46:26,374] Trial 4 finished with value: 0.21666666666666667 and parameters: {'boosting_type': 'gbdt', 'num_leaves': 70, 'learning_rate': 0.05021672930339682, 'n_estimators': 466, 'max_depth': 1, 'subsample': 0.8108237677958401, 'colsample_bytree': 0.924585048174503, 'reg_alpha': 0.09212218405319239, 'reg_lambda': 0.7908020892255965}. Best is trial 1 with value: 0.1233333333333333.
[I 2024-10-22 10:46:26,456] Trial 5 finished with value: 0.18666666666666665 and parameters: {'boosting_type': 'dart', 'num_leaves': 252, 'learning_rate': 0.16076652497483074, 'n_estimators': 287, 'max_depth': 2, 'subsample': 0.7119826482789844, 'colsample_bytree': 0.8838706896644454, 'reg_alpha': 0.27446371389233126, 'reg_lambda': 0.9274279832051469}. Best is trial 1 with value: 0.1233333333333333.
[I 2024-10-22 10:46:26,523] Trial 6 finished with value: 0.13 and parameters: {'boosting_type': 'gbdt', 'num_leaves': 43, 'learning_rate': 0.4210306496429064, 'n_estimators': 182, 'max_depth': 5, 'subsample': 0.9400444665062626, 'colsample_bytree': 0.9745789844541896, 'reg_alpha': 0.2211285108789559, 'reg_lambda': 0.5653890866107463}. Best is trial 1 with value: 0.1233333333333333.
[I 2024-10-22 10:46:26,602] Trial 7 finished with value: 0.15166666666666662 and parameters: {'boosting_type': 'gbdt', 'num_leaves': 138, 'learning_rate': 0.03685523964736919, 'n_estimators': 121, 'max_depth': 9, 'subsample': 0.9953357981327249, 'colsample_bytree': 0.6494279332831648, 'reg_alpha': 0.8666284270900503, 'reg_lambda': 0.6451491427766736}. Best is trial 1 with value: 0.1233333333333333.
[I 2024-10-22 10:46:26,616] Trial 8 finished with value: 0.245 and parameters: {'boosting_type': 'gbdt', 'num_leaves': 181, 'learning_rate': 0.31675712418579755, 'n_estimators': 29, 'max_depth': 1, 'subsample': 0.5569668903317898, 'colsample_bytree': 0.6470632567379654, 'reg_alpha': 0.6132024644756052, 'reg_lambda': 0.0883159461322065}. Best is trial 1 with value: 0.1233333333333333.
[I 2024-10-22 10:46:26,875] Trial 9 finished with value: 0.135 and parameters: {'boosting_type': 'gbdt', 'num_leaves': 167, 'learning_rate': 0.09058653569692975, 'n_estimators': 864, 'max_depth': -1, 'subsample': 0.8990853571187394, 'colsample_bytree': 0.898835738612729, 'reg_alpha': 0.8357142353061492, 'reg_lambda': 0.5207060739479117}. Best is trial 1 with value: 0.1233333333333333.
[I 2024-10-22 10:46:27,981] Trial 10 finished with value: 0.1266666666666667 and parameters: {'boosting_type': 'dart', 'num_leaves': 97, 'learning_rate': 0.23087591486141315, 'n_estimators': 689, 'max_depth': 8, 'subsample': 0.6305043449176093, 'colsample_bytree': 0.5386222738370835, 'reg_alpha': 0.46724445530512715, 'reg_lambda': 0.33578996998537336}. Best is trial 1 with value: 0.1233333333333333.
[I 2024-10-22 10:46:29,110] Trial 11 finished with value: 0.1316666666666667 and parameters: {'boosting_type': 'dart', 'num_leaves': 97, 'learning_rate': 0.23739216859578563, 'n_estimators': 690, 'max_depth': 8, 'subsample': 0.6319816364309626, 'colsample_bytree': 0.5374181249767991, 'reg_alpha': 0.4708730173855608, 'reg_lambda': 0.3172023838505644}. Best is trial 1 with value: 0.1233333333333333.
[I 2024-10-22 10:46:30,822] Trial 12 finished with value: 0.13 and parameters: {'boosting_type': 'dart', 'num_leaves': 110, 'learning_rate': 0.20744242172593125, 'n_estimators': 987, 'max_depth': 7, 'subsample': 0.6183768882548756, 'colsample_bytree': 0.5130168279771163, 'reg_alpha': 0.503996149234354, 'reg_lambda': 0.36454689878368174}. Best is trial 1 with value: 0.1233333333333333.
[I 2024-10-22 10:46:31,564] Trial 13 finished with value: 0.125 and parameters: {'boosting_type': 'dart', 'num_leaves': 14, 'learning_rate': 0.32192318109447665, 'n_estimators': 658, 'max_depth': 10, 'subsample': 0.5195514181406538, 'colsample_bytree': 0.7425169702721213, 'reg_alpha': 0.35619866950685075, 'reg_lambda': 0.33871895393051865}. Best is trial 1 with value: 0.1233333333333333.
[I 2024-10-22 10:46:31,785] Trial 14 finished with value: 0.135 and parameters: {'boosting_type': 'goss', 'num_leaves': 9, 'learning_rate': 0.3317218966631099, 'n_estimators': 633, 'max_depth': 10, 'subsample': 0.53325880256004, 'colsample_bytree': 0.7645363808685202, 'reg_alpha': 0.30904469887246633, 'reg_lambda': 0.9861103248124985}. Best is trial 1 with value: 0.1233333333333333.
[I 2024-10-22 10:46:32,151] Trial 15 finished with value: 0.13 and parameters: {'boosting_type': 'gbdt', 'num_leaves': 209, 'learning_rate': 0.3364717383561356, 'n_estimators': 798, 'max_depth': 6, 'subsample': 0.5029058537882721, 'colsample_bytree': 0.6895820098675541, 'reg_alpha': 0.013818385561179092, 'reg_lambda': 0.44082390178546216}. Best is trial 1 with value: 0.1233333333333333.
[I 2024-10-22 10:46:32,518] Trial 16 finished with value: 0.18833333333333335 and parameters: {'boosting_type': 'dart', 'num_leaves': 2, 'learning_rate': 0.15097769121281263, 'n_estimators': 970, 'max_depth': 10, 'subsample': 0.5777779422214587, 'colsample_bytree': 0.837905049422007, 'reg_alpha': 0.6429336289590453, 'reg_lambda': 0.22812841277537355}. Best is trial 1 with value: 0.1233333333333333.
[I 2024-10-22 10:46:32,725] Trial 17 finished with value: 0.1283333333333333 and parameters: {'boosting_type': 'gbdt', 'num_leaves': 228, 'learning_rate': 0.2882070710991002, 'n_estimators': 595, 'max_depth': 7, 'subsample': 0.7654893008224571, 'colsample_bytree': 0.7013894680029089, 'reg_alpha': 0.36844500454955637, 'reg_lambda': 0.6341281333352561}. Best is trial 1 with value: 0.1233333333333333.
[I 2024-10-22 10:46:34,347] Trial 18 finished with value: 0.1283333333333333 and parameters: {'boosting_type': 'dart', 'num_leaves': 138, 'learning_rate': 0.38343040358631797, 'n_estimators': 796, 'max_depth': 9, 'subsample': 0.68236302479141, 'colsample_bytree': 0.8364614963176717, 'reg_alpha': 0.15138258107972352, 'reg_lambda': 0.19654093614299578}. Best is trial 1 with value: 0.1233333333333333.
[I 2024-10-22 10:46:34,522] Trial 19 finished with value: 0.14166666666666672 and parameters: {'boosting_type': 'goss', 'num_leaves': 24, 'learning_rate': 0.11463213035619857, 'n_estimators': 375, 'max_depth': 6, 'subsample': 0.5967306907900849, 'colsample_bytree': 0.6183840825433244, 'reg_alpha': 0.6089093160798412, 'reg_lambda': 0.00894755605053732}. Best is trial 1 with value: 0.1233333333333333.
[I 2024-10-22 10:46:35,502] Trial 20 finished with value: 0.1316666666666667 and parameters: {'boosting_type': 'dart', 'num_leaves': 186, 'learning_rate': 0.18531181955202897, 'n_estimators': 574, 'max_depth': 9, 'subsample': 0.6691047237033109, 'colsample_bytree': 0.7086122441651905, 'reg_alpha': 0.3543057767384651, 'reg_lambda': 0.44524305856807367}. Best is trial 1 with value: 0.1233333333333333.
[I 2024-10-22 10:46:36,710] Trial 21 finished with value: 0.1283333333333333 and parameters: {'boosting_type': 'dart', 'num_leaves': 82, 'learning_rate': 0.2560385415688672, 'n_estimators': 729, 'max_depth': 8, 'subsample': 0.5064724073402465, 'colsample_bytree': 0.5604515343242934, 'reg_alpha': 0.4492222284154613, 'reg_lambda': 0.3398150083627857}. Best is trial 1 with value: 0.1233333333333333.
[I 2024-10-22 10:46:37,455] Trial 22 finished with value: 0.13 and parameters: {'boosting_type': 'dart', 'num_leaves': 108, 'learning_rate': 0.2574119690623401, 'n_estimators': 554, 'max_depth': 8, 'subsample': 0.6284114884338033, 'colsample_bytree': 0.5777435998078301, 'reg_alpha': 0.5452347887537126, 'reg_lambda': 0.2598577396299555}. Best is trial 1 with value: 0.1233333333333333.
[I 2024-10-22 10:46:39,156] Trial 23 finished with value: 0.1233333333333333 and parameters: {'boosting_type': 'dart', 'num_leaves': 39, 'learning_rate': 0.21455428032183396, 'n_estimators': 888, 'max_depth': 10, 'subsample': 0.5851368642122725, 'colsample_bytree': 0.5053602506276409, 'reg_alpha': 0.4106596157384149, 'reg_lambda': 0.4603309970571921}. Best is trial 1 with value: 0.1233333333333333.
[I 2024-10-22 10:46:40,708] Trial 24 finished with value: 0.1266666666666667 and parameters: {'boosting_type': 'dart', 'num_leaves': 37, 'learning_rate': 0.3734079274253226, 'n_estimators': 907, 'max_depth': 10, 'subsample': 0.5612655603844777, 'colsample_bytree': 0.5116229583254095, 'reg_alpha': 0.7277550110283614, 'reg_lambda': 0.5681672460194575}. Best is trial 1 with value: 0.1233333333333333.
[I 2024-10-22 10:46:40,853] Trial 25 finished with value: 0.14 and parameters: {'boosting_type': 'gbdt', 'num_leaves': 55, 'learning_rate': 0.29604291820926476, 'n_estimators': 786, 'max_depth': 10, 'subsample': 0.7376028256875712, 'colsample_bytree': 0.6219495138341711, 'reg_alpha': 0.9969349318547148, 'reg_lambda': 0.8656318294133458}. Best is trial 1 with value: 0.1233333333333333.
[I 2024-10-22 10:46:42,026] Trial 26 finished with value: 0.125 and parameters: {'boosting_type': 'dart', 'num_leaves': 24, 'learning_rate': 0.1341908829109847, 'n_estimators': 930, 'max_depth': 6, 'subsample': 0.5902049766289639, 'colsample_bytree': 0.793248070737304, 'reg_alpha': 0.39755407481382155, 'reg_lambda': 0.4490798741565247}. Best is trial 1 with value: 0.1233333333333333.
[I 2024-10-22 10:46:43,154] Trial 27 finished with value: 0.1333333333333333 and parameters: {'boosting_type': 'dart', 'num_leaves': 23, 'learning_rate': 0.20678252449261667, 'n_estimators': 835, 'max_depth': 7, 'subsample': 0.522615019484945, 'colsample_bytree': 0.726174097563858, 'reg_alpha': 0.2347377247503002, 'reg_lambda': 0.6262548295255765}. Best is trial 1 with value: 0.1233333333333333.
[I 2024-10-22 10:46:43,478] Trial 28 finished with value: 0.13 and parameters: {'boosting_type': 'goss', 'num_leaves': 80, 'learning_rate': 0.2850729749460568, 'n_estimators': 738, 'max_depth': 9, 'subsample': 0.6532202917450766, 'colsample_bytree': 0.6754986472742044, 'reg_alpha': 0.16640218107786098, 'reg_lambda': 0.7090698611558636}. Best is trial 1 with value: 0.1233333333333333.
[I 2024-10-22 10:46:43,615] Trial 29 finished with value: 0.135 and parameters: {'boosting_type': 'gbdt', 'num_leaves': 54, 'learning_rate': 0.08837203793693221, 'n_estimators': 389, 'max_depth': 4, 'subsample': 0.6929522350754093, 'colsample_bytree': 0.5924136657278652, 'reg_alpha': 0.42293202121897655, 'reg_lambda': 0.415858276409742}. Best is trial 1 with value: 0.1233333333333333.
[I 2024-10-22 10:46:44,001] Trial 30 finished with value: 0.1316666666666667 and parameters: {'boosting_type': 'goss', 'num_leaves': 154, 'learning_rate': 0.18248905598515364, 'n_estimators': 922, 'max_depth': 9, 'subsample': 0.5976290343882883, 'colsample_bytree': 0.8035548768158953, 'reg_alpha': 0.30978773636631346, 'reg_lambda': 0.15223347482549454}. Best is trial 1 with value: 0.1233333333333333.
[I 2024-10-22 10:46:45,076] Trial 31 finished with value: 0.13666666666666671 and parameters: {'boosting_type': 'dart', 'num_leaves': 23, 'learning_rate': 0.1351554052814852, 'n_estimators': 936, 'max_depth': 5, 'subsample': 0.5942635786845777, 'colsample_bytree': 0.8040956074107878, 'reg_alpha': 0.4156311134466925, 'reg_lambda': 0.4780511723841077}. Best is trial 1 with value: 0.1233333333333333.
[I 2024-10-22 10:46:46,334] Trial 32 finished with value: 0.17500000000000004 and parameters: {'boosting_type': 'dart', 'num_leaves': 44, 'learning_rate': 0.01038733546362712, 'n_estimators': 859, 'max_depth': 6, 'subsample': 0.5446073607141882, 'colsample_bytree': 0.7471578508732437, 'reg_alpha': 0.37741712324828697, 'reg_lambda': 0.5289914993538632}. Best is trial 1 with value: 0.1233333333333333.
[I 2024-10-22 10:46:47,427] Trial 33 finished with value: 0.1316666666666667 and parameters: {'boosting_type': 'dart', 'num_leaves': 15, 'learning_rate': 0.11715982964852885, 'n_estimators': 975, 'max_depth': 5, 'subsample': 0.5665471835750201, 'colsample_bytree': 0.7836538935814863, 'reg_alpha': 0.5567559482268657, 'reg_lambda': 0.3899467876071637}. Best is trial 1 with value: 0.1233333333333333.
[I 2024-10-22 10:46:48,071] Trial 34 finished with value: 0.13 and parameters: {'boosting_type': 'dart', 'num_leaves': 68, 'learning_rate': 0.18588469015253078, 'n_estimators': 907, 'max_depth': 3, 'subsample': 0.535489833088322, 'colsample_bytree': 0.8398803693304902, 'reg_alpha': 0.6996912411357121, 'reg_lambda': 0.6932010330418495}. Best is trial 1 with value: 0.1233333333333333.
[I 2024-10-22 10:46:48,690] Trial 35 finished with value: 0.13 and parameters: {'boosting_type': 'dart', 'num_leaves': 34, 'learning_rate': 0.4756588777383164, 'n_estimators': 507, 'max_depth': 7, 'subsample': 0.7679774916330807, 'colsample_bytree': 0.7290829803285899, 'reg_alpha': 0.5352957392731847, 'reg_lambda': 0.28026705072748925}. Best is trial 1 with value: 0.1233333333333333.
[I 2024-10-22 10:46:49,520] Trial 36 finished with value: 0.1333333333333333 and parameters: {'boosting_type': 'dart', 'num_leaves': 206, 'learning_rate': 0.06952052388381069, 'n_estimators': 660, 'max_depth': 6, 'subsample': 0.6552159327584464, 'colsample_bytree': 0.8742034104956898, 'reg_alpha': 0.3102465560165607, 'reg_lambda': 0.8488304861894895}. Best is trial 1 with value: 0.1233333333333333.
[I 2024-10-22 10:46:49,690] Trial 37 finished with value: 0.13 and parameters: {'boosting_type': 'gbdt', 'num_leaves': 248, 'learning_rate': 0.37103370065620106, 'n_estimators': 742, 'max_depth': 3, 'subsample': 0.582609138866298, 'colsample_bytree': 0.6615280898765431, 'reg_alpha': 0.2375737913729027, 'reg_lambda': 0.5838978012830243}. Best is trial 1 with value: 0.1233333333333333.
[I 2024-10-22 10:46:49,987] Trial 38 finished with value: 0.1383333333333333 and parameters: {'boosting_type': 'goss', 'num_leaves': 59, 'learning_rate': 0.1593009660255795, 'n_estimators': 999, 'max_depth': 4, 'subsample': 0.8716103492346334, 'colsample_bytree': 0.9973707989073202, 'reg_alpha': 0.39727627272347343, 'reg_lambda': 0.7878622501118995}. Best is trial 1 with value: 0.1233333333333333.
[I 2024-10-22 10:46:50,294] Trial 39 finished with value: 0.125 and parameters: {'boosting_type': 'gbdt', 'num_leaves': 128, 'learning_rate': 0.2224145338290994, 'n_estimators': 844, 'max_depth': 8, 'subsample': 0.7223513634458036, 'colsample_bytree': 0.6236048753382569, 'reg_alpha': 0.14302453858748176, 'reg_lambda': 0.47366772193974027}. Best is trial 1 with value: 0.1233333333333333.
[I 2024-10-22 10:46:50,778] Trial 40 finished with value: 0.1283333333333333 and parameters: {'boosting_type': 'dart', 'num_leaves': 4, 'learning_rate': 0.44672780550703295, 'n_estimators': 901, 'max_depth': 10, 'subsample': 0.6108107363977928, 'colsample_bytree': 0.9380732988844244, 'reg_alpha': 0.4992019599433307, 'reg_lambda': 0.5214091802688277}. Best is trial 1 with value: 0.1233333333333333.
[I 2024-10-22 10:46:51,106] Trial 41 finished with value: 0.125 and parameters: {'boosting_type': 'gbdt', 'num_leaves': 128, 'learning_rate': 0.2276115284061051, 'n_estimators': 831, 'max_depth': 8, 'subsample': 0.8063238440942854, 'colsample_bytree': 0.6047386973641432, 'reg_alpha': 0.09882570490628209, 'reg_lambda': 0.47369180242982223}. Best is trial 1 with value: 0.1233333333333333.
[I 2024-10-22 10:46:51,321] Trial 42 finished with value: 0.1283333333333333 and parameters: {'boosting_type': 'gbdt', 'num_leaves': 196, 'learning_rate': 0.2649432831861483, 'n_estimators': 866, 'max_depth': 7, 'subsample': 0.7161549691165756, 'colsample_bytree': 0.6374196996175279, 'reg_alpha': 0.2780830357378048, 'reg_lambda': 0.3999660963053038}. Best is trial 1 with value: 0.1233333333333333.
[I 2024-10-22 10:46:51,600] Trial 43 finished with value: 0.1283333333333333 and parameters: {'boosting_type': 'gbdt', 'num_leaves': 231, 'learning_rate': 0.22780066270883226, 'n_estimators': 781, 'max_depth': 9, 'subsample': 0.5518086512470983, 'colsample_bytree': 0.5389556560446154, 'reg_alpha': 0.34624885723365645, 'reg_lambda': 0.4816742640969117}. Best is trial 1 with value: 0.1233333333333333.
[I 2024-10-22 10:46:51,957] Trial 44 finished with value: 0.1266666666666667 and parameters: {'boosting_type': 'gbdt', 'num_leaves': 172, 'learning_rate': 0.20522085178356114, 'n_estimators': 951, 'max_depth': 8, 'subsample': 0.6484016840028416, 'colsample_bytree': 0.5666798478348493, 'reg_alpha': 0.1770084766905574, 'reg_lambda': 0.2815345459582518}. Best is trial 1 with value: 0.1233333333333333.
[I 2024-10-22 10:46:52,181] Trial 45 finished with value: 0.1266666666666667 and parameters: {'boosting_type': 'gbdt', 'num_leaves': 46, 'learning_rate': 0.13614797013120017, 'n_estimators': 283, 'max_depth': 10, 'subsample': 0.5170037259258445, 'colsample_bytree': 0.502199074611727, 'reg_alpha': 0.008302300319589118, 'reg_lambda': 0.6007663874010548}. Best is trial 1 with value: 0.1233333333333333.
[I 2024-10-22 10:46:52,520] Trial 46 finished with value: 0.1283333333333333 and parameters: {'boosting_type': 'gbdt', 'num_leaves': 146, 'learning_rate': 0.31580265550226866, 'n_estimators': 830, 'max_depth': 6, 'subsample': 0.9523951151399191, 'colsample_bytree': 0.781536708152167, 'reg_alpha': 0.06013733481042016, 'reg_lambda': 0.6815021989821444}. Best is trial 1 with value: 0.1233333333333333.
[I 2024-10-22 10:46:53,389] Trial 47 finished with value: 0.13 and parameters: {'boosting_type': 'dart', 'num_leaves': 121, 'learning_rate': 0.18676326190494535, 'n_estimators': 695, 'max_depth': 5, 'subsample': 0.701574252383107, 'colsample_bytree': 0.6734689622724895, 'reg_alpha': 0.45458051742720557, 'reg_lambda': 0.5381714881541889}. Best is trial 1 with value: 0.1233333333333333.
[I 2024-10-22 10:46:53,703] Trial 48 finished with value: 0.1233333333333333 and parameters: {'boosting_type': 'gbdt', 'num_leaves': 32, 'learning_rate': 0.2768662047111239, 'n_estimators': 888, 'max_depth': 0, 'subsample': 0.8344484378050518, 'colsample_bytree': 0.541516107179533, 'reg_alpha': 0.20338494123391568, 'reg_lambda': 0.348749933737063}. Best is trial 1 with value: 0.1233333333333333.
[I 2024-10-22 10:46:54,060] Trial 49 finished with value: 0.15333333333333332 and parameters: {'boosting_type': 'dart', 'num_leaves': 28, 'learning_rate': 0.34714620223335274, 'n_estimators': 901, 'max_depth': 1, 'subsample': 0.8366930283110245, 'colsample_bytree': 0.535717075703795, 'reg_alpha': 0.26316793077893497, 'reg_lambda': 0.3181393549079914}. Best is trial 1 with value: 0.1233333333333333.
[I 2024-10-22 10:46:54,243] Trial 50 finished with value: 0.13 and parameters: {'boosting_type': 'gbdt', 'num_leaves': 14, 'learning_rate': 0.3960872327538092, 'n_estimators': 461, 'max_depth': -1, 'subsample': 0.9013110048561056, 'colsample_bytree': 0.5562219575794369, 'reg_alpha': 0.19583726410753297, 'reg_lambda': 0.20543204370583112}. Best is trial 1 with value: 0.1233333333333333.
[I 2024-10-22 10:46:54,577] Trial 51 finished with value: 0.125 and parameters: {'boosting_type': 'gbdt', 'num_leaves': 87, 'learning_rate': 0.27067296472231855, 'n_estimators': 952, 'max_depth': 7, 'subsample': 0.7867039456325298, 'colsample_bytree': 0.5268086235177016, 'reg_alpha': 0.12510143861772294, 'reg_lambda': 0.3660486322788299}. Best is trial 1 with value: 0.1233333333333333.
[I 2024-10-22 10:46:54,759] Trial 52 finished with value: 0.135 and parameters: {'boosting_type': 'gbdt', 'num_leaves': 69, 'learning_rate': 0.24494106072979746, 'n_estimators': 876, 'max_depth': 2, 'subsample': 0.8452062689003754, 'colsample_bytree': 0.583874255991052, 'reg_alpha': 0.34141705072649287, 'reg_lambda': 0.42471997916691595}. Best is trial 1 with value: 0.1233333333333333.
[I 2024-10-22 10:46:55,027] Trial 53 finished with value: 0.1283333333333333 and parameters: {'boosting_type': 'gbdt', 'num_leaves': 36, 'learning_rate': 0.31255919315809966, 'n_estimators': 762, 'max_depth': 0, 'subsample': 0.7448469346531472, 'colsample_bytree': 0.6411717462004253, 'reg_alpha': 0.07155408862545659, 'reg_lambda': 0.4535512870767331}. Best is trial 1 with value: 0.1233333333333333.
[I 2024-10-22 10:46:55,267] Trial 54 finished with value: 0.1283333333333333 and parameters: {'boosting_type': 'gbdt', 'num_leaves': 15, 'learning_rate': 0.2178997742381423, 'n_estimators': 825, 'max_depth': 0, 'subsample': 0.5693217919593387, 'colsample_bytree': 0.6130100837278787, 'reg_alpha': 0.20875162035042993, 'reg_lambda': 0.38646829197348975}. Best is trial 1 with value: 0.1233333333333333.
