[I 2024-12-15 13:48:13,635] A new study created in memory with name: no-name-21876032-fde3-4030-9553-2d2739d503fd
[I 2024-12-15 13:48:14,152] Trial 0 finished with value: 0.14 and parameters: {'boosting_type': 'dart', 'num_leaves': 8, 'learning_rate': 0.3244728157621108, 'n_estimators': 847, 'max_depth': 2, 'subsample': 0.7803638995503817, 'colsample_bytree': 0.9461540953396359, 'reg_alpha': 0.07741628523735344, 'reg_lambda': 0.6146414296570615}. Best is trial 0 with value: 0.14.
[I 2024-12-15 13:48:14,175] Trial 1 finished with value: 0.18500000000000005 and parameters: {'boosting_type': 'dart', 'num_leaves': 225, 'learning_rate': 0.35558544573850714, 'n_estimators': 54, 'max_depth': 2, 'subsample': 0.9808679727415547, 'colsample_bytree': 0.751960171626531, 'reg_alpha': 0.9676593956184515, 'reg_lambda': 0.8553720083972343}. Best is trial 0 with value: 0.14.
[I 2024-12-15 13:48:14,620] Trial 2 finished with value: 0.125 and parameters: {'boosting_type': 'goss', 'num_leaves': 124, 'learning_rate': 0.33273400445785345, 'n_estimators': 597, 'max_depth': 10, 'subsample': 0.98733267916907, 'colsample_bytree': 0.5575221530360563, 'reg_alpha': 0.015938861219887412, 'reg_lambda': 0.26651332434282626}. Best is trial 2 with value: 0.125.
[I 2024-12-15 13:48:15,462] Trial 3 finished with value: 0.1266666666666667 and parameters: {'boosting_type': 'dart', 'num_leaves': 243, 'learning_rate': 0.2587000573872095, 'n_estimators': 962, 'max_depth': 3, 'subsample': 0.6503479799681293, 'colsample_bytree': 0.8467257382348266, 'reg_alpha': 0.001534971560689824, 'reg_lambda': 0.24071335710053454}. Best is trial 2 with value: 0.125.
[I 2024-12-15 13:48:15,638] Trial 4 finished with value: 0.1466666666666666 and parameters: {'boosting_type': 'goss', 'num_leaves': 56, 'learning_rate': 0.20072085221025973, 'n_estimators': 604, 'max_depth': 3, 'subsample': 0.9159213443525505, 'colsample_bytree': 0.5140342449724324, 'reg_alpha': 0.7198918778623905, 'reg_lambda': 0.0878734950280794}. Best is trial 2 with value: 0.125.
[I 2024-12-15 13:48:16,071] Trial 5 finished with value: 0.1333333333333333 and parameters: {'boosting_type': 'goss', 'num_leaves': 92, 'learning_rate': 0.15167829545073577, 'n_estimators': 764, 'max_depth': -1, 'subsample': 0.5569927219321048, 'colsample_bytree': 0.7162995697864729, 'reg_alpha': 0.9095914702580059, 'reg_lambda': 0.7130627671451528}. Best is trial 2 with value: 0.125.
[I 2024-12-15 13:48:16,163] Trial 6 finished with value: 0.13 and parameters: {'boosting_type': 'gbdt', 'num_leaves': 90, 'learning_rate': 0.1138437399025043, 'n_estimators': 227, 'max_depth': 4, 'subsample': 0.7791522404477522, 'colsample_bytree': 0.9587124705659709, 'reg_alpha': 0.8501503586906441, 'reg_lambda': 0.36602881425339673}. Best is trial 2 with value: 0.125.
[I 2024-12-15 13:48:17,814] Trial 7 finished with value: 0.1316666666666667 and parameters: {'boosting_type': 'dart', 'num_leaves': 79, 'learning_rate': 0.20637279776429418, 'n_estimators': 569, 'max_depth': -1, 'subsample': 0.7458428417346945, 'colsample_bytree': 0.5152957129369613, 'reg_alpha': 0.3286995824771418, 'reg_lambda': 0.033438858317078934}. Best is trial 2 with value: 0.125.
[I 2024-12-15 13:48:18,143] Trial 8 finished with value: 0.1466666666666666 and parameters: {'boosting_type': 'dart', 'num_leaves': 131, 'learning_rate': 0.2101396178936486, 'n_estimators': 499, 'max_depth': 3, 'subsample': 0.8412177270338879, 'colsample_bytree': 0.8824736030350954, 'reg_alpha': 0.18957225514818343, 'reg_lambda': 0.5624973703067705}. Best is trial 2 with value: 0.125.
[I 2024-12-15 13:48:18,372] Trial 9 finished with value: 0.1383333333333333 and parameters: {'boosting_type': 'gbdt', 'num_leaves': 66, 'learning_rate': 0.04324749762956433, 'n_estimators': 148, 'max_depth': -1, 'subsample': 0.5118803145597646, 'colsample_bytree': 0.9085951943440131, 'reg_alpha': 0.25381979527829124, 'reg_lambda': 0.61806331959361}. Best is trial 2 with value: 0.125.
[I 2024-12-15 13:48:18,585] Trial 10 finished with value: 0.14166666666666672 and parameters: {'boosting_type': 'goss', 'num_leaves': 172, 'learning_rate': 0.46354529823243207, 'n_estimators': 319, 'max_depth': 10, 'subsample': 0.9976358024967562, 'colsample_bytree': 0.6245900616487523, 'reg_alpha': 0.5337562707505588, 'reg_lambda': 0.3602613877326049}. Best is trial 2 with value: 0.125.
[I 2024-12-15 13:48:19,229] Trial 11 finished with value: 0.1333333333333333 and parameters: {'boosting_type': 'goss', 'num_leaves': 252, 'learning_rate': 0.30527772159992633, 'n_estimators': 996, 'max_depth': 8, 'subsample': 0.6396959462177056, 'colsample_bytree': 0.8008087586179358, 'reg_alpha': 0.0067152893061974694, 'reg_lambda': 0.209277750098565}. Best is trial 2 with value: 0.125.
[I 2024-12-15 13:48:21,117] Trial 12 finished with value: 0.13 and parameters: {'boosting_type': 'dart', 'num_leaves': 176, 'learning_rate': 0.42183002383825674, 'n_estimators': 996, 'max_depth': 6, 'subsample': 0.6730633993646864, 'colsample_bytree': 0.6357748835179553, 'reg_alpha': 0.41712164252659456, 'reg_lambda': 0.2868757551508897}. Best is trial 2 with value: 0.125.
[I 2024-12-15 13:48:21,502] Trial 13 finished with value: 0.1266666666666667 and parameters: {'boosting_type': 'goss', 'num_leaves': 155, 'learning_rate': 0.3859236153591991, 'n_estimators': 726, 'max_depth': 6, 'subsample': 0.6251982465657131, 'colsample_bytree': 0.8243378958631269, 'reg_alpha': 0.11816393494076852, 'reg_lambda': 0.19469386108211384}. Best is trial 2 with value: 0.125.
[I 2024-12-15 13:48:21,961] Trial 14 finished with value: 0.1283333333333333 and parameters: {'boosting_type': 'gbdt', 'num_leaves': 195, 'learning_rate': 0.2742612740293485, 'n_estimators': 428, 'max_depth': 10, 'subsample': 0.7028397855096858, 'colsample_bytree': 0.6294867453817788, 'reg_alpha': 0.001202691916840748, 'reg_lambda': 0.4429951569090221}. Best is trial 2 with value: 0.125.
[I 2024-12-15 13:48:23,606] Trial 15 finished with value: 0.13 and parameters: {'boosting_type': 'dart', 'num_leaves': 125, 'learning_rate': 0.4915229262841361, 'n_estimators': 842, 'max_depth': 7, 'subsample': 0.8628314607993403, 'colsample_bytree': 0.7250246437871588, 'reg_alpha': 0.5892009204095017, 'reg_lambda': 0.14609499389667846}. Best is trial 2 with value: 0.125.
[I 2024-12-15 13:48:23,756] Trial 16 finished with value: 0.15666666666666662 and parameters: {'boosting_type': 'goss', 'num_leaves': 209, 'learning_rate': 0.2763021778309785, 'n_estimators': 651, 'max_depth': 1, 'subsample': 0.5784483406304874, 'colsample_bytree': 0.8322682695476153, 'reg_alpha': 0.29593263814039006, 'reg_lambda': 0.3121731934519085}. Best is trial 2 with value: 0.125.
[I 2024-12-15 13:48:23,962] Trial 17 finished with value: 0.14 and parameters: {'boosting_type': 'goss', 'num_leaves': 250, 'learning_rate': 0.3995135201353119, 'n_estimators': 400, 'max_depth': 5, 'subsample': 0.8932338593287289, 'colsample_bytree': 0.9960144909397355, 'reg_alpha': 0.16143324352563115, 'reg_lambda': 0.9663894816494222}. Best is trial 2 with value: 0.125.
[I 2024-12-15 13:48:26,168] Trial 18 finished with value: 0.1283333333333333 and parameters: {'boosting_type': 'dart', 'num_leaves': 126, 'learning_rate': 0.24325048104245767, 'n_estimators': 876, 'max_depth': 8, 'subsample': 0.7207772495608245, 'colsample_bytree': 0.5810254704988587, 'reg_alpha': 0.44049398390767347, 'reg_lambda': 0.47794190842583906}. Best is trial 2 with value: 0.125.
[I 2024-12-15 13:48:26,455] Trial 19 finished with value: 0.1333333333333333 and parameters: {'boosting_type': 'gbdt', 'num_leaves': 30, 'learning_rate': 0.1371716108246043, 'n_estimators': 700, 'max_depth': 9, 'subsample': 0.8177925734098517, 'colsample_bytree': 0.7740372979563005, 'reg_alpha': 0.70817796651374, 'reg_lambda': 0.24338264219829953}. Best is trial 2 with value: 0.125.
[I 2024-12-15 13:48:26,577] Trial 20 finished with value: 0.16500000000000004 and parameters: {'boosting_type': 'goss', 'num_leaves': 149, 'learning_rate': 0.33922308211553015, 'n_estimators': 497, 'max_depth': 1, 'subsample': 0.930704090073857, 'colsample_bytree': 0.6884714680728001, 'reg_alpha': 0.209896501712464, 'reg_lambda': 0.04334674135804506}. Best is trial 2 with value: 0.125.
[I 2024-12-15 13:48:26,904] Trial 21 finished with value: 0.13 and parameters: {'boosting_type': 'goss', 'num_leaves': 158, 'learning_rate': 0.39353857837035405, 'n_estimators': 714, 'max_depth': 5, 'subsample': 0.6302190644106911, 'colsample_bytree': 0.8540038178917009, 'reg_alpha': 0.11122514510156413, 'reg_lambda': 0.17582037271480153}. Best is trial 2 with value: 0.125.
[I 2024-12-15 13:48:27,304] Trial 22 finished with value: 0.1383333333333333 and parameters: {'boosting_type': 'goss', 'num_leaves': 110, 'learning_rate': 0.3538332411878382, 'n_estimators': 777, 'max_depth': 6, 'subsample': 0.6021036390170116, 'colsample_bytree': 0.8159056100276408, 'reg_alpha': 0.07870010293717628, 'reg_lambda': 0.12952772184678624}. Best is trial 2 with value: 0.125.
[I 2024-12-15 13:48:27,652] Trial 23 finished with value: 0.135 and parameters: {'boosting_type': 'goss', 'num_leaves': 217, 'learning_rate': 0.4405910062005358, 'n_estimators': 910, 'max_depth': 4, 'subsample': 0.6451132947216438, 'colsample_bytree': 0.8748897726935477, 'reg_alpha': 0.09439247030863038, 'reg_lambda': 0.39990487950489195}. Best is trial 2 with value: 0.125.
[I 2024-12-15 13:48:28,034] Trial 24 finished with value: 0.1333333333333333 and parameters: {'boosting_type': 'goss', 'num_leaves': 186, 'learning_rate': 0.37707834345586344, 'n_estimators': 581, 'max_depth': 8, 'subsample': 0.5157547403833482, 'colsample_bytree': 0.775971363027967, 'reg_alpha': 0.013335250219063706, 'reg_lambda': 0.25273441489417536}. Best is trial 2 with value: 0.125.
[I 2024-12-15 13:48:29,748] Trial 25 finished with value: 0.13 and parameters: {'boosting_type': 'dart', 'num_leaves': 237, 'learning_rate': 0.2914410259518491, 'n_estimators': 921, 'max_depth': 6, 'subsample': 0.5705747908457981, 'colsample_bytree': 0.6839427110560414, 'reg_alpha': 0.3517931254586578, 'reg_lambda': 0.0052716111832044055}. Best is trial 2 with value: 0.125.
[I 2024-12-15 13:48:30,256] Trial 26 finished with value: 0.1333333333333333 and parameters: {'boosting_type': 'goss', 'num_leaves': 148, 'learning_rate': 0.25945079047497344, 'n_estimators': 788, 'max_depth': 7, 'subsample': 0.6833850509073205, 'colsample_bytree': 0.5632893716542241, 'reg_alpha': 0.15565054807859557, 'reg_lambda': 0.3031103587160918}. Best is trial 2 with value: 0.125.
[I 2024-12-15 13:48:30,691] Trial 27 finished with value: 0.14166666666666672 and parameters: {'boosting_type': 'goss', 'num_leaves': 109, 'learning_rate': 0.23592111391731724, 'n_estimators': 661, 'max_depth': 9, 'subsample': 0.614356272165744, 'colsample_bytree': 0.9126026283619948, 'reg_alpha': 0.22446607376385905, 'reg_lambda': 0.19068428580499092}. Best is trial 2 with value: 0.125.
[I 2024-12-15 13:48:30,827] Trial 28 finished with value: 0.125 and parameters: {'boosting_type': 'gbdt', 'num_leaves': 204, 'learning_rate': 0.33362759607313264, 'n_estimators': 407, 'max_depth': 3, 'subsample': 0.6693485872355562, 'colsample_bytree': 0.8401802838590721, 'reg_alpha': 0.08868172072304992, 'reg_lambda': 0.1032661784393446}. Best is trial 2 with value: 0.125.
[I 2024-12-15 13:48:30,903] Trial 29 finished with value: 0.15500000000000003 and parameters: {'boosting_type': 'gbdt', 'num_leaves': 205, 'learning_rate': 0.3207168462846128, 'n_estimators': 310, 'max_depth': 1, 'subsample': 0.7823009872644907, 'colsample_bytree': 0.936093560115092, 'reg_alpha': 0.05443598392827382, 'reg_lambda': 0.12155889351149063}. Best is trial 2 with value: 0.125.
[I 2024-12-15 13:48:31,037] Trial 30 finished with value: 0.1283333333333333 and parameters: {'boosting_type': 'gbdt', 'num_leaves': 234, 'learning_rate': 0.3246310353995556, 'n_estimators': 411, 'max_depth': 3, 'subsample': 0.722170177219313, 'colsample_bytree': 0.8611980938447171, 'reg_alpha': 0.0630660728439836, 'reg_lambda': 0.08420755508363281}. Best is trial 2 with value: 0.125.
[I 2024-12-15 13:48:31,164] Trial 31 finished with value: 0.135 and parameters: {'boosting_type': 'gbdt', 'num_leaves': 167, 'learning_rate': 0.3655028945290695, 'n_estimators': 536, 'max_depth': 2, 'subsample': 0.6717849478215415, 'colsample_bytree': 0.8292926254910811, 'reg_alpha': 0.12910235935160863, 'reg_lambda': 0.21670022685552434}. Best is trial 2 with value: 0.125.
[I 2024-12-15 13:48:31,584] Trial 32 finished with value: 0.1316666666666667 and parameters: {'boosting_type': 'dart', 'num_leaves': 193, 'learning_rate': 0.41290019158294833, 'n_estimators': 468, 'max_depth': 4, 'subsample': 0.6618969716560483, 'colsample_bytree': 0.8008221666413051, 'reg_alpha': 0.13691365505007003, 'reg_lambda': 0.3392574326240775}. Best is trial 2 with value: 0.125.
[I 2024-12-15 13:48:31,670] Trial 33 finished with value: 0.1383333333333333 and parameters: {'boosting_type': 'gbdt', 'num_leaves': 228, 'learning_rate': 0.30266050801313704, 'n_estimators': 286, 'max_depth': 2, 'subsample': 0.9536659490594843, 'colsample_bytree': 0.7651967976756309, 'reg_alpha': 0.2825177288510984, 'reg_lambda': 0.07231350890997311}. Best is trial 2 with value: 0.125.
[I 2024-12-15 13:48:31,716] Trial 34 finished with value: 0.19666666666666666 and parameters: {'boosting_type': 'dart', 'num_leaves': 140, 'learning_rate': 0.3515525534739551, 'n_estimators': 17, 'max_depth': 3, 'subsample': 0.6043462272573015, 'colsample_bytree': 0.741900592381531, 'reg_alpha': 0.05983610293268036, 'reg_lambda': 0.4343762123588627}. Best is trial 2 with value: 0.125.
[I 2024-12-15 13:48:31,857] Trial 35 finished with value: 0.135 and parameters: {'boosting_type': 'gbdt', 'num_leaves': 217, 'learning_rate': 0.44577388286555814, 'n_estimators': 626, 'max_depth': 2, 'subsample': 0.5470418756856494, 'colsample_bytree': 0.9053827662530958, 'reg_alpha': 0.001485612647907253, 'reg_lambda': 0.262432222361932}. Best is trial 2 with value: 0.125.
[I 2024-12-15 13:48:32,419] Trial 36 finished with value: 0.1316666666666667 and parameters: {'boosting_type': 'goss', 'num_leaves': 100, 'learning_rate': 0.18088985747589575, 'n_estimators': 829, 'max_depth': 0, 'subsample': 0.7343744351030488, 'colsample_bytree': 0.8489906442414391, 'reg_alpha': 0.1967093898741769, 'reg_lambda': 0.15326111749570964}. Best is trial 2 with value: 0.125.
[I 2024-12-15 13:48:33,500] Trial 37 finished with value: 0.1333333333333333 and parameters: {'boosting_type': 'dart', 'num_leaves': 247, 'learning_rate': 0.33304742042076685, 'n_estimators': 738, 'max_depth': 5, 'subsample': 0.7813555565502107, 'colsample_bytree': 0.9623761778456891, 'reg_alpha': 0.6560635082897213, 'reg_lambda': 0.7348909830945902}. Best is trial 2 with value: 0.125.
[I 2024-12-15 13:48:33,659] Trial 38 finished with value: 0.13666666666666671 and parameters: {'boosting_type': 'gbdt', 'num_leaves': 32, 'learning_rate': 0.3845110946889127, 'n_estimators': 366, 'max_depth': 4, 'subsample': 0.6905600689303852, 'colsample_bytree': 0.7987916409066058, 'reg_alpha': 0.11767568866882464, 'reg_lambda': 0.5208002952874335}. Best is trial 2 with value: 0.125.
[I 2024-12-15 13:48:33,747] Trial 39 finished with value: 0.15666666666666662 and parameters: {'boosting_type': 'goss', 'num_leaves': 182, 'learning_rate': 0.2240835082901113, 'n_estimators': 168, 'max_depth': 3, 'subsample': 0.5410974082196979, 'colsample_bytree': 0.7020853124694221, 'reg_alpha': 0.8341969010100496, 'reg_lambda': 0.0007622166044016776}. Best is trial 2 with value: 0.125.
[I 2024-12-15 13:48:35,509] Trial 40 finished with value: 0.1333333333333333 and parameters: {'boosting_type': 'dart', 'num_leaves': 75, 'learning_rate': 0.04214183480146802, 'n_estimators': 550, 'max_depth': 0, 'subsample': 0.7689154158825783, 'colsample_bytree': 0.8884263450494975, 'reg_alpha': 0.24489024194617182, 'reg_lambda': 0.6382655872511978}. Best is trial 2 with value: 0.125.
[I 2024-12-15 13:48:36,042] Trial 41 finished with value: 0.1266666666666667 and parameters: {'boosting_type': 'gbdt', 'num_leaves': 197, 'learning_rate': 0.2697240099971889, 'n_estimators': 448, 'max_depth': 10, 'subsample': 0.700124996392914, 'colsample_bytree': 0.5424947506085781, 'reg_alpha': 0.027620734111099797, 'reg_lambda': 0.4394865856420144}. Best is trial 2 with value: 0.125.
[I 2024-12-15 13:48:36,601] Trial 42 finished with value: 0.1316666666666667 and parameters: {'boosting_type': 'gbdt', 'num_leaves': 201, 'learning_rate': 0.1771817121550608, 'n_estimators': 477, 'max_depth': 10, 'subsample': 0.6463075461199266, 'colsample_bytree': 0.5255720450645954, 'reg_alpha': 0.04150349093505437, 'reg_lambda': 0.3791910854091596}. Best is trial 2 with value: 0.125.
[I 2024-12-15 13:48:36,911] Trial 43 finished with value: 0.1316666666666667 and parameters: {'boosting_type': 'gbdt', 'num_leaves': 158, 'learning_rate': 0.27109423936892096, 'n_estimators': 355, 'max_depth': 9, 'subsample': 0.703454737122783, 'colsample_bytree': 0.5026806471314285, 'reg_alpha': 0.08747956346712474, 'reg_lambda': 0.10143117281748648}. Best is trial 2 with value: 0.125.
[I 2024-12-15 13:48:37,210] Trial 44 finished with value: 0.1333333333333333 and parameters: {'boosting_type': 'gbdt', 'num_leaves': 220, 'learning_rate': 0.09150334705764868, 'n_estimators': 227, 'max_depth': 10, 'subsample': 0.5852808550422811, 'colsample_bytree': 0.5694069251423276, 'reg_alpha': 0.1735248187797696, 'reg_lambda': 0.2017742036304852}. Best is trial 2 with value: 0.125.
[I 2024-12-15 13:48:37,476] Trial 45 finished with value: 0.1283333333333333 and parameters: {'boosting_type': 'gbdt', 'num_leaves': 164, 'learning_rate': 0.30192647330329575, 'n_estimators': 435, 'max_depth': 7, 'subsample': 0.7490422125039191, 'colsample_bytree': 0.5283988895226636, 'reg_alpha': 0.36797482428497, 'reg_lambda': 0.32861465888132796}. Best is trial 2 with value: 0.125.
[I 2024-12-15 13:48:37,861] Trial 46 finished with value: 0.125 and parameters: {'boosting_type': 'goss', 'num_leaves': 240, 'learning_rate': 0.21581323735816604, 'n_estimators': 543, 'max_depth': 9, 'subsample': 0.8050542287126898, 'colsample_bytree': 0.6596900911064938, 'reg_alpha': 0.03379389004466514, 'reg_lambda': 0.5626557267699628}. Best is trial 2 with value: 0.125.
[I 2024-12-15 13:48:38,285] Trial 47 finished with value: 0.1316666666666667 and parameters: {'boosting_type': 'goss', 'num_leaves': 255, 'learning_rate': 0.18866555498505067, 'n_estimators': 605, 'max_depth': 9, 'subsample': 0.9639515784284803, 'colsample_bytree': 0.6451160360203698, 'reg_alpha': 0.10357291146694639, 'reg_lambda': 0.5751553945121775}. Best is trial 2 with value: 0.125.
[I 2024-12-15 13:48:38,470] Trial 48 finished with value: 0.13 and parameters: {'boosting_type': 'goss', 'num_leaves': 233, 'learning_rate': 0.2163868717699149, 'n_estimators': 528, 'max_depth': 3, 'subsample': 0.8262484953416305, 'colsample_bytree': 0.6621376021471267, 'reg_alpha': 0.049725026847291943, 'reg_lambda': 0.711986944587031}. Best is trial 2 with value: 0.125.
[I 2024-12-15 13:48:38,972] Trial 49 finished with value: 0.1316666666666667 and parameters: {'boosting_type': 'goss', 'num_leaves': 241, 'learning_rate': 0.14627085498371667, 'n_estimators': 661, 'max_depth': 8, 'subsample': 0.8847701170943106, 'colsample_bytree': 0.6092687394671308, 'reg_alpha': 0.17204609457764003, 'reg_lambda': 0.856582139440939}. Best is trial 2 with value: 0.125.
[I 2024-12-15 13:48:39,520] Trial 50 finished with value: 0.13666666666666671 and parameters: {'boosting_type': 'goss', 'num_leaves': 210, 'learning_rate': 0.23838803336648082, 'n_estimators': 953, 'max_depth': 5, 'subsample': 0.9891784167899306, 'colsample_bytree': 0.6027808278566185, 'reg_alpha': 0.2844472505940131, 'reg_lambda': 0.5390591880964677}. Best is trial 2 with value: 0.125.
[I 2024-12-15 13:48:40,851] Trial 51 finished with value: 0.1266666666666667 and parameters: {'boosting_type': 'dart', 'num_leaves': 135, 'learning_rate': 0.2568125390300817, 'n_estimators': 453, 'max_depth': 10, 'subsample': 0.6632578498384842, 'colsample_bytree': 0.5512105249197236, 'reg_alpha': 0.029790424977205042, 'reg_lambda': 0.6552948422753995}. Best is trial 2 with value: 0.125.
[I 2024-12-15 13:48:41,286] Trial 52 finished with value: 0.13666666666666671 and parameters: {'boosting_type': 'goss', 'num_leaves': 191, 'learning_rate': 0.2890737830426016, 'n_estimators': 578, 'max_depth': 9, 'subsample': 0.7029706363128952, 'colsample_bytree': 0.7319832808370662, 'reg_alpha': 0.002725683501590144, 'reg_lambda': 0.4782429773924013}. Best is trial 2 with value: 0.125.
[I 2024-12-15 13:48:41,608] Trial 53 finished with value: 0.13 and parameters: {'boosting_type': 'gbdt', 'num_leaves': 179, 'learning_rate': 0.31603486713132406, 'n_estimators': 364, 'max_depth': 10, 'subsample': 0.6222373322954933, 'colsample_bytree': 0.5469261478676106, 'reg_alpha': 0.0803562887646126, 'reg_lambda': 0.28242171752425194}. Best is trial 2 with value: 0.125.
[I 2024-12-15 13:48:41,976] Trial 54 finished with value: 0.135 and parameters: {'boosting_type': 'goss', 'num_leaves': 117, 'learning_rate': 0.3474094323023417, 'n_estimators': 529, 'max_depth': 9, 'subsample': 0.7996329899395328, 'colsample_bytree': 0.5966794375416432, 'reg_alpha': 0.037826391164974216, 'reg_lambda': 0.44384305270499863}. Best is trial 2 with value: 0.125.
[I 2024-12-15 13:48:43,590] Trial 55 finished with value: 0.13666666666666671 and parameters: {'boosting_type': 'dart', 'num_leaves': 224, 'learning_rate': 0.1980816052014094, 'n_estimators': 695, 'max_depth': 8, 'subsample': 0.8611320660834499, 'colsample_bytree': 0.7898937345570156, 'reg_alpha': 0.5077923547410861, 'reg_lambda': 0.5905493438029106}. Best is trial 2 with value: 0.125.
